,number,value,datetime_start,datetime_complete,duration,params_bagging_temperature,params_boosting_type,params_depth,params_grow_policy,params_iterations,params_l2_leaf_reg,params_learning_rate,params_max_bin,params_random_strength,state
329,329,0.2885322740554374,2023-06-10 16:21:04.169706,2023-06-10 16:21:05.022652,0 days 00:00:00.852946,0.032027390732345166,,7,Lossguide,1008,98.38170218996615,0.10439391396878463,32,98,COMPLETE
330,330,0.4443430619706574,2023-06-10 16:21:05.023381,2023-06-10 16:21:06.002585,0 days 00:00:00.979204,0.07372227366575967,,7,Lossguide,979,0.024127801819340284,0.008877642393299714,32,93,COMPLETE
331,331,0.5051915114858754,2023-06-10 16:21:06.003316,2023-06-10 16:21:06.728536,0 days 00:00:00.725220,0.04853889135988676,,7,Lossguide,1006,0.0043460398373418715,0.022234106179717113,32,96,COMPLETE
332,332,0.3068103565863066,2023-06-10 16:21:06.729284,2023-06-10 16:21:09.975665,0 days 00:00:03.246381,0.5405381391183557,,7,Depthwise,1050,97.70036546077903,0.015271538222433522,32,97,COMPLETE
333,333,0.30206038452083894,2023-06-10 16:21:09.976344,2023-06-10 16:21:11.487120,0 days 00:00:01.510776,0.033145840719622725,,7,Lossguide,1022,26.628247649165534,0.011906145368163434,32,94,COMPLETE
334,334,0.3408023657916648,2023-06-10 16:21:11.487711,2023-06-10 16:21:13.165703,0 days 00:00:01.677992,0.35141252296818737,,6,Lossguide,992,46.906475842180065,0.013921842553075301,5,98,COMPLETE
335,335,0.29805795776887667,2023-06-10 16:21:13.166369,2023-06-10 16:21:14.238988,0 days 00:00:01.072619,0.02380994282983445,,7,Lossguide,1015,46.09377251415738,0.03112213219848968,32,95,COMPLETE
336,336,0.4183060728622044,2023-06-10 16:21:14.239618,2023-06-10 16:21:15.153883,0 days 00:00:00.914265,0.09333657944292488,,7,Lossguide,934,0.029064879245708126,0.007641392586369749,32,98,COMPLETE
337,337,0.3833619650423298,2023-06-10 16:21:15.154507,2023-06-10 16:21:15.893701,0 days 00:00:00.739194,0.0404400350626519,,7,Lossguide,960,0.5719093110520417,0.07069004606566169,32,93,COMPLETE
338,338,0.32559986989629613,2023-06-10 16:21:15.894350,2023-06-10 16:21:16.782458,0 days 00:00:00.888108,0.17079981366562053,,7,Lossguide,907,3.228372332979554,0.02540974187095568,32,96,COMPLETE
339,339,0.2943477354581664,2023-06-10 16:21:16.783240,2023-06-10 16:21:17.903178,0 days 00:00:01.119938,0.06341227705763398,,8,Lossguide,632,68.84759114555187,0.04577864345510925,32,100,COMPLETE
340,340,0.31741971793088264,2023-06-10 16:21:17.903960,2023-06-10 16:21:18.799865,0 days 00:00:00.895905,0.05616665710675749,,8,Lossguide,624,11.653023003332663,0.048768511601133914,32,100,COMPLETE
341,341,0.30677415655215146,2023-06-10 16:21:18.800625,2023-06-10 16:21:19.794600,0 days 00:00:00.993975,0.06391436622585026,,8,Lossguide,944,24.659850318275065,0.03318053231602039,32,100,COMPLETE
342,342,0.30605508751720534,2023-06-10 16:21:19.795455,2023-06-10 16:21:21.053687,0 days 00:00:01.258232,0.07523289286772075,,8,Lossguide,482,67.34692011719665,0.03428505025381856,32,98,COMPLETE
343,343,0.44257532741086725,2023-06-10 16:21:21.054320,2023-06-10 16:21:21.809046,0 days 00:00:00.754726,0.8793165811224413,,9,Lossguide,579,0.0005339844635655855,0.04364367209356677,64,95,COMPLETE
344,344,0.33097166448275445,2023-06-10 16:21:21.809699,2023-06-10 16:21:23.098825,0 days 00:00:01.289126,0.0486356057984259,,8,Lossguide,929,39.950761803992854,0.018008787317172884,10,76,COMPLETE
345,345,0.3015860388053765,2023-06-10 16:21:23.099439,2023-06-10 16:21:23.988087,0 days 00:00:00.888648,0.042876856551666884,,8,Lossguide,551,66.27960575958934,0.07387396318074488,32,98,COMPLETE
346,346,0.3998490374797474,2023-06-10 16:21:23.988731,2023-06-10 16:21:24.710475,0 days 00:00:00.721744,0.06160345377173264,,8,Lossguide,658,0.0974477320276657,0.0397406065670288,32,92,COMPLETE
347,347,0.3979556312014769,2023-06-10 16:21:24.711206,2023-06-10 16:21:25.438569,0 days 00:00:00.727363,0.7401705709366262,,8,Lossguide,316,0.3452777024565816,0.1042504950722295,32,96,COMPLETE
348,348,0.31251664137095786,2023-06-10 16:21:25.439214,2023-06-10 16:21:31.452036,0 days 00:00:06.012822,0.03371686076444348,Ordered,7,SymmetricTree,1000,33.3214387173025,0.05409221417248413,32,100,COMPLETE
349,349,0.359652750372989,2023-06-10 16:21:31.452725,2023-06-10 16:21:32.550035,0 days 00:00:01.097310,1.6792763898819798,,7,Lossguide,654,6.147120943868929,0.027998968429872644,32,28,COMPLETE
350,350,0.36736050922479324,2023-06-10 16:21:32.550890,2023-06-10 16:21:33.585639,0 days 00:00:01.034749,2.1744269556252775,,7,Lossguide,790,15.094736812728078,0.03563336974901149,32,94,COMPLETE
351,351,0.43019238252048764,2023-06-10 16:21:33.586245,2023-06-10 16:21:34.464680,0 days 00:00:00.878435,0.016805585919885214,,8,Lossguide,980,0.05482027861548618,0.008523561672525418,20,98,COMPLETE
352,352,0.407975940777369,2023-06-10 16:21:34.465417,2023-06-10 16:21:35.159111,0 days 00:00:00.693694,1.2282180795964839,,7,Depthwise,771,0.8888346034034592,0.0814409229958396,32,96,COMPLETE
353,353,0.29549163438039283,2023-06-10 16:21:35.159867,2023-06-10 16:21:36.182896,0 days 00:00:01.023029,0.04997543700284852,,7,Lossguide,919,70.33273101721936,0.04500790828342356,32,93,COMPLETE
354,354,0.3582069495989443,2023-06-10 16:21:36.183699,2023-06-10 16:21:37.180205,0 days 00:00:00.996506,0.053593856281254584,,5,Lossguide,917,70.95296850837894,0.04410584317530832,3,92,COMPLETE
355,355,0.29502860374099416,2023-06-10 16:21:37.180976,2023-06-10 16:21:38.324595,0 days 00:00:01.143619,0.07387509655678826,,7,Lossguide,951,94.41388464865894,0.04076082978448444,32,100,COMPLETE
356,356,0.4276396182668548,2023-06-10 16:21:38.325239,2023-06-10 16:21:39.122555,0 days 00:00:00.797316,0.08824599343743268,,7,Lossguide,958,2.051572516961816,0.05179881769926331,4,99,COMPLETE
357,357,0.29916632093874934,2023-06-10 16:21:39.123168,2023-06-10 16:21:40.341817,0 days 00:00:01.218649,0.07167485595238411,,7,Lossguide,969,99.51319027404958,0.03778603317297647,32,100,COMPLETE
358,358,0.30043536906797313,2023-06-10 16:21:40.342422,2023-06-10 16:21:41.371374,0 days 00:00:01.028952,0.10284254510640248,,7,Lossguide,942,98.14633495182822,0.04637907202936443,32,24,COMPLETE
359,359,0.3020322770357247,2023-06-10 16:21:41.372017,2023-06-10 16:21:42.370006,0 days 00:00:00.997989,0.05900287271743091,,7,Lossguide,983,45.9898231469134,0.04331306571784303,32,98,COMPLETE
360,360,0.4180911488141773,2023-06-10 16:21:42.370615,2023-06-10 16:21:43.277285,0 days 00:00:00.906670,0.06632681011113221,,7,Lossguide,952,24.436218843327907,0.03353569370399309,2,100,COMPLETE
361,361,0.2973521654267766,2023-06-10 16:21:43.277973,2023-06-10 16:21:44.254511,0 days 00:00:00.976538,0.0464874442869675,,7,Lossguide,957,49.2232881324909,0.04400607113875401,32,97,COMPLETE
362,362,0.29477405576084326,2023-06-10 16:21:44.255155,2023-06-10 16:21:45.270514,0 days 00:00:01.015359,0.07770723919932634,,7,Lossguide,1004,97.46586605805312,0.0604674400064833,32,100,COMPLETE
363,363,0.5021931956089529,2023-06-10 16:21:45.271126,2023-06-10 16:21:45.989883,0 days 00:00:00.718757,0.10681759262452666,,7,Lossguide,974,0.0015018331998885323,0.04182159272775706,32,100,COMPLETE
364,364,0.4593209216572356,2023-06-10 16:21:45.990507,2023-06-10 16:21:46.709956,0 days 00:00:00.719449,0.06492246635596109,,7,Lossguide,1011,0.00014371519562614307,0.06004402282456456,5,96,COMPLETE
365,365,0.30082521968075315,2023-06-10 16:21:46.710729,2023-06-10 16:21:47.712347,0 days 00:00:01.001618,0.14826011530357616,,7,Lossguide,1044,98.5956381668166,0.04828064616404378,32,100,COMPLETE
366,366,0.3026365630625835,2023-06-10 16:21:47.713107,2023-06-10 16:21:48.584954,0 days 00:00:00.871847,0.08915766121980018,,7,Lossguide,1025,46.81010469286073,0.06755616266993729,32,98,COMPLETE
367,367,0.4556063635625185,2023-06-10 16:21:48.585615,2023-06-10 16:21:49.280115,0 days 00:00:00.694500,0.07189483100062462,,7,Lossguide,983,0.12792014882614586,0.08163925639678025,32,94,COMPLETE
368,368,0.378249363893502,2023-06-10 16:21:49.280783,2023-06-10 16:21:50.383344,0 days 00:00:01.102561,7.716816105287278,,7,Lossguide,996,28.60052526457292,0.05779584916571383,32,97,COMPLETE
369,369,0.32627500778437746,2023-06-10 16:21:50.384414,2023-06-10 16:21:51.451507,0 days 00:00:01.067093,0.6069963919519109,,7,Lossguide,732,65.83385283208465,0.05099011680964308,32,100,COMPLETE
370,370,0.4750804771485509,2023-06-10 16:21:51.452162,2023-06-10 16:21:52.207613,0 days 00:00:00.755451,0.08541151379500127,,7,Lossguide,939,0.004325310203297922,0.030311667848342487,32,95,COMPLETE
371,371,0.2985243976167089,2023-06-10 16:21:52.208264,2023-06-10 16:21:53.129150,0 days 00:00:00.920886,0.03836964183022974,,8,Lossguide,1008,20.1303048097426,0.040649808592832674,32,98,COMPLETE
372,372,0.29233335792232423,2023-06-10 16:21:53.129815,2023-06-10 16:21:54.264178,0 days 00:00:01.134363,0.04380567072490238,,7,Lossguide,921,62.73483018434082,0.03942354825448388,32,47,COMPLETE
373,373,0.30178762187405733,2023-06-10 16:21:54.264806,2023-06-10 16:21:55.648352,0 days 00:00:01.383546,0.048673302031768235,Plain,4,SymmetricTree,1030,34.84217108115432,0.038116820514573664,32,46,COMPLETE
374,374,0.41069744806166675,2023-06-10 16:21:55.649005,2023-06-10 16:21:56.379546,0 days 00:00:00.730541,0.05642474018532599,,7,Lossguide,966,0.021223568164950978,0.05205426684617898,64,100,COMPLETE
375,375,0.2996529440397849,2023-06-10 16:21:56.380179,2023-06-10 16:21:57.390597,0 days 00:00:01.010418,0.04305235287687659,,7,Lossguide,780,48.369879386056205,0.03834804105142982,32,42,COMPLETE
376,376,0.3194108802498761,2023-06-10 16:21:57.391252,2023-06-10 16:21:58.269951,0 days 00:00:00.878699,0.038669199370293734,,7,Lossguide,592,10.4326371756291,0.04552392805424573,32,98,COMPLETE
377,377,0.3570327245796181,2023-06-10 16:21:58.270623,2023-06-10 16:21:58.972202,0 days 00:00:00.701579,0.07642078052064327,,7,Depthwise,921,1.6974029912408388e-06,0.06632478763734764,10,50,COMPLETE
378,378,0.30905295698452817,2023-06-10 16:21:58.972835,2023-06-10 16:21:59.978240,0 days 00:00:01.005405,0.2936210206496783,,7,Lossguide,799,59.14067465471859,0.055363582070703875,32,45,COMPLETE
379,379,0.3030136103641427,2023-06-10 16:21:59.978867,2023-06-10 16:22:00.963960,0 days 00:00:00.985093,0.055566110316876804,,7,Lossguide,940,32.63386334346964,0.041609714373658034,32,48,COMPLETE
380,380,0.35303082672030595,2023-06-10 16:22:00.964583,2023-06-10 16:22:01.750074,0 days 00:00:00.785491,0.12394237867044512,,7,Lossguide,751,5.748287934983318,0.05783257075412687,20,93,COMPLETE
381,381,0.36672099481843684,2023-06-10 16:22:01.750730,2023-06-10 16:22:02.847768,0 days 00:00:01.097038,3.315283641592556,,7,Lossguide,994,18.557610617611576,0.03119052519564775,32,43,COMPLETE
382,382,0.4759275310402532,2023-06-10 16:22:02.848443,2023-06-10 16:22:05.487115,0 days 00:00:02.638672,60.996366264782225,,7,Lossguide,809,64.55174652652327,0.1041624772275512,32,96,COMPLETE
383,383,0.30027927266896803,2023-06-10 16:22:05.487981,2023-06-10 16:22:06.521920,0 days 00:00:01.033939,0.04467269742176728,,8,Lossguide,967,44.16449780597531,0.037012385620669205,32,52,COMPLETE
384,384,0.29549311814240753,2023-06-10 16:22:06.522702,2023-06-10 16:22:07.663306,0 days 00:00:01.140604,0.011779882055884136,,7,Lossguide,419,66.32471071321795,0.03387889349180712,32,47,COMPLETE
385,385,0.4306463012300371,2023-06-10 16:22:07.664066,2023-06-10 16:22:08.385933,0 days 00:00:00.721867,0.1408192575057134,,6,Lossguide,376,0.0002557302311780805,0.027730515016485338,32,43,COMPLETE
386,386,0.38253530920039597,2023-06-10 16:22:08.386679,2023-06-10 16:22:09.345505,0 days 00:00:00.958826,0.10186701862729168,,7,Lossguide,948,66.74426838551337,0.046765051841054735,4,48,COMPLETE
387,387,0.49364773092174524,2023-06-10 16:22:09.346232,2023-06-10 16:22:10.090048,0 days 00:00:00.743816,0.01011564132484067,,7,Lossguide,505,0.006908119089780584,0.03462821537210499,32,52,COMPLETE
388,388,0.4814737170910098,2023-06-10 16:22:10.090787,2023-06-10 16:22:10.859293,0 days 00:00:00.768506,0.013490809311936962,,7,Lossguide,787,0.009531582008630364,0.03127799507179677,32,8,COMPLETE
389,389,0.38966787898320754,2023-06-10 16:22:10.859939,2023-06-10 16:22:11.638044,0 days 00:00:00.778105,0.21045562531189374,,7,Lossguide,354,28.49430704891685,0.12704981154235925,3,46,COMPLETE
390,390,0.2950216714366404,2023-06-10 16:22:11.638896,2023-06-10 16:22:12.767564,0 days 00:00:01.128668,0.012420468209907644,,7,Lossguide,926,97.8301448232317,0.04119647863808077,32,48,COMPLETE
391,391,0.29086359285658075,2023-06-10 16:22:12.768379,2023-06-10 16:22:13.851013,0 days 00:00:01.082634,0.03575824309362882,,7,Lossguide,933,41.1520352759858,0.034778443388671636,32,47,COMPLETE
392,392,0.3163996048158874,2023-06-10 16:22:13.851790,2023-06-10 16:22:14.775138,0 days 00:00:00.923348,0.013554692672103298,,7,Lossguide,438,16.106365961742135,0.03546142611457575,32,49,COMPLETE
393,393,0.5851599139462209,2023-06-10 16:22:14.775930,2023-06-10 16:22:15.470495,0 days 00:00:00.694565,0.012562188856120206,,7,Lossguide,426,3.609099119647597e-05,0.03200966043658746,2,44,COMPLETE
394,394,0.2966631496610037,2023-06-10 16:22:15.471155,2023-06-10 16:22:16.463456,0 days 00:00:00.992301,0.037331536366765755,,7,Lossguide,926,36.336782367188235,0.03819118964643341,32,48,COMPLETE
395,395,0.36525187021840516,2023-06-10 16:22:16.464224,2023-06-10 16:22:17.262384,0 days 00:00:00.798160,0.03218328134789438,,7,Lossguide,934,2.9784548598462703,0.040851318177254674,32,51,COMPLETE
396,396,0.3231108883442926,2023-06-10 16:22:17.263124,2023-06-10 16:22:36.798689,0 days 00:00:19.535565,0.011110661715436888,Ordered,7,SymmetricTree,954,98.5138254366772,0.027757923687919774,5,46,COMPLETE
397,397,0.2992668410696634,2023-06-10 16:22:36.799491,2023-06-10 16:22:37.728871,0 days 00:00:00.929380,0.011822279727395359,,8,Lossguide,915,41.17850297018572,0.04823006677147283,32,98,COMPLETE
398,398,0.44043629045329913,2023-06-10 16:22:37.729469,2023-06-10 16:22:38.464413,0 days 00:00:00.734944,0.046933417356771236,,7,Lossguide,940,0.03933863071203141,0.035176111713440504,32,46,COMPLETE
399,399,0.30687640151757,2023-06-10 16:22:38.465052,2023-06-10 16:22:39.363702,0 days 00:00:00.898650,0.03778508693395048,,7,Lossguide,980,19.90065289175569,0.04247196117320945,32,50,COMPLETE
400,400,0.3345122562814644,2023-06-10 16:22:39.364325,2023-06-10 16:22:40.077623,0 days 00:00:00.713298,0.03001370879239892,,7,Depthwise,513,10.541289417073905,0.06848557094510667,32,47,COMPLETE
401,401,0.5111359214703673,2023-06-10 16:22:40.078368,2023-06-10 16:22:40.795917,0 days 00:00:00.717549,0.05286595676454961,,7,Lossguide,908,0.0010882355905935193,0.04857466332549025,32,41,COMPLETE
402,402,0.2981782993245322,2023-06-10 16:22:40.796681,2023-06-10 16:22:42.051623,0 days 00:00:01.254942,0.03801605340933572,,7,Lossguide,927,62.47813224171562,0.02344881942478692,32,54,COMPLETE
403,403,0.3912638295166743,2023-06-10 16:22:42.052441,2023-06-10 16:22:42.764963,0 days 00:00:00.712522,0.010166670075950946,,7,Lossguide,951,0.4114628780062384,0.05408437791426673,32,39,COMPLETE
404,404,0.3522157099318672,2023-06-10 16:22:42.765661,2023-06-10 16:22:43.645624,0 days 00:00:00.879963,1.2377317571623536,,7,Lossguide,966,0.79407677631188,0.03299538046573385,32,48,COMPLETE
405,405,0.32688850397244495,2023-06-10 16:22:43.646411,2023-06-10 16:22:44.420760,0 days 00:00:00.774349,0.23514513544686833,,7,Lossguide,1001,28.612411468271766,0.0844377587266283,64,44,COMPLETE
406,406,0.3015415971303794,2023-06-10 16:22:44.421451,2023-06-10 16:22:45.612541,0 days 00:00:01.191090,0.38157705819459264,,6,Lossguide,711,99.73115507661632,0.04067784580494939,32,53,COMPLETE
407,407,0.3921373038153448,2023-06-10 16:22:45.613300,2023-06-10 16:22:46.469768,0 days 00:00:00.856468,0.01799002944023676,,8,Lossguide,917,0.2287838241019291,0.021512445593289863,32,49,COMPLETE
408,408,0.3411923255877224,2023-06-10 16:22:46.470820,2023-06-10 16:22:51.001077,0 days 00:00:04.530257,0.015567928476666404,,7,Lossguide,934,47.5273636115383,0.0011891216477862452,32,45,COMPLETE
409,409,0.3254912402311107,2023-06-10 16:22:51.001942,2023-06-10 16:22:51.812968,0 days 00:00:00.811026,0.04473930971305859,,7,Lossguide,984,64.62959978580905,0.08832923915919229,10,31,COMPLETE
410,410,0.5395099985266802,2023-06-10 16:22:51.813758,2023-06-10 16:22:52.516637,0 days 00:00:00.702879,0.06109952354997275,,7,Lossguide,958,5.590976409399619e-05,0.06453308175091477,32,47,COMPLETE
411,411,0.30693127136957515,2023-06-10 16:22:52.517416,2023-06-10 16:22:53.522476,0 days 00:00:01.005060,0.03214137616540964,,7,Lossguide,914,25.420948470646266,0.027190429611894586,32,57,COMPLETE
412,412,0.34150240349905925,2023-06-10 16:22:53.523106,2023-06-10 16:22:54.377583,0 days 00:00:00.854477,0.027524818253886512,,7,Lossguide,328,4.318692192620526,0.03710628682134202,20,45,COMPLETE
413,413,0.4327384663802908,2023-06-10 16:22:54.378206,2023-06-10 16:22:55.106354,0 days 00:00:00.728148,0.022085238930784012,,9,Lossguide,1016,0.01808207680611669,0.1082822955438759,32,52,COMPLETE
414,414,0.3352794142013663,2023-06-10 16:22:55.106960,2023-06-10 16:22:56.129742,0 days 00:00:01.022782,0.5067145589169904,,7,Lossguide,966,45.455267362752586,0.05945817328844223,32,49,COMPLETE
415,415,0.33283975149151157,2023-06-10 16:22:56.130391,2023-06-10 16:22:57.363789,0 days 00:00:01.233398,1.0544687593116204,,7,Lossguide,900,68.12880798111702,0.04552891397571839,32,71,COMPLETE
416,416,0.4096597244727491,2023-06-10 16:22:57.364496,2023-06-10 16:22:58.132209,0 days 00:00:00.767713,2.582568507500793,,7,Lossguide,541,0.18685073403954816,0.1320574689440646,32,49,COMPLETE
417,417,0.3105469841411578,2023-06-10 16:22:58.132958,2023-06-10 16:22:58.939045,0 days 00:00:00.806087,0.04115948541606117,,7,Lossguide,942,35.43546298009822,0.09049499297270909,32,51,COMPLETE
418,418,0.3228952690027408,2023-06-10 16:22:58.939713,2023-06-10 16:23:12.427198,0 days 00:00:13.487485,0.049821569020589145,Ordered,7,SymmetricTree,924,14.101068999130943,0.01910833456746153,32,100,COMPLETE
419,419,0.36565339959878196,2023-06-10 16:23:12.427876,2023-06-10 16:23:13.642158,0 days 00:00:01.214282,0.03441416702763271,,7,Lossguide,1037,66.19905350160704,0.030090690402102407,3,96,COMPLETE
420,420,0.3885506807352363,2023-06-10 16:23:13.642923,2023-06-10 16:23:14.578874,0 days 00:00:00.935951,0.06616790340424758,,7,Lossguide,896,47.9156006704279,0.041884565775662796,4,41,COMPLETE
421,421,0.3573779079469232,2023-06-10 16:23:14.579615,2023-06-10 16:23:15.348212,0 days 00:00:00.768597,0.012059480496835546,,8,Lossguide,945,1.4552255854103526,0.053439459707462014,32,92,COMPLETE
422,422,0.3028859656499612,2023-06-10 16:23:15.348956,2023-06-10 16:23:16.169793,0 days 00:00:00.820837,0.027138103018453184,,7,Lossguide,980,97.74854828907921,0.14549193613376718,32,98,COMPLETE
423,423,0.4040944641539373,2023-06-10 16:23:16.170549,2023-06-10 16:23:17.066888,0 days 00:00:00.896339,1.8618200359610617,,6,Depthwise,409,99.57667681241062,0.12304114430651138,2,95,COMPLETE
424,424,0.5365887234346323,2023-06-10 16:23:17.067663,2023-06-10 16:23:17.758361,0 days 00:00:00.690698,0.04216148284322722,,7,Lossguide,752,7.92523480973199e-06,0.03216371553908071,32,98,COMPLETE
425,425,0.3994673387831601,2023-06-10 16:23:17.759086,2023-06-10 16:23:18.501337,0 days 00:00:00.742251,0.2966808238337843,,7,Lossguide,916,0.0028807479943386925,0.02486669029250791,32,100,COMPLETE
426,426,0.30110590123385106,2023-06-10 16:23:18.502082,2023-06-10 16:23:19.318840,0 days 00:00:00.816758,0.01938953167772731,,7,Lossguide,1004,23.33564423545147,0.07751410779786705,32,94,COMPLETE
427,427,0.3933965372551682,2023-06-10 16:23:19.319465,2023-06-10 16:23:20.155416,0 days 00:00:00.835951,0.05710591524449791,,7,Lossguide,676,2.300639899605783,0.03543354140436185,5,47,COMPLETE
428,428,0.5810976526053062,2023-06-10 16:23:20.156080,2023-06-10 16:23:21.105644,0 days 00:00:00.949564,0.03493345756401996,,7,Lossguide,1066,1.3897555191855548e-07,0.1618805080502668,32,62,COMPLETE
429,429,0.5382546916837025,2023-06-10 16:23:21.106252,2023-06-10 16:23:21.824101,0 days 00:00:00.717849,0.015037649879902531,,7,Lossguide,958,0.0005132332655839904,0.1711642200733399,32,96,COMPLETE
430,430,0.3112418024837698,2023-06-10 16:23:21.824733,2023-06-10 16:23:22.675806,0 days 00:00:00.851073,0.04915899960187977,,7,Lossguide,932,37.42618596458824,0.11172286575175036,32,98,COMPLETE
431,431,0.3485184504646834,2023-06-10 16:23:22.676510,2023-06-10 16:23:23.571238,0 days 00:00:00.894728,0.7449329250671474,,7,Lossguide,986,8.534800677487652,0.046013933317565266,32,100,COMPLETE
432,432,0.29582639162403135,2023-06-10 16:23:23.571904,2023-06-10 16:23:24.635447,0 days 00:00:01.063543,0.02916092843416359,,7,Lossguide,902,62.14103792854277,0.039598624920223625,32,92,COMPLETE
433,433,0.3782773003581832,2023-06-10 16:23:24.636145,2023-06-10 16:23:26.050938,0 days 00:00:01.414793,4.223900396761897,,7,Lossguide,920,65.3142492542067,0.03783584960421192,32,93,COMPLETE
434,434,0.2980576934386611,2023-06-10 16:23:26.051738,2023-06-10 16:23:27.108913,0 days 00:00:01.057175,0.02379355540556166,,8,Lossguide,888,64.97077805383846,0.03986075162150962,32,96,COMPLETE
435,435,0.43626169081778854,2023-06-10 16:23:27.109678,2023-06-10 16:23:27.828117,0 days 00:00:00.718439,0.028990620305172392,,7,Lossguide,901,0.00033304163310180146,0.029003208793162746,64,97,COMPLETE
436,436,0.48729316703632936,2023-06-10 16:23:27.828884,2023-06-10 16:23:28.526351,0 days 00:00:00.697467,0.02133175365501658,,7,Lossguide,902,0.001644806634261962,0.10339751466268234,32,79,COMPLETE
437,437,0.4544589282000748,2023-06-10 16:23:28.527004,2023-06-10 16:23:29.271775,0 days 00:00:00.744771,0.031371382921764966,,7,Lossguide,941,0.05888055497309222,0.057261978646522015,32,100,COMPLETE
438,438,0.365865414098667,2023-06-10 16:23:29.272538,2023-06-10 16:23:30.364457,0 days 00:00:01.091919,1.5798971733094704,,7,Lossguide,888,28.614737222225777,0.05006702580983125,32,43,COMPLETE
439,439,0.5186603946057928,2023-06-10 16:23:30.365316,2023-06-10 16:23:31.071160,0 days 00:00:00.705844,0.026583276018672053,,7,Lossguide,929,0.0007831155353862759,0.04353726384618297,32,94,COMPLETE
