,number,value,datetime_start,datetime_complete,duration,params_bagging_temperature,params_boosting_type,params_depth,params_grow_policy,params_iterations,params_l2_leaf_reg,params_learning_rate,params_max_bin,params_random_strength,state
440,440,0.5598001679823674,2023-06-10 16:23:31.072138,2023-06-10 16:23:32.749584,0 days 00:00:01.677446,0.036202752692354394,Plain,7,SymmetricTree,477,46.39776207413381,0.002735475697740905,32,98,COMPLETE
441,441,0.4416407357584653,2023-06-10 16:23:32.750362,2023-06-10 16:23:33.450674,0 days 00:00:00.700312,0.3298895920821992,,7,Lossguide,911,1.5485401670703133e-05,0.07031376157843354,10,96,COMPLETE
442,442,0.454334358929387,2023-06-10 16:23:33.451374,2023-06-10 16:23:34.155114,0 days 00:00:00.703740,0.44984603923445715,,7,Lossguide,966,0.00019388696456198155,0.034392158525247934,32,100,COMPLETE
443,443,0.4753638017560733,2023-06-10 16:23:34.155809,2023-06-10 16:23:34.840891,0 days 00:00:00.685082,0.019745846236874854,,7,Lossguide,944,0.000365555662708246,0.09339442107860077,20,92,COMPLETE
444,444,0.45362817740527406,2023-06-10 16:23:34.841550,2023-06-10 16:23:35.545365,0 days 00:00:00.703815,0.041861601662280055,,8,Lossguide,905,1.3165834489945822e-06,0.04232130788600716,32,47,COMPLETE
445,445,0.3172924105268913,2023-06-10 16:23:35.546068,2023-06-10 16:23:37.901863,0 days 00:00:02.355795,0.8943727216663516,,7,Depthwise,957,96.36071387972645,0.025769558136240437,32,98,COMPLETE
446,446,0.3095785068792247,2023-06-10 16:23:37.902540,2023-06-10 16:23:38.661772,0 days 00:00:00.759232,0.015712271161400528,,7,Lossguide,984,55.70387483313096,0.1825653947434672,32,50,COMPLETE
447,447,0.5596375267889524,2023-06-10 16:23:38.662439,2023-06-10 16:23:39.434944,0 days 00:00:00.772505,0.02603890924988739,,7,Lossguide,930,7.658147684136397e-05,0.14019195071017543,32,95,COMPLETE
448,448,0.3890097190835498,2023-06-10 16:23:39.435622,2023-06-10 16:23:40.341119,0 days 00:00:00.905497,0.03228171347073211,,7,Lossguide,889,24.360333345786216,0.06260401072167134,3,97,COMPLETE
449,449,0.48796387123242085,2023-06-10 16:23:40.341735,2023-06-10 16:23:41.109626,0 days 00:00:00.767891,0.010268115776545284,,7,Lossguide,1020,0.008923938658886093,0.015597539623785458,32,94,COMPLETE
450,450,0.38185618598216414,2023-06-10 16:23:41.110274,2023-06-10 16:23:41.832589,0 days 00:00:00.722315,0.03707335411351315,,7,Lossguide,590,0.8153443699165551,0.11692502100779202,32,45,COMPLETE
451,451,0.38043829685769576,2023-06-10 16:23:41.833321,2023-06-10 16:23:42.591136,0 days 00:00:00.757815,0.022770995373746022,,7,Lossguide,919,68.97696271145404,0.18845493745980646,4,100,COMPLETE
452,452,0.39911608827691053,2023-06-10 16:23:42.591921,2023-06-10 16:23:43.306676,0 days 00:00:00.714755,0.04535079355247651,,7,Lossguide,949,0.4063844950224964,0.0494916596736873,32,98,COMPLETE
453,453,0.29957916557970693,2023-06-10 16:23:43.307333,2023-06-10 16:23:44.516820,0 days 00:00:01.209487,0.07770912238992676,,7,Lossguide,1004,99.31608335361773,0.03212131556177071,32,96,COMPLETE
454,454,0.31173574070288357,2023-06-10 16:23:44.517490,2023-06-10 16:23:45.297040,0 days 00:00:00.779550,0.01770583288359926,,7,Lossguide,875,39.61542064932225,0.1347247130887618,32,92,COMPLETE
455,455,0.31163293731346314,2023-06-10 16:23:45.297707,2023-06-10 16:23:49.661540,0 days 00:00:04.363833,0.02808376469384509,,7,Lossguide,969,15.352577908897892,0.002156487406092341,32,98,COMPLETE
456,456,0.2986812047626908,2023-06-10 16:23:49.662336,2023-06-10 16:23:50.728397,0 days 00:00:01.066061,0.012936206052181053,,7,Lossguide,933,50.997242177879265,0.03752565812664977,32,94,COMPLETE
457,457,0.5395797600656936,2023-06-10 16:23:50.729057,2023-06-10 16:23:51.469578,0 days 00:00:00.740521,0.2618738372663412,,8,Lossguide,901,0.015882934900419247,0.019114733768459524,2,100,COMPLETE
458,458,0.46679147639263663,2023-06-10 16:23:51.470324,2023-06-10 16:23:52.207905,0 days 00:00:00.737581,0.12233316005878664,,7,Lossguide,916,1.6076679889306693e-08,0.07630560940383137,5,96,COMPLETE
459,459,0.316361799770883,2023-06-10 16:23:52.208535,2023-06-10 16:23:52.934580,0 days 00:00:00.726045,0.18510056793909305,,7,Lossguide,954,31.533969353867267,0.2549806081332024,32,91,COMPLETE
460,460,0.2959350448876365,2023-06-10 16:23:52.935313,2023-06-10 16:23:55.201835,0 days 00:00:02.266522,0.04236876697233772,,7,Lossguide,884,66.5606237756662,0.009543569010896204,32,98,COMPLETE
461,461,0.34432385730980825,2023-06-10 16:23:55.202640,2023-06-10 16:23:56.441519,0 days 00:00:01.238879,1.3830700903316588,,7,Lossguide,860,5.50077409588014,0.013243246258862867,32,98,COMPLETE
462,462,0.30281620791679,2023-06-10 16:23:56.442213,2023-06-10 16:23:57.493273,0 days 00:00:01.051060,0.0657971705441982,,6,Lossguide,882,20.436216755798867,0.02954534593053802,32,94,COMPLETE
463,463,0.40739649263161604,2023-06-10 16:23:57.494059,2023-06-10 16:24:01.846021,0 days 00:00:04.351962,2.3993038388682955,,7,Lossguide,883,61.19333214096324,0.001531557563191508,32,100,COMPLETE
464,464,0.32166902030369443,2023-06-10 16:24:01.846687,2023-06-10 16:24:08.511320,0 days 00:00:06.664633,0.04891035423733859,Ordered,7,SymmetricTree,867,42.287956906042105,0.039258402333514596,32,50,COMPLETE
465,465,0.3696776811643452,2023-06-10 16:24:08.512048,2023-06-10 16:24:12.896362,0 days 00:00:04.384314,0.03212150185668357,,7,Lossguide,899,67.0020300022759,0.0010598492628136455,32,97,COMPLETE
466,466,0.37808114096431894,2023-06-10 16:24:12.897039,2023-06-10 16:24:13.623092,0 days 00:00:00.726053,0.04096353945326212,,7,Lossguide,1000,0.18630544790666045,0.04605050553370769,64,47,COMPLETE
467,467,0.3036438192843701,2023-06-10 16:24:13.623729,2023-06-10 16:24:14.844340,0 days 00:00:01.220611,0.02448447821373493,,9,Lossguide,850,31.153475537819713,0.02130581750749428,32,21,COMPLETE
468,468,0.4600089424352882,2023-06-10 16:24:14.844984,2023-06-10 16:24:15.966091,0 days 00:00:01.121107,18.32479426293897,,7,Depthwise,889,0.005470862177180024,0.00916806426468126,32,95,COMPLETE
469,469,0.2981720582905917,2023-06-10 16:24:15.966794,2023-06-10 16:24:20.463743,0 days 00:00:04.496949,0.032293823169681414,,7,Lossguide,910,69.09562232023971,0.0031775077863524215,32,100,COMPLETE
470,470,0.43996478280439544,2023-06-10 16:24:20.464436,2023-06-10 16:24:21.415494,0 days 00:00:00.951058,0.05913243685560023,,7,Lossguide,977,0.027726554523953548,0.0077945615791912256,32,92,COMPLETE
471,471,0.3244059246001654,2023-06-10 16:24:21.416172,2023-06-10 16:24:22.500556,0 days 00:00:01.084384,0.5740711861603995,,7,Lossguide,879,98.8909188425863,0.05764210978623739,10,89,COMPLETE
472,472,0.3047103849002111,2023-06-10 16:24:22.501239,2023-06-10 16:24:23.987340,0 days 00:00:01.486101,0.20725956792767675,,7,Lossguide,1044,42.21506142417879,0.016860737563106402,32,44,COMPLETE
473,473,0.3089574913991316,2023-06-10 16:24:23.987990,2023-06-10 16:24:25.487259,0 days 00:00:01.499269,0.014768361807417377,,7,Lossguide,342,19.049879529405814,0.010349440452632456,32,96,COMPLETE
474,474,0.31465535378489706,2023-06-10 16:24:25.487908,2023-06-10 16:24:26.409353,0 days 00:00:00.921445,0.14800878608566337,,8,Lossguide,922,9.97769577595131,0.03546287451931268,32,98,COMPLETE
475,475,0.3851822843479997,2023-06-10 16:24:26.410025,2023-06-10 16:24:27.563839,0 days 00:00:01.153814,6.144830879183611,,7,Lossguide,864,49.73545474764598,0.04980644278832905,32,93,COMPLETE
476,476,0.3485250116116445,2023-06-10 16:24:27.564562,2023-06-10 16:24:28.375398,0 days 00:00:00.810836,0.6514097078791666,,7,Lossguide,941,28.941823953026304,0.09594868462479818,20,98,COMPLETE
477,477,0.29570641103172296,2023-06-10 16:24:28.376046,2023-06-10 16:24:29.248475,0 days 00:00:00.872429,0.018750037459355395,,7,Lossguide,983,68.22724897138882,0.12194164184596082,32,39,COMPLETE
478,478,0.2979284706041919,2023-06-10 16:24:29.249196,2023-06-10 16:24:30.080297,0 days 00:00:00.831101,0.01849623535371901,,7,Lossguide,997,67.18670235057111,0.10991999948731385,32,41,COMPLETE
479,479,0.29718056860540004,2023-06-10 16:24:30.080976,2023-06-10 16:24:30.865241,0 days 00:00:00.784265,0.021874900271565544,,7,Lossguide,1013,36.60659577137736,0.1432876197247562,32,32,COMPLETE
480,480,0.5482694432115677,2023-06-10 16:24:30.865909,2023-06-10 16:24:31.595308,0 days 00:00:00.729399,0.017547182064326542,,7,Lossguide,617,0.08827536778636667,0.11412527516812558,3,34,COMPLETE
481,481,0.3733147193656399,2023-06-10 16:24:31.596009,2023-06-10 16:24:32.421272,0 days 00:00:00.825263,0.013024888828589615,,7,Lossguide,978,98.03684440301849,0.13009197133394895,4,36,COMPLETE
482,482,0.348319100246251,2023-06-10 16:24:32.421899,2023-06-10 16:24:33.996715,0 days 00:00:01.574816,4.036013909469793,,7,Lossguide,901,0.12806407148490082,0.007393173071861714,32,37,COMPLETE
483,483,0.3274662363550894,2023-06-10 16:24:33.997441,2023-06-10 16:24:34.787097,0 days 00:00:00.789656,0.020965344121753486,,7,Lossguide,564,17.82139925501411,0.12242578002567073,32,60,COMPLETE
484,484,0.37534246636013324,2023-06-10 16:24:34.787846,2023-06-10 16:24:35.976536,0 days 00:00:01.188690,9.383092218137568,,7,Lossguide,1030,48.92351376764072,0.1012824052561815,32,100,COMPLETE
485,485,0.3845105145849768,2023-06-10 16:24:35.977172,2023-06-10 16:24:36.823509,0 days 00:00:00.846337,0.028191819409184946,Plain,7,SymmetricTree,997,2.0013982781616058,0.06938045515192497,32,35,COMPLETE
486,486,0.4617270657237788,2023-06-10 16:24:36.824165,2023-06-10 16:24:38.126162,0 days 00:00:01.301997,0.7472291213308541,,7,Lossguide,464,1.092739825840262,0.008289653068389174,2,55,COMPLETE
487,487,0.5000861592779544,2023-06-10 16:24:38.126838,2023-06-10 16:24:38.884054,0 days 00:00:00.757216,0.025597541718590647,,7,Lossguide,966,0.002601974894444073,0.013991536712075816,32,26,COMPLETE
488,488,0.5482235265156524,2023-06-10 16:24:38.884685,2023-06-10 16:24:39.594761,0 days 00:00:00.710076,0.010032194337529988,,7,Lossguide,385,0.00021771395862654392,0.1484308421696739,32,43,COMPLETE
489,489,0.29803873858781355,2023-06-10 16:24:39.595419,2023-06-10 16:24:41.949435,0 days 00:00:02.354016,0.07961734376674495,,7,Lossguide,846,67.99480196644173,0.009487306082703175,32,95,COMPLETE
490,490,0.3643312636726861,2023-06-10 16:24:41.950139,2023-06-10 16:24:43.115109,0 days 00:00:01.164970,0.014893831922471318,,7,Depthwise,888,99.86125590764271,0.05530376167041878,32,56,COMPLETE
491,491,0.3071230381972653,2023-06-10 16:24:43.115882,2023-06-10 16:24:43.975942,0 days 00:00:00.860060,0.03626863608066649,,7,Lossguide,989,28.460739507027625,0.042968734988528524,32,40,COMPLETE
492,492,0.3391047164917202,2023-06-10 16:24:43.976634,2023-06-10 16:24:45.063126,0 days 00:00:01.086492,0.022394598357707046,,7,Lossguide,918,4.010169540151722,0.011061806487144003,32,52,COMPLETE
493,493,0.3483418633559592,2023-06-10 16:24:45.063980,2023-06-10 16:24:49.533460,0 days 00:00:04.469480,0.108388319241338,,7,Lossguide,872,44.557605042967644,0.002362108872063015,5,98,COMPLETE
494,494,0.4443394496003418,2023-06-10 16:24:49.534227,2023-06-10 16:24:50.259575,0 days 00:00:00.725348,0.029243907887689536,,7,Lossguide,939,0.03742932134122702,0.08176311985235758,32,100,COMPLETE
495,495,0.31653725626257523,2023-06-10 16:24:50.260359,2023-06-10 16:24:51.059773,0 days 00:00:00.799414,0.051371447737328525,,7,Lossguide,1026,12.190824407528734,0.08794937278889964,32,90,COMPLETE
496,496,0.5117374292328436,2023-06-10 16:24:51.060561,2023-06-10 16:24:51.843211,0 days 00:00:00.782650,0.017775480411458804,,7,Lossguide,908,0.0008614568489609001,0.007005609927840102,32,96,COMPLETE
497,497,0.43637152329257267,2023-06-10 16:24:51.844052,2023-06-10 16:24:56.117468,0 days 00:00:04.273416,39.931779193554235,,6,Lossguide,960,68.89018261104111,0.008939810814771498,64,93,COMPLETE
498,498,0.3116421687518432,2023-06-10 16:24:56.118250,2023-06-10 16:24:56.940693,0 days 00:00:00.822443,0.036574726348067,,7,Lossguide,979,23.123817038052596,0.06266514391914425,32,100,COMPLETE
499,499,0.364309217996167,2023-06-10 16:24:56.941464,2023-06-10 16:25:00.332763,0 days 00:00:03.391299,3.458406818665447,,7,Lossguide,893,45.23183761477356,0.00802820865112896,32,95,COMPLETE
500,500,0.42890990347805835,2023-06-10 16:25:00.333537,2023-06-10 16:25:01.108128,0 days 00:00:00.774591,0.012479067667096617,,7,Lossguide,862,0.0727089271835291,0.023251052288761447,32,48,COMPLETE
501,501,0.4775204225021518,2023-06-10 16:25:01.108914,2023-06-10 16:25:01.830302,0 days 00:00:00.721388,1.0743967231532598,,7,Lossguide,922,3.2875499556012377e-08,0.0399357824623506,10,38,COMPLETE
502,502,0.5149756784790659,2023-06-10 16:25:01.830985,2023-06-10 16:25:02.528296,0 days 00:00:00.697311,0.09575035145033065,,7,Lossguide,828,0.0013409625294527076,0.10068735089271952,32,98,COMPLETE
503,503,0.4227835734096118,2023-06-10 16:25:02.529059,2023-06-10 16:25:03.321879,0 days 00:00:00.792820,2.2058060788308316,,7,Lossguide,1089,6.889284440626887e-05,0.04998396524097307,32,96,COMPLETE
504,504,0.5665410141218,2023-06-10 16:25:03.322594,2023-06-10 16:25:04.006901,0 days 00:00:00.684307,0.4822125160509056,,7,Lossguide,941,3.986228019312547e-06,0.19498664555890338,32,45,COMPLETE
505,505,0.46569752478857784,2023-06-10 16:25:04.007679,2023-06-10 16:25:04.859740,0 days 00:00:00.852061,0.06630065955758065,,7,Lossguide,1007,0.0018461046844415495,0.006854915347241179,20,91,COMPLETE
506,506,0.45230884883278477,2023-06-10 16:25:04.860513,2023-06-10 16:25:05.580037,0 days 00:00:00.719524,0.02534913538357983,,5,Lossguide,904,6.319733695380185e-07,0.012627195936908153,32,98,COMPLETE
507,507,0.34266272616755244,2023-06-10 16:25:05.580788,2023-06-10 16:25:19.269557,0 days 00:00:13.688769,0.04578448016080877,Ordered,7,SymmetricTree,792,30.88302437486796,0.010018292532622989,32,94,COMPLETE
508,508,0.2819563086159106,2023-06-10 16:25:19.270253,2023-06-10 16:25:20.077023,0 days 00:00:00.806770,0.03233208508075347,,7,Lossguide,953,66.33530107800823,0.12364316308885265,32,16,COMPLETE
509,509,0.29696379446768456,2023-06-10 16:25:20.077791,2023-06-10 16:25:20.886485,0 days 00:00:00.808694,0.020623995135569458,,7,Lossguide,515,49.54536580854342,0.12938960508881553,32,72,COMPLETE
510,510,0.2982865952520881,2023-06-10 16:25:20.887335,2023-06-10 16:25:21.765457,0 days 00:00:00.878122,0.03083406941905409,,7,Lossguide,968,98.00632910231717,0.1642195619210031,32,3,COMPLETE
511,511,0.5029628408364406,2023-06-10 16:25:21.766216,2023-06-10 16:25:22.498168,0 days 00:00:00.731952,0.1706713348154798,,7,Lossguide,983,0.5740712985814107,0.12372936193538404,3,23,COMPLETE
512,512,0.38364537203715915,2023-06-10 16:25:22.498840,2023-06-10 16:25:23.288074,0 days 00:00:00.789234,0.024771224701109384,,7,Depthwise,305,14.551285589046861,0.15363189735896193,4,53,COMPLETE
513,513,0.31727538747304845,2023-06-10 16:25:23.288906,2023-06-10 16:25:24.021555,0 days 00:00:00.732649,0.016884755715770836,,7,Lossguide,954,6.7372345860436464,0.11750012540413596,32,65,COMPLETE
514,514,0.30973264738262085,2023-06-10 16:25:24.022324,2023-06-10 16:25:24.801670,0 days 00:00:00.779346,0.030212401841778817,,7,Lossguide,811,32.0583384674098,0.1061683751031576,32,50,COMPLETE
515,515,0.5641292904436619,2023-06-10 16:25:24.802451,2023-06-10 16:25:25.504887,0 days 00:00:00.702436,0.03773822624362946,,7,Lossguide,637,0.00012285274454227962,0.0851500128809589,32,88,COMPLETE
516,516,0.5372241387140803,2023-06-10 16:25:25.505684,2023-06-10 16:25:26.213857,0 days 00:00:00.708173,0.05771699096081744,,7,Lossguide,992,3.468169062169924e-05,0.14372664549965145,32,28,COMPLETE
517,517,0.3007492287990294,2023-06-10 16:25:26.214655,2023-06-10 16:25:27.700251,0 days 00:00:01.485596,0.020571958029494346,,7,Lossguide,841,62.30430320931165,0.017715064676084,32,10,COMPLETE
518,518,0.46760964285173834,2023-06-10 16:25:27.700962,2023-06-10 16:25:28.427671,0 days 00:00:00.726709,0.014564946994792601,,9,Lossguide,1058,0.004019229544346572,0.042454154382034225,32,100,COMPLETE
519,519,0.43998429051319077,2023-06-10 16:25:28.428356,2023-06-10 16:25:31.420536,0 days 00:00:02.992180,0.03210398856825593,,7,Lossguide,531,21.58910000045883,0.0019161713030276656,2,10,COMPLETE
520,520,0.45552632869695087,2023-06-10 16:25:31.421220,2023-06-10 16:25:32.144291,0 days 00:00:00.723071,0.011365559788991002,,7,Lossguide,967,0.0004642795962780064,0.07113371903580677,5,20,COMPLETE
521,521,0.3027608732293023,2023-06-10 16:25:32.144961,2023-06-10 16:25:32.907573,0 days 00:00:00.762612,0.0429526960906459,,7,Lossguide,880,99.59609719511735,0.28333350728123413,32,92,COMPLETE
522,522,0.5039656866829177,2023-06-10 16:25:32.908405,2023-06-10 16:25:33.687073,0 days 00:00:00.778668,10.877934929421382,,7,Lossguide,932,1.0317150849393672e-08,0.04653610700872446,32,12,COMPLETE
523,523,0.298883053371444,2023-06-10 16:25:33.687855,2023-06-10 16:25:34.518828,0 days 00:00:00.830973,0.02605784164971237,,7,Lossguide,1016,47.34189348662972,0.09362560101314008,32,58,COMPLETE
524,524,0.3890056656554335,2023-06-10 16:25:34.519562,2023-06-10 16:25:37.104168,0 days 00:00:02.584606,0.07088692676935339,,7,Lossguide,858,0.30745399651762245,0.00123022761100201,32,47,COMPLETE
525,525,0.30185579158298825,2023-06-10 16:25:37.104829,2023-06-10 16:25:38.326682,0 days 00:00:01.221853,0.3049586275794013,,7,Lossguide,946,59.29717839156718,0.02769992190927493,32,96,COMPLETE
526,526,0.3169477330679045,2023-06-10 16:25:38.327379,2023-06-10 16:25:39.369042,0 days 00:00:01.041663,0.3752444134016024,,7,Lossguide,911,34.30041903678089,0.03667582914532429,32,17,COMPLETE
527,527,0.31429208754505444,2023-06-10 16:25:39.369729,2023-06-10 16:25:41.914810,0 days 00:00:02.545081,0.7874338746441033,,7,Lossguide,821,69.40022908525785,0.015347297922503694,32,100,COMPLETE
528,528,0.3812190529110387,2023-06-10 16:25:41.915517,2023-06-10 16:25:42.647158,0 days 00:00:00.731641,0.12936293157978426,,7,Lossguide,893,1.2662770101242105,0.12915613104604887,64,94,COMPLETE
529,529,0.38284675445961797,2023-06-10 16:25:42.647807,2023-06-10 16:25:43.549551,0 days 00:00:00.901744,1.4534293892729204,,7,Lossguide,781,0.023387701351116456,0.01964107612117527,32,63,COMPLETE
530,530,0.33727761044676596,2023-06-10 16:25:43.550255,2023-06-10 16:25:44.711715,0 days 00:00:01.161460,17.269338963877097,,7,Lossguide,684,38.172456406869486,0.20373433640818042,32,15,COMPLETE
531,531,0.3026917363266712,2023-06-10 16:25:44.712487,2023-06-10 16:25:45.829252,0 days 00:00:01.116765,0.04767486643639437,,7,Lossguide,407,21.297163779074932,0.02422894999575167,32,98,COMPLETE
532,532,0.44796771077946324,2023-06-10 16:25:45.830039,2023-06-10 16:25:50.510558,0 days 00:00:04.680519,30.895866136447257,,7,Lossguide,989,99.40904646079933,0.0064323539172825295,10,76,COMPLETE
533,533,0.6221484715373824,2023-06-10 16:25:50.511270,2023-06-10 16:25:51.141020,0 days 00:00:00.629750,62.78323131036738,Plain,6,SymmetricTree,954,2.150290350480924e-07,0.056536852278867816,32,17,COMPLETE
534,534,0.5012112079087194,2023-06-10 16:25:51.141704,2023-06-10 16:25:51.800590,0 days 00:00:00.658886,0.036681074741530935,,7,Depthwise,919,0.013899886918745373,0.11221403245934027,32,42,COMPLETE
535,535,0.4300307149398308,2023-06-10 16:25:51.801292,2023-06-10 16:25:52.518666,0 days 00:00:00.717374,0.022562802254263166,,4,Lossguide,972,1.2263537794274975e-05,0.0074543812540784704,32,68,COMPLETE
536,536,0.2981496138785891,2023-06-10 16:25:52.519430,2023-06-10 16:25:53.720628,0 days 00:00:01.201198,0.05377114189508453,,7,Lossguide,877,58.73020794103983,0.030434638232736042,32,6,COMPLETE
537,537,0.30042830752376887,2023-06-10 16:25:53.721436,2023-06-10 16:25:54.623626,0 days 00:00:00.902190,0.01816340270220994,,7,Lossguide,932,42.75226051034812,0.04563776593924182,32,96,COMPLETE
538,538,0.33928174574354275,2023-06-10 16:25:54.624465,2023-06-10 16:25:57.957719,0 days 00:00:03.333254,1.7831906913130213,,7,Lossguide,858,9.023800363563325,0.0037335466406918883,20,93,COMPLETE
539,539,0.3053224782086834,2023-06-10 16:25:57.958528,2023-06-10 16:26:02.893471,0 days 00:00:04.934943,0.48297797478500804,,7,Lossguide,1005,66.4120871941877,0.003280463146396999,32,33,COMPLETE
540,540,0.3006127213781991,2023-06-10 16:26:02.894256,2023-06-10 16:26:03.860329,0 days 00:00:00.966073,0.08062934017105164,,7,Lossguide,837,27.500464636018243,0.05334423557277819,32,31,COMPLETE
541,541,0.3646443930362978,2023-06-10 16:26:03.861127,2023-06-10 16:26:04.794594,0 days 00:00:00.933467,0.029678649354530618,,7,Lossguide,769,66.18021264206894,0.06341085653557683,3,90,COMPLETE
542,542,0.4781930917699597,2023-06-10 16:26:04.795243,2023-06-10 16:26:05.712538,0 days 00:00:00.917295,0.03936218313531558,,7,Lossguide,1034,0.14310984539750568,0.00843831302362001,4,98,COMPLETE
543,543,0.5327708306133009,2023-06-10 16:26:05.713197,2023-06-10 16:26:06.452435,0 days 00:00:00.739238,0.02543956861150857,,7,Lossguide,733,1.7628021387110044e-05,0.03915152155125564,32,2,COMPLETE
544,544,0.5271218415556653,2023-06-10 16:26:06.453099,2023-06-10 16:26:07.132525,0 days 00:00:00.679426,0.033404786420884916,,7,Lossguide,903,2.582977138382461e-05,0.07661930361437912,32,100,COMPLETE
545,545,0.3095455439626936,2023-06-10 16:26:07.133294,2023-06-10 16:26:09.306094,0 days 00:00:02.172800,0.05686167293765087,,6,Lossguide,952,16.609249278508678,0.006279839089017047,32,96,COMPLETE
546,546,0.36749529054250146,2023-06-10 16:26:09.306894,2023-06-10 16:26:10.128732,0 days 00:00:00.821838,2.7278349442153016,,7,Lossguide,925,0.005206248008771379,0.03547896694369246,32,54,COMPLETE
547,547,0.6726830221486755,2023-06-10 16:26:10.129495,2023-06-10 16:26:10.853743,0 days 00:00:00.724248,0.015373657227614601,,7,Lossguide,978,7.980260958186909e-06,0.1478702459218199,2,46,COMPLETE
548,548,0.3155730161484795,2023-06-10 16:26:10.854523,2023-06-10 16:26:11.614296,0 days 00:00:00.759773,0.09697067300130724,,7,Lossguide,802,38.337130085027184,0.22014446310372468,32,98,COMPLETE
549,549,0.3224143451507848,2023-06-10 16:26:11.615074,2023-06-10 16:26:16.050516,0 days 00:00:04.435442,0.9898984616710617,,7,Lossguide,890,4.107744722419008,0.0014668671370516176,32,49,COMPLETE
