,number,value,datetime_start,datetime_complete,duration,params_bagging_temperature,params_boosting_type,params_depth,params_grow_policy,params_iterations,params_l2_leaf_reg,params_learning_rate,params_max_bin,params_random_strength,state
858,858,0.28355868600235407,2023-06-10 16:55:24.000310,2023-06-10 16:55:25.625604,0 days 00:00:01.625294,0.04600440407377392,Plain,4,SymmetricTree,803,1.889665860794245,0.010379374502202455,32,3,COMPLETE
859,859,0.2833306359200838,2023-06-10 16:55:25.626457,2023-06-10 16:55:28.763753,0 days 00:00:03.137296,0.05056554772103446,Ordered,4,SymmetricTree,773,13.665199326816921,0.0430228274668934,64,14,COMPLETE
860,860,0.27584743868555,2023-06-10 16:55:28.764616,2023-06-10 16:55:29.995624,0 days 00:00:01.231008,16.026611901622243,Plain,4,SymmetricTree,892,24.625160511657377,0.07709202995526743,32,11,COMPLETE
861,861,0.23880341980037204,2023-06-10 16:55:29.996607,2023-06-10 16:55:30.967884,0 days 00:00:00.971277,4.302597526347686,Plain,4,SymmetricTree,667,9.235371979031738,0.10688920821014243,20,6,COMPLETE
862,862,0.42919130863496757,2023-06-10 16:55:30.968678,2023-06-10 16:55:31.562872,0 days 00:00:00.594194,4.357794625956151,Plain,4,SymmetricTree,662,0.005786936869823188,0.10889721595817457,20,0,COMPLETE
863,863,0.26342713092816616,2023-06-10 16:55:31.563596,2023-06-10 16:55:32.493584,0 days 00:00:00.929988,5.294929235232063,Plain,4,SymmetricTree,674,4.909607583372845,0.12094045473770412,20,4,COMPLETE
864,864,0.46405530298837017,2023-06-10 16:55:32.494380,2023-06-10 16:55:33.112341,0 days 00:00:00.617961,5.01565901977756,,4,Depthwise,634,0.0642628865634043,0.13600121674769194,20,2,COMPLETE
865,865,0.3035951394166086,2023-06-10 16:55:33.113107,2023-06-10 16:55:33.830892,0 days 00:00:00.717785,0.010118721354831117,Plain,4,SymmetricTree,646,11.23771359642027,0.10119046531992332,20,5,COMPLETE
866,866,0.3030946832702599,2023-06-10 16:55:33.831679,2023-06-10 16:55:34.813389,0 days 00:00:00.981710,4.090568076027608,Plain,4,SymmetricTree,620,7.458635578636915,0.12013284474985314,20,57,COMPLETE
867,867,0.2888917474184473,2023-06-10 16:55:34.814244,2023-06-10 16:55:35.574824,0 days 00:00:00.760580,3.3255301807367545,Plain,4,SymmetricTree,665,9.08213292494002,0.29801421296140124,20,6,COMPLETE
868,868,0.27332926026220417,2023-06-10 16:55:35.575774,2023-06-10 16:55:36.571108,0 days 00:00:00.995334,4.731529966593563,Plain,4,SymmetricTree,684,16.135952723291677,0.09272244242754682,20,3,COMPLETE
869,869,0.4533850319778712,2023-06-10 16:55:36.571997,2023-06-10 16:55:38.323720,0 days 00:00:01.751723,6.709779113361404,Plain,4,SymmetricTree,699,1.3593379757068574e-05,0.002297480129981876,20,7,COMPLETE
870,870,0.4808830260290495,2023-06-10 16:55:38.324608,2023-06-10 16:55:39.904130,0 days 00:00:01.579522,3.3602599660238823,Plain,4,SymmetricTree,638,19.936266353645355,0.0022670864142240736,64,5,COMPLETE
871,871,0.31954295790735293,2023-06-10 16:55:39.904924,2023-06-10 16:55:40.768086,0 days 00:00:00.863162,2.968120638593525,Plain,4,SymmetricTree,659,3.229984542720834,0.1063531030281767,20,77,COMPLETE
872,872,0.2994245262750842,2023-06-10 16:55:40.768962,2023-06-10 16:55:42.000711,0 days 00:00:01.231749,3.907873230675191,Plain,5,SymmetricTree,679,10.956427603655413,0.13258332915796048,20,7,COMPLETE
873,873,0.4530293145558979,2023-06-10 16:55:42.001600,2023-06-10 16:55:42.734735,0 days 00:00:00.733135,0.032507120912170194,,4,Lossguide,696,0.6365353799525981,0.1444660006789878,20,2,COMPLETE
874,874,0.4562976829882362,2023-06-10 16:55:42.735515,2023-06-10 16:55:44.353857,0 days 00:00:01.618342,2.4998777181197944,Plain,4,SymmetricTree,657,5.712967828920869,0.003963967048723085,20,43,COMPLETE
875,875,0.44312182893461594,2023-06-10 16:55:44.354661,2023-06-10 16:55:44.985649,0 days 00:00:00.630988,3.0575889013929904,Plain,4,SymmetricTree,606,0.00048648401511816207,0.09519747323492175,20,8,COMPLETE
876,876,0.517369060905167,2023-06-10 16:55:44.986464,2023-06-10 16:55:46.792068,0 days 00:00:01.805604,6.025710816272688,Plain,4,SymmetricTree,715,0.011230611775547098,0.0011900203120152107,20,5,COMPLETE
877,877,0.4781806256728955,2023-06-10 16:55:46.792884,2023-06-10 16:55:47.413985,0 days 00:00:00.621101,4.439321156243856,Plain,4,SymmetricTree,300,0.0013439097237486445,0.11524244786018163,10,9,COMPLETE
878,878,0.3585602654748614,2023-06-10 16:55:47.414799,2023-06-10 16:55:48.435423,0 days 00:00:01.020624,0.03383300132497727,Plain,4,SymmetricTree,685,30.792185887703678,0.03937840579030173,3,0,COMPLETE
879,879,0.4513292008640415,2023-06-10 16:55:48.436196,2023-06-10 16:55:50.084104,0 days 00:00:01.647908,0.11168362202589775,Plain,4,SymmetricTree,629,16.3697126284982,0.0015439677991841818,64,5,COMPLETE
880,880,0.4128975549528422,2023-06-10 16:55:50.084984,2023-06-10 16:55:54.356336,0 days 00:00:04.271352,2.202160434606011,Ordered,4,SymmetricTree,730,4.862336932679376e-07,0.0076970821397028865,5,3,COMPLETE
881,881,0.2636537663455507,2023-06-10 16:55:54.357123,2023-06-10 16:55:56.450392,0 days 00:00:02.093269,3.6568139244137483,Plain,6,SymmetricTree,667,39.44329758465912,0.04499610270611809,20,8,COMPLETE
882,882,0.7729870852988983,2023-06-10 16:55:56.451188,2023-06-10 16:55:57.039035,0 days 00:00:00.587847,2.6858592292269323,Plain,5,SymmetricTree,703,2.0146911476599058e-05,0.20844437978619468,64,11,COMPLETE
883,883,0.38868305784827567,2023-06-10 16:55:57.039772,2023-06-10 16:55:57.859970,0 days 00:00:00.820198,2.104167719018039,Plain,4,SymmetricTree,645,4.065700086934737e-06,0.019000782441187962,64,6,COMPLETE
884,884,0.29200311561331416,2023-06-10 16:55:57.860733,2023-06-10 16:55:59.104428,0 days 00:00:01.243695,1.7188538831847426,Plain,4,SymmetricTree,681,24.352869328376226,0.05443598550655393,4,9,COMPLETE
885,885,0.37662245694630136,2023-06-10 16:55:59.105249,2023-06-10 16:56:00.940711,0 days 00:00:01.835462,2.4606967736757634,Plain,4,SymmetricTree,715,0.004767437613969477,0.003987069757301171,20,4,COMPLETE
886,886,0.34580414136607396,2023-06-10 16:56:00.941500,2023-06-10 16:56:01.897316,0 days 00:00:00.955816,0.6723848932589285,,4,Depthwise,738,10.259690856470915,0.03447469968408026,64,16,COMPLETE
887,887,0.26139584088181655,2023-06-10 16:56:01.898116,2023-06-10 16:56:03.481229,0 days 00:00:01.583113,1.4563523327266337,Plain,4,SymmetricTree,667,18.265745805590353,0.0294787566952677,64,7,COMPLETE
888,888,0.4401667150468618,2023-06-10 16:56:03.481981,2023-06-10 16:56:04.197027,0 days 00:00:00.715046,2.9886523067717206,Plain,4,SymmetricTree,696,5.88527671851643e-06,0.04801201779529714,20,13,COMPLETE
889,889,0.3013462083224906,2023-06-10 16:56:04.197821,2023-06-10 16:56:05.337893,0 days 00:00:01.140072,1.9575273672194968,Plain,4,SymmetricTree,730,41.66647247000156,0.16366953976742488,64,50,COMPLETE
890,890,0.5790612320897647,2023-06-10 16:56:05.338688,2023-06-10 16:56:06.011453,0 days 00:00:00.672765,1.0018402377027875,Plain,8,SymmetricTree,1033,1.171651810615884e-06,0.04088962921792425,2,2,COMPLETE
891,891,0.5715241073879016,2023-06-10 16:56:06.012257,2023-06-10 16:56:06.611657,0 days 00:00:00.599400,3.6945814544162165,Plain,4,SymmetricTree,752,1.9122566170891186e-08,0.1033034180470914,32,10,COMPLETE
892,892,0.36507915531890445,2023-06-10 16:56:06.612431,2023-06-10 16:56:07.527968,0 days 00:00:00.915537,8.308304292018834,Plain,4,SymmetricTree,645,0.18841113771541265,0.05051611357108819,20,6,COMPLETE
893,893,0.2829313215163386,2023-06-10 16:56:07.528752,2023-06-10 16:56:09.323285,0 days 00:00:01.794533,10.65369750795595,Plain,4,SymmetricTree,687,56.75405002675367,0.03734343012199841,64,8,COMPLETE
894,894,0.6586405439026471,2023-06-10 16:56:09.324092,2023-06-10 16:56:09.894582,0 days 00:00:00.570490,81.81574485564991,Plain,4,SymmetricTree,706,12.640046155779219,0.18237224705987584,32,19,COMPLETE
895,895,0.42547489118303716,2023-06-10 16:56:09.895448,2023-06-10 16:56:11.972130,0 days 00:00:02.076682,0.04273036886811852,,4,Lossguide,615,6.54236675470036,0.002461974570410248,32,12,COMPLETE
896,896,0.2877299683231508,2023-06-10 16:56:11.972925,2023-06-10 16:56:12.889132,0 days 00:00:00.916207,1.307049929644788,Plain,4,SymmetricTree,721,27.487327770443407,0.09226936209796784,10,4,COMPLETE
897,897,0.2958018789997668,2023-06-10 16:56:12.889963,2023-06-10 16:56:14.261988,0 days 00:00:01.372025,0.021424027147850355,Plain,4,SymmetricTree,672,98.72602576543852,0.08457092362151272,64,10,COMPLETE
898,898,0.34672448883847823,2023-06-10 16:56:14.262892,2023-06-10 16:56:14.929414,0 days 00:00:00.666522,2.302906947782643,Plain,4,SymmetricTree,653,2.808173639917029,0.22518338404003296,3,6,COMPLETE
899,899,0.2587637530343476,2023-06-10 16:56:14.930378,2023-06-10 16:56:16.206192,0 days 00:00:01.275814,1.6984104130352407,Plain,4,SymmetricTree,747,22.77113003298603,0.06017664592422114,32,1,COMPLETE
900,900,0.30315819872801963,2023-06-10 16:56:16.207068,2023-06-10 16:56:17.185789,0 days 00:00:00.978721,5.271106076638909,Plain,4,SymmetricTree,633,1.2125985505771248,0.04269261720045948,20,8,COMPLETE
901,901,0.4777762649262163,2023-06-10 16:56:17.186593,2023-06-10 16:56:19.572001,0 days 00:00:02.385408,2.966576338554997,Ordered,4,SymmetricTree,585,1.005814444195142e-08,0.012876031383726786,32,11,COMPLETE
902,902,0.6450041045685623,2023-06-10 16:56:19.572909,2023-06-10 16:56:20.162345,0 days 00:00:00.589436,1.9863103780064004,Plain,4,SymmetricTree,693,5.978515985902866e-07,0.12330489337917212,5,3,COMPLETE
903,903,0.268492074734639,2023-06-10 16:56:20.163310,2023-06-10 16:56:21.495821,0 days 00:00:01.332511,0.07852716071767188,Plain,4,SymmetricTree,726,39.92954683522414,0.054016150509940665,64,7,COMPLETE
904,904,0.29658642008198727,2023-06-10 16:56:21.496699,2023-06-10 16:56:22.270149,0 days 00:00:00.773450,0.15570795271478527,Plain,4,SymmetricTree,755,0.09858644451173999,0.04546612035404627,32,9,COMPLETE
905,905,0.3629470962364747,2023-06-10 16:56:22.271046,2023-06-10 16:56:22.982507,0 days 00:00:00.711461,0.7912938903967084,Plain,4,SymmetricTree,680,0.061915953393156045,0.14959611982144694,4,14,COMPLETE
906,906,0.2648835410652302,2023-06-10 16:56:22.983315,2023-06-10 16:56:24.527195,0 days 00:00:01.543880,1.4207431660676861,Plain,4,SymmetricTree,869,13.406842710269489,0.031258088069316126,32,5,COMPLETE
907,907,0.38857160644039607,2023-06-10 16:56:24.527972,2023-06-10 16:56:25.385542,0 days 00:00:00.857570,0.3017111646248611,Plain,4,SymmetricTree,703,0.00026046178706675343,0.02522704806374777,64,12,COMPLETE
908,908,0.5115618959952545,2023-06-10 16:56:25.386399,2023-06-10 16:56:25.988734,0 days 00:00:00.602335,2.3117573722015,,4,Depthwise,737,6.286751079115068e-05,0.11322815036259797,20,9,COMPLETE
909,909,0.423012313211232,2023-06-10 16:56:25.989524,2023-06-10 16:56:26.622783,0 days 00:00:00.633259,4.11819624920686,Plain,4,SymmetricTree,667,2.6082313518812376e-07,0.06706351682741625,32,4,COMPLETE
910,910,0.25965048071145275,2023-06-10 16:56:26.623522,2023-06-10 16:56:28.356856,0 days 00:00:01.733334,1.1015198936931785,Plain,4,SymmetricTree,716,62.66952554967774,0.050456566279193794,32,6,COMPLETE
911,911,0.27378950556130627,2023-06-10 16:56:28.357628,2023-06-10 16:56:29.613126,0 days 00:00:01.255498,1.6600447296546796,Plain,4,SymmetricTree,763,7.8673551304443095,0.03919567124599366,64,0,COMPLETE
912,912,0.27314316529516364,2023-06-10 16:56:29.613881,2023-06-10 16:56:30.923844,0 days 00:00:01.309963,2.6323728101712405,Plain,4,SymmetricTree,654,29.010846123527966,0.08545282040435667,32,8,COMPLETE
913,913,0.26143057727878727,2023-06-10 16:56:30.924744,2023-06-10 16:56:32.052631,0 days 00:00:01.127887,3.4758643066537585,Plain,4,SymmetricTree,622,17.648234693440035,0.061782575887159595,20,10,COMPLETE
914,914,0.296956900849373,2023-06-10 16:56:32.053524,2023-06-10 16:56:33.458482,0 days 00:00:01.404958,0.028196449184402513,Plain,4,SymmetricTree,695,37.99713794010182,0.015465931097471991,32,2,COMPLETE
915,915,0.2802895159761935,2023-06-10 16:56:33.459265,2023-06-10 16:56:35.451868,0 days 00:00:01.992603,1.8868464622062333,Plain,5,SymmetricTree,737,65.26699696532498,0.0345274250562011,64,7,COMPLETE
916,916,0.3916439367907847,2023-06-10 16:56:35.452755,2023-06-10 16:56:36.149798,0 days 00:00:00.697043,1.2711032403659082,Plain,4,SymmetricTree,679,2.708815433069746e-06,0.0453658587752086,32,4,COMPLETE
917,917,0.31799514879297375,2023-06-10 16:56:36.150679,2023-06-10 16:56:36.936408,0 days 00:00:00.785729,1.5549809982703668,,4,Lossguide,715,5.128303831556474,0.07205632703546926,32,12,COMPLETE
918,918,0.5207490240688756,2023-06-10 16:56:36.937182,2023-06-10 16:56:38.930613,0 days 00:00:01.993431,0.01898586990695877,Plain,4,SymmetricTree,855,2.631399754075616e-05,0.0013208688203012117,2,6,COMPLETE
919,919,0.3498225977956124,2023-06-10 16:56:38.931452,2023-06-10 16:56:39.732133,0 days 00:00:00.800681,0.13466297757789372,Plain,4,SymmetricTree,603,0.003797019769529159,0.02218493038840848,64,10,COMPLETE
920,920,0.35868353458313107,2023-06-10 16:56:39.732865,2023-06-10 16:56:41.230035,0 days 00:00:01.497170,27.219212945133787,Plain,4,SymmetricTree,563,21.677609896620346,0.017361864131543402,20,15,COMPLETE
921,921,0.4237604019384871,2023-06-10 16:56:41.230782,2023-06-10 16:56:42.918919,0 days 00:00:01.688137,2.228764053335739,Plain,4,SymmetricTree,648,12.4404867925526,0.0032714799863280846,32,7,COMPLETE
922,922,0.28363216158780313,2023-06-10 16:56:42.919791,2023-06-10 16:56:47.095640,0 days 00:00:04.175849,0.9996620556108461,Ordered,4,SymmetricTree,752,34.000251212012756,0.053375293824248465,32,4,COMPLETE
923,923,0.30701027136296777,2023-06-10 16:56:47.096456,2023-06-10 16:56:47.968427,0 days 00:00:00.871971,10.090683491977762,Plain,4,SymmetricTree,783,9.14999413930321,0.13761866336807843,64,9,COMPLETE
924,924,0.24619118038421164,2023-06-10 16:56:47.969315,2023-06-10 16:56:49.447583,0 days 00:00:01.478268,6.113101883726584,Plain,4,SymmetricTree,666,50.23713834319366,0.10591226539450302,32,12,COMPLETE
925,925,0.27136434695328315,2023-06-10 16:56:49.448477,2023-06-10 16:56:50.941394,0 days 00:00:01.492917,7.400662947198525,Plain,4,SymmetricTree,697,68.07579109472066,0.10649915801941615,10,18,COMPLETE
926,926,0.4168096471921561,2023-06-10 16:56:50.942158,2023-06-10 16:56:51.731221,0 days 00:00:00.789063,6.819944642583463,Plain,4,SymmetricTree,680,0.025214054139929384,0.09885676739656261,32,16,COMPLETE
927,927,0.3509033645427718,2023-06-10 16:56:51.731998,2023-06-10 16:56:52.465093,0 days 00:00:00.733095,8.737156020842066,Plain,4,SymmetricTree,709,0.44668336345448933,0.11412496894087698,20,23,COMPLETE
928,928,0.6187934649833262,2023-06-10 16:56:52.465897,2023-06-10 16:56:53.159654,0 days 00:00:00.693757,4.578870840576626,Plain,7,SymmetricTree,725,0.00024387506394951182,0.10431354773889251,64,2,COMPLETE
929,929,0.2879972573002122,2023-06-10 16:56:53.160501,2023-06-10 16:56:54.117197,0 days 00:00:00.956696,6.766078608435095,Plain,4,SymmetricTree,668,67.6620569138886,0.1260888454515148,32,14,COMPLETE
930,930,0.2921213086345258,2023-06-10 16:56:54.118003,2023-06-10 16:56:54.974963,0 days 00:00:00.856960,0.5042979763468519,Plain,4,SymmetricTree,692,44.30273939053405,0.08696499877450306,32,13,COMPLETE
931,931,0.30001571558260337,2023-06-10 16:56:54.975756,2023-06-10 16:56:56.431590,0 days 00:00:01.455834,0.4653091771972662,Plain,4,SymmetricTree,670,97.41166420619594,0.08122782976235667,64,6,COMPLETE
932,932,0.34669117383415915,2023-06-10 16:56:56.432377,2023-06-10 16:56:58.578829,0 days 00:00:02.146452,1.3397547319972987,,4,Depthwise,769,45.92903440236643,0.004496574960628393,3,8,COMPLETE
933,933,0.3581970962055089,2023-06-10 16:56:58.579673,2023-06-10 16:57:03.794212,0 days 00:00:05.214539,5.748243867869823,Plain,10,SymmetricTree,707,30.265005223412466,0.09866073081044158,32,11,COMPLETE
934,934,0.5116281620066433,2023-06-10 16:57:03.795292,2023-06-10 16:57:05.599357,0 days 00:00:01.804065,5.859160414236985,Plain,4,SymmetricTree,737,50.99404276079171,0.002565015224980055,5,4,COMPLETE
935,935,0.3287457100511997,2023-06-10 16:57:05.600267,2023-06-10 16:57:06.399223,0 days 00:00:00.798956,13.06427240221129,Plain,4,SymmetricTree,690,22.310923508934962,0.13453517333800202,20,9,COMPLETE
936,936,0.31288636030136335,2023-06-10 16:57:06.400088,2023-06-10 16:57:07.348308,0 days 00:00:00.948220,7.99178375686254,Plain,4,SymmetricTree,1066,34.350382198391245,0.09356170631636382,32,2,COMPLETE
937,937,0.46003565371686633,2023-06-10 16:57:07.349177,2023-06-10 16:57:07.936280,0 days 00:00:00.587103,1.845582864263823,Plain,4,SymmetricTree,718,0.00033881563342013385,0.1179284452749638,64,0,COMPLETE
938,938,0.3029274632349751,2023-06-10 16:57:07.937165,2023-06-10 16:57:08.747882,0 days 00:00:00.810717,1.5704409198765796,Plain,4,SymmetricTree,752,15.832551957897326,0.1609284596346267,4,5,COMPLETE
939,939,0.364932405547208,2023-06-10 16:57:08.748770,2023-06-10 16:57:10.438988,0 days 00:00:01.690218,5.959435466230842,,6,Lossguide,660,0.21139082602457177,0.009095075453226234,32,11,COMPLETE
940,940,0.25698934170654386,2023-06-10 16:57:10.439907,2023-06-10 16:57:12.123511,0 days 00:00:01.683604,1.1334680034921643,Plain,4,SymmetricTree,843,69.42491730520214,0.07588106037317269,64,8,COMPLETE
941,941,0.3846089142215556,2023-06-10 16:57:12.124412,2023-06-10 16:57:13.449093,0 days 00:00:01.324681,9.190005508862729,Plain,4,SymmetricTree,678,0.010623687732601857,0.011688916164285953,20,13,COMPLETE
942,942,0.30397337523094614,2023-06-10 16:57:13.449994,2023-06-10 16:57:14.306906,0 days 00:00:00.856912,1.8655809200852014,Plain,4,SymmetricTree,777,0.9411834327863106,0.11029499066517166,32,88,COMPLETE
943,943,0.37058566922862246,2023-06-10 16:57:14.307665,2023-06-10 16:57:15.474943,0 days 00:00:01.167278,0.7432263746390908,Ordered,4,SymmetricTree,729,0.0010729563888507562,0.18064077101806938,32,6,COMPLETE
944,944,0.2767932576790119,2023-06-10 16:57:15.475746,2023-06-10 16:57:16.494026,0 days 00:00:01.018280,1.4436412380888073,Plain,4,SymmetricTree,696,3.74832042792198,0.09015033579886757,64,10,COMPLETE
945,945,0.3710911344677029,2023-06-10 16:57:16.494794,2023-06-10 16:57:18.358199,0 days 00:00:01.863405,32.92279143838674,Plain,4,SymmetricTree,760,24.285299798915393,0.02744872199270874,32,7,COMPLETE
946,946,0.39596994131444013,2023-06-10 16:57:18.358976,2023-06-10 16:57:19.010905,0 days 00:00:00.651929,2.183694234996846,Plain,4,SymmetricTree,821,0.047581786161551676,0.15327686636971288,20,3,COMPLETE
947,947,0.34919844620638313,2023-06-10 16:57:19.011716,2023-06-10 16:57:19.680083,0 days 00:00:00.668367,0.060080517125547454,Plain,4,SymmetricTree,714,0.004243095049154679,0.06570081284172992,32,5,COMPLETE
948,948,0.31792938214533284,2023-06-10 16:57:19.680892,2023-06-10 16:57:20.352123,0 days 00:00:00.671231,0.041902912179515965,Plain,4,SymmetricTree,791,2.3673403855186517,0.12846440319553554,64,8,COMPLETE
949,949,0.526242500195275,2023-06-10 16:57:20.352877,2023-06-10 16:57:22.425054,0 days 00:00:02.072177,0.22411854018716007,Plain,4,SymmetricTree,886,0.0005871290475315831,0.0015347871740188064,2,12,COMPLETE
950,950,0.5221034550986091,2023-06-10 16:57:22.425906,2023-06-10 16:57:24.098166,0 days 00:00:01.672260,4.712372776691714,Plain,4,SymmetricTree,656,0.0021743808497183856,0.001639294400878886,32,39,COMPLETE
951,951,0.35219817484415356,2023-06-10 16:57:24.099010,2023-06-10 16:57:24.861572,0 days 00:00:00.762562,0.040697326190123034,Plain,4,SymmetricTree,740,0.020701181264170095,0.05852427376416227,32,10,COMPLETE
952,952,0.30324448149230043,2023-06-10 16:57:24.862836,2023-06-10 16:57:25.986363,0 days 00:00:01.123527,0.8676060960358555,,5,Depthwise,681,46.206866689305116,0.07532521662627407,64,6,COMPLETE
953,953,0.31763211437749106,2023-06-10 16:57:25.987294,2023-06-10 16:57:26.602392,0 days 00:00:00.615098,0.16261586917523338,Plain,4,SymmetricTree,701,13.062335341880377,0.2582999576634847,20,3,COMPLETE
954,954,0.31318598218325816,2023-06-10 16:57:26.603241,2023-06-10 16:57:27.501969,0 days 00:00:00.898728,0.09548419564136514,Plain,4,SymmetricTree,667,99.54853501113068,0.09864273089655996,32,8,COMPLETE
955,955,0.28245304419746153,2023-06-10 16:57:27.502821,2023-06-10 16:57:28.639705,0 days 00:00:01.136884,2.6443442071401955,Plain,4,SymmetricTree,638,32.204487062183915,0.11255676131568214,32,13,COMPLETE
956,956,0.6270366234126845,2023-06-10 16:57:28.640600,2023-06-10 16:57:29.257247,0 days 00:00:00.616647,1.2086245372426545,Plain,4,SymmetricTree,722,3.788194812766142e-08,0.19441323001651664,64,16,COMPLETE
957,957,0.30888534800343037,2023-06-10 16:57:29.258041,2023-06-10 16:57:30.108739,0 days 00:00:00.850698,1.6599748472092666,Plain,4,SymmetricTree,765,0.3755646964122643,0.05057576420686602,10,5,COMPLETE
958,958,0.4572207457987512,2023-06-10 16:57:30.109541,2023-06-10 16:57:31.924540,0 days 00:00:01.814999,2.0260918818001943,Plain,4,SymmetricTree,737,7.853491229526925,0.002254028805214043,32,10,COMPLETE
959,959,0.44474815209777974,2023-06-10 16:57:31.925408,2023-06-10 16:57:33.637079,0 days 00:00:01.711671,1.3617926352803766,Plain,4,SymmetricTree,682,18.118528736201448,0.0013466842359445633,20,0,COMPLETE
960,960,0.2870624615484422,2023-06-10 16:57:33.637958,2023-06-10 16:57:36.535891,0 days 00:00:02.897933,1.7248149543921543,Plain,7,SymmetricTree,809,48.44498730211106,0.08211407818900514,32,7,COMPLETE
961,961,0.5263953705367248,2023-06-10 16:57:36.536834,2023-06-10 16:57:37.154338,0 days 00:00:00.617504,2.386320160357393,,4,Lossguide,866,7.634388454103273e-07,0.06813725449548495,3,9,COMPLETE
962,962,0.3249667800256446,2023-06-10 16:57:37.155129,2023-06-10 16:57:38.554506,0 days 00:00:01.399377,20.688978031203987,Plain,4,SymmetricTree,708,26.289369612223478,0.056281735622389466,64,2,COMPLETE
963,963,0.334925935876376,2023-06-10 16:57:38.555342,2023-06-10 16:57:40.393857,0 days 00:00:01.838515,1.0068574577321423,Plain,4,SymmetricTree,745,0.08110392443952286,0.004771428267037143,32,4,COMPLETE
964,964,0.30288846941670255,2023-06-10 16:57:40.394773,2023-06-10 16:57:41.417795,0 days 00:00:01.023022,0.013049404705809696,Plain,4,SymmetricTree,788,1.4680897585273298,0.03845791062253956,32,11,COMPLETE
