,number,value,datetime_start,datetime_complete,duration,params_bagging_temperature,params_boosting_type,params_depth,params_grow_policy,params_iterations,params_l2_leaf_reg,params_learning_rate,params_max_bin,params_random_strength,state
430,430,0.3564450980587238,2023-06-10 16:45:55.469775,2023-06-10 16:45:56.281321,0 days 00:00:00.811546,1.8733257880907532,Plain,4,SymmetricTree,887,0.012962775640766666,0.04295790002613031,32,2,COMPLETE
431,431,0.2754757181221925,2023-06-10 16:45:56.282037,2023-06-10 16:45:57.808138,0 days 00:00:01.526101,6.894800172460911,Plain,4,SymmetricTree,613,30.81804250238192,0.057775743260162514,64,8,COMPLETE
432,432,0.28813786691458804,2023-06-10 16:45:57.809007,2023-06-10 16:45:59.360261,0 days 00:00:01.551254,3.17388637028324,Plain,4,SymmetricTree,576,64.27927391768142,0.021485120025644237,32,5,COMPLETE
433,433,0.27542480310753414,2023-06-10 16:45:59.360959,2023-06-10 16:46:00.317554,0 days 00:00:00.956595,1.3998208244186727,Plain,4,SymmetricTree,729,12.71186973921939,0.18819603905671314,32,11,COMPLETE
434,434,0.35832874546864835,2023-06-10 16:46:00.318258,2023-06-10 16:46:01.509639,0 days 00:00:01.191381,2.5688399980817844,Plain,4,SymmetricTree,825,0.017896507996340526,0.024320153205443673,10,9,COMPLETE
435,435,0.2641110358851314,2023-06-10 16:46:01.510417,2023-06-10 16:46:02.835926,0 days 00:00:01.325509,1.1055275061309067,Plain,4,SymmetricTree,664,5.612521531372413,0.03325908913220404,64,14,COMPLETE
436,436,0.26826059149891923,2023-06-10 16:46:02.836746,2023-06-10 16:46:04.200861,0 days 00:00:01.364115,4.304130738584271,Plain,4,SymmetricTree,703,29.6821276096115,0.07178428047127874,32,7,COMPLETE
437,437,0.6117917096476857,2023-06-10 16:46:04.201624,2023-06-10 16:46:05.444692,0 days 00:00:01.243068,1.6578507528645596,Ordered,6,SymmetricTree,759,0.008290252384050576,0.22446753805475345,20,5,COMPLETE
438,438,0.44879730438503806,2023-06-10 16:46:05.445378,2023-06-10 16:46:06.056720,0 days 00:00:00.611342,0.02269436923902458,Plain,4,SymmetricTree,677,0.13983695661968892,0.10312061999950156,3,11,COMPLETE
439,439,0.2656478207375551,2023-06-10 16:46:06.057361,2023-06-10 16:46:07.481158,0 days 00:00:01.423797,2.171714058211617,Plain,4,SymmetricTree,736,18.252863659942346,0.051881122579315764,64,2,COMPLETE
440,440,0.3979148973356672,2023-06-10 16:46:07.481889,2023-06-10 16:46:08.256775,0 days 00:00:00.774886,1.2481720431954129,Plain,4,SymmetricTree,715,0.0001873882815108176,0.036842704175370694,5,9,COMPLETE
441,441,0.29672647824295934,2023-06-10 16:46:08.257430,2023-06-10 16:46:09.466110,0 days 00:00:01.208680,0.7297919232608989,,4,Depthwise,791,46.87182799728945,0.06138901112597377,32,7,COMPLETE
442,442,0.3799812501984454,2023-06-10 16:46:09.466976,2023-06-10 16:46:10.243642,0 days 00:00:00.776666,9.056800309552045,Plain,4,SymmetricTree,691,4.027671770832223,0.2548947624478438,32,22,COMPLETE
443,443,0.2979450662566705,2023-06-10 16:46:10.244434,2023-06-10 16:46:12.156604,0 days 00:00:01.912170,2.7988604445490113,Plain,4,SymmetricTree,748,8.30347818234356,0.013311321908634852,64,18,COMPLETE
444,444,0.4616922177928091,2023-06-10 16:46:12.157377,2023-06-10 16:46:12.802015,0 days 00:00:00.644638,0.059603752525760265,Plain,5,SymmetricTree,773,0.00030759342951673885,0.04405993169583186,4,4,COMPLETE
445,445,0.30744854924315684,2023-06-10 16:46:12.802813,2023-06-10 16:46:13.795330,0 days 00:00:00.992517,0.1126316091542402,Plain,4,SymmetricTree,714,67.31695727909293,0.05341928009163679,32,12,COMPLETE
446,446,0.29315645433468174,2023-06-10 16:46:13.796084,2023-06-10 16:46:14.925288,0 days 00:00:01.129204,1.9052404386079578,Plain,4,SymmetricTree,646,1.9237715825899189,0.041642987297895645,64,6,COMPLETE
447,447,0.3006480226688836,2023-06-10 16:46:14.926017,2023-06-10 16:46:16.288241,0 days 00:00:01.362224,1.5073154317661477,Plain,4,SymmetricTree,671,0.7471405758866086,0.02693291956442157,32,56,COMPLETE
448,448,0.26485816586047306,2023-06-10 16:46:16.288935,2023-06-10 16:46:17.749230,0 days 00:00:01.460295,5.5780439171166245,Plain,4,SymmetricTree,693,21.704682653561886,0.047644081179451174,32,8,COMPLETE
449,449,0.26954861660623985,2023-06-10 16:46:17.749893,2023-06-10 16:46:18.589967,0 days 00:00:00.840074,0.9752417819095163,Plain,4,SymmetricTree,733,12.384350679214212,0.11198468388933544,64,10,COMPLETE
450,450,0.3370783376727409,2023-06-10 16:46:18.590774,2023-06-10 16:46:19.540482,0 days 00:00:00.949708,2.285181668059254,,4,Lossguide,711,39.254957476045554,0.06908030908523362,32,0,COMPLETE
451,451,0.5291386136399747,2023-06-10 16:46:19.541278,2023-06-10 16:46:20.166657,0 days 00:00:00.625379,3.4994934889748244,Plain,4,SymmetricTree,810,0.0351077000512766,0.28297682210731523,64,13,COMPLETE
452,452,0.3786940774894157,2023-06-10 16:46:20.167467,2023-06-10 16:46:21.006484,0 days 00:00:00.839017,11.299105215668481,Plain,4,SymmetricTree,754,0.3663495205635577,0.0612299982707773,32,74,COMPLETE
453,453,0.2685903061771011,2023-06-10 16:46:21.007180,2023-06-10 16:46:21.931411,0 days 00:00:00.924231,0.5581807670038214,Plain,4,SymmetricTree,684,26.331904357037388,0.07600212971706946,32,5,COMPLETE
454,454,0.2837438795036794,2023-06-10 16:46:21.932104,2023-06-10 16:46:23.061402,0 days 00:00:01.129298,0.1319386944683735,Plain,4,SymmetricTree,660,15.118232492677135,0.03914476879480706,64,9,COMPLETE
455,455,0.2862865202853634,2023-06-10 16:46:23.062226,2023-06-10 16:46:24.905567,0 days 00:00:01.843341,1.6569615418054042,Plain,4,SymmetricTree,727,99.24364623840022,0.030838005977350137,32,3,COMPLETE
456,456,0.3974683422330514,2023-06-10 16:46:24.906275,2023-06-10 16:46:25.807574,0 days 00:00:00.901299,1.277766714651045,Plain,4,SymmetricTree,771,2.9069542256989873,0.05460343743388002,2,7,COMPLETE
457,457,0.27459213365160184,2023-06-10 16:46:25.808299,2023-06-10 16:46:27.346826,0 days 00:00:01.538527,1.9497078110059398,Plain,4,SymmetricTree,703,48.343926786959045,0.047910103907558,64,11,COMPLETE
458,458,0.40362391340309983,2023-06-10 16:46:27.347599,2023-06-10 16:46:29.121014,0 days 00:00:01.773415,2.4893689157551155,Ordered,5,SymmetricTree,741,0.056085388056378485,0.08368515070810448,32,16,COMPLETE
459,459,0.266385461694023,2023-06-10 16:46:29.121717,2023-06-10 16:46:30.576710,0 days 00:00:01.454993,3.0381910751358747,Plain,4,SymmetricTree,793,30.285166507452885,0.06628652555453358,64,6,COMPLETE
460,460,0.2908248065249643,2023-06-10 16:46:30.577522,2023-06-10 16:46:31.414028,0 days 00:00:00.836506,1.485172828972534,Plain,4,SymmetricTree,680,10.13564334883837,0.1436152664508321,32,34,COMPLETE
461,461,0.26720195815869263,2023-06-10 16:46:31.414746,2023-06-10 16:46:32.779119,0 days 00:00:01.364373,0.8795038180691974,Plain,4,SymmetricTree,718,17.245205285834345,0.03661883140933662,32,8,COMPLETE
462,462,0.4231136884575136,2023-06-10 16:46:32.779902,2023-06-10 16:46:33.424688,0 days 00:00:00.644786,1.128009186888446,Plain,4,SymmetricTree,696,0.0002123569624133855,0.09645072368196106,64,10,COMPLETE
463,463,0.29810353515274013,2023-06-10 16:46:33.425417,2023-06-10 16:46:34.429216,0 days 00:00:01.003799,7.93055574844006,Plain,4,SymmetricTree,625,5.458015949728652,0.043663216806964326,10,2,COMPLETE
464,464,0.31237374663008943,2023-06-10 16:46:34.430015,2023-06-10 16:46:35.504500,0 days 00:00:01.074485,3.951265273287257,,4,Depthwise,760,60.84689703098137,0.12932658226532648,32,4,COMPLETE
465,465,0.28483354353480433,2023-06-10 16:46:35.505298,2023-06-10 16:46:37.680277,0 days 00:00:02.174979,2.0145125546087583,Plain,7,SymmetricTree,660,29.003400189508433,0.055523054599824276,64,13,COMPLETE
466,466,0.28458076685639555,2023-06-10 16:46:37.681068,2023-06-10 16:46:38.680710,0 days 00:00:00.999642,0.029278457925142304,Plain,4,SymmetricTree,595,20.804026454286998,0.04846089802522849,32,7,COMPLETE
467,467,0.28528810179964137,2023-06-10 16:46:38.681511,2023-06-10 16:46:39.765752,0 days 00:00:01.084241,0.09655815049302716,Plain,4,SymmetricTree,739,1.3063710398974824,0.03247503123069291,32,9,COMPLETE
468,468,0.3008459502673732,2023-06-10 16:46:39.766472,2023-06-10 16:46:40.831214,0 days 00:00:01.064742,0.013443996691979194,Plain,4,SymmetricTree,714,42.272248273857365,0.06036934787796324,20,5,COMPLETE
469,469,0.3250823881330816,2023-06-10 16:46:40.831970,2023-06-10 16:46:42.168314,0 days 00:00:01.336344,1.7419622430230903,Plain,4,SymmetricTree,693,7.721779127848215,0.039962916931588176,3,11,COMPLETE
470,470,0.4020455399407539,2023-06-10 16:46:42.169085,2023-06-10 16:46:42.884503,0 days 00:00:00.715418,2.6651817072380926,Plain,4,SymmetricTree,378,0.003232307551149894,0.05120994960414803,64,7,COMPLETE
471,471,0.2909428931290173,2023-06-10 16:46:42.885259,2023-06-10 16:46:43.853828,0 days 00:00:00.968569,1.385700256069971,Plain,4,SymmetricTree,783,13.761422695547324,0.1621263116491544,5,9,COMPLETE
472,472,0.4058575943376716,2023-06-10 16:46:43.854596,2023-06-10 16:46:44.527516,0 days 00:00:00.672920,2.3197107782782287,,4,Lossguide,674,0.0016622280559865897,0.07570569180633206,32,4,COMPLETE
473,473,0.27713466969591183,2023-06-10 16:46:44.528169,2023-06-10 16:46:46.357322,0 days 00:00:01.829153,0.3741511476355844,Plain,4,SymmetricTree,727,61.14362874796125,0.022983323217276953,64,6,COMPLETE
474,474,0.5139280569073416,2023-06-10 16:46:46.357955,2023-06-10 16:46:48.220284,0 days 00:00:01.862329,4.81400482949723,Plain,4,SymmetricTree,749,31.988243014791713,0.0024369137597579837,4,14,COMPLETE
475,475,0.24701385980186677,2023-06-10 16:46:48.220965,2023-06-10 16:46:49.938971,0 days 00:00:01.718006,3.3449014393529146,Plain,4,SymmetricTree,646,20.338706149523237,0.044139836609856625,32,11,COMPLETE
476,476,0.3780787821948634,2023-06-10 16:46:49.939741,2023-06-10 16:46:50.840611,0 days 00:00:00.900870,3.4995289806985013,Plain,4,SymmetricTree,637,0.015084623789110713,0.02784552738043752,32,13,COMPLETE
477,477,0.3741783670211183,2023-06-10 16:46:50.841395,2023-06-10 16:46:51.621913,0 days 00:00:00.780518,3.119274083972715,Plain,4,SymmetricTree,625,0.005763421293331451,0.037326659230652294,32,15,COMPLETE
478,478,0.4116968536354679,2023-06-10 16:46:51.622676,2023-06-10 16:46:54.371196,0 days 00:00:02.748520,4.083575096673382,Plain,10,SymmetricTree,662,2.2733917525291267,0.04334468382730436,32,12,COMPLETE
479,479,0.32938166032209026,2023-06-10 16:46:54.371978,2023-06-10 16:46:59.261005,0 days 00:00:04.889027,2.7050294467425497,Ordered,4,SymmetricTree,605,0.18499398515212429,0.019164142836706664,32,11,COMPLETE
480,480,0.32536671125854083,2023-06-10 16:46:59.261733,2023-06-10 16:47:00.911229,0 days 00:00:01.649496,2.0831161316418023,Plain,4,SymmetricTree,666,48.19397781265463,0.011352264865495433,32,9,COMPLETE
481,481,0.37529892400312875,2023-06-10 16:47:00.911932,2023-06-10 16:47:02.521937,0 days 00:00:01.610005,3.48108973922107,Plain,4,SymmetricTree,637,23.718427354865796,0.00695096325225935,32,10,COMPLETE
482,482,0.29901623110720604,2023-06-10 16:47:02.522672,2023-06-10 16:47:03.394848,0 days 00:00:00.872176,1.6808913275630806,Plain,4,SymmetricTree,653,0.2437300777693476,0.04399777703751804,32,1,COMPLETE
483,483,0.25552908589564854,2023-06-10 16:47:03.395603,2023-06-10 16:47:04.763751,0 days 00:00:01.368148,2.4591996000977288,Plain,4,SymmetricTree,643,95.37882689632251,0.1968417801541537,32,7,COMPLETE
484,484,0.5737037088107079,2023-06-10 16:47:04.764477,2023-06-10 16:47:05.510582,0 days 00:00:00.746105,5.543722963895918,Plain,6,SymmetricTree,830,0.008636272627362504,0.06478013766744269,32,84,COMPLETE
485,485,0.30920922057330147,2023-06-10 16:47:05.511303,2023-06-10 16:47:06.758605,0 days 00:00:01.247302,4.357036731426868,,4,Depthwise,680,10.318461202455834,0.032844057218008336,32,3,COMPLETE
486,486,0.30348940726865686,2023-06-10 16:47:06.759307,2023-06-10 16:47:07.605774,0 days 00:00:00.846467,1.9399935964489023,Plain,4,SymmetricTree,804,0.6997579815142778,0.05564512410407629,32,11,COMPLETE
487,487,0.2998497649724888,2023-06-10 16:47:07.606692,2023-06-10 16:47:09.275562,0 days 00:00:01.668870,0.2009889595274922,Plain,4,SymmetricTree,650,35.93965628305028,0.014777234681120648,32,8,COMPLETE
488,488,0.2966140799317574,2023-06-10 16:47:09.276399,2023-06-10 16:47:10.613918,0 days 00:00:01.337519,1.4923206459054426,Plain,7,SymmetricTree,694,13.890127971704164,0.09202744397947535,32,5,COMPLETE
489,489,0.2956474174590559,2023-06-10 16:47:10.614734,2023-06-10 16:47:12.167820,0 days 00:00:01.553086,3.1904866945945782,Plain,4,SymmetricTree,668,0.09362015974296982,0.018317488688084523,32,9,COMPLETE
490,490,0.4681393746835872,2023-06-10 16:47:12.168644,2023-06-10 16:47:12.940028,0 days 00:00:00.771384,1.2204007339807055,Plain,4,SymmetricTree,622,0.03486602255293972,0.04833676315683829,2,16,COMPLETE
491,491,0.6586782244699935,2023-06-10 16:47:12.940831,2023-06-10 16:47:13.558669,0 days 00:00:00.617838,73.90334703276913,Plain,4,SymmetricTree,555,9.305886126054476e-07,0.035097949051792685,32,13,COMPLETE
492,492,0.2745431163440935,2023-06-10 16:47:13.559794,2023-06-10 16:47:14.894461,0 days 00:00:01.334667,2.130605226200242,Plain,4,SymmetricTree,704,4.7278306712277836,0.02474625766140867,32,6,COMPLETE
493,493,0.34850393787612116,2023-06-10 16:47:14.895265,2023-06-10 16:47:17.077716,0 days 00:00:02.182451,19.722694476159322,Plain,4,SymmetricTree,919,21.699593557982798,0.0075808795361912915,32,11,COMPLETE
494,494,0.28493678340161943,2023-06-10 16:47:17.078649,2023-06-10 16:47:18.571677,0 days 00:00:01.493028,0.10450491488637029,Plain,4,SymmetricTree,680,68.67373432337028,0.0401537783281086,32,3,COMPLETE
495,495,0.4958471594032715,2023-06-10 16:47:18.572504,2023-06-10 16:47:19.278519,0 days 00:00:00.706015,1.6910383398044224,,4,Lossguide,776,0.020040664206411807,0.05718645974871177,32,8,COMPLETE
496,496,0.5621117862011019,2023-06-10 16:47:19.279312,2023-06-10 16:47:19.859799,0 days 00:00:00.580487,0.24903937020678676,Plain,4,SymmetricTree,693,1.2332189692256457e-05,0.11955998270541347,10,0,COMPLETE
497,497,0.24674508657101793,2023-06-10 16:47:19.860522,2023-06-10 16:47:21.480733,0 days 00:00:01.620211,2.4715840723107623,Plain,4,SymmetricTree,710,37.46362532931089,0.07972357283106961,20,5,COMPLETE
498,498,0.25265476755065064,2023-06-10 16:47:21.481534,2023-06-10 16:47:23.097137,0 days 00:00:01.615603,2.962554222974402,Plain,4,SymmetricTree,760,47.23232246345405,0.08038722478169721,20,4,COMPLETE
499,499,0.2819018098974821,2023-06-10 16:47:23.097956,2023-06-10 16:47:24.621360,0 days 00:00:01.523404,2.553825742881477,Plain,5,SymmetricTree,717,29.45829382806592,0.07209596881432477,20,2,COMPLETE
500,500,0.3038200955860257,2023-06-10 16:47:24.622147,2023-06-10 16:47:26.164863,0 days 00:00:01.542716,3.5849857893691266,Plain,4,SymmetricTree,579,98.85805407036723,0.08543461725990369,3,5,COMPLETE
501,501,0.27048547455215305,2023-06-10 16:47:26.165653,2023-06-10 16:47:27.967230,0 days 00:00:01.801577,14.7766313590103,Plain,4,SymmetricTree,730,44.614713160596224,0.066499715764732,20,6,COMPLETE
502,502,0.2933216022208712,2023-06-10 16:47:27.968036,2023-06-10 16:47:30.625411,0 days 00:00:02.657375,2.880245512586087,Ordered,4,SymmetricTree,745,19.944927532096834,0.09982927617757685,20,2,COMPLETE
503,503,0.26451716075647225,2023-06-10 16:47:30.626238,2023-06-10 16:47:32.172011,0 days 00:00:01.545773,2.318025534685298,Plain,4,SymmetricTree,790,62.68344523041131,0.07250856493901911,20,53,COMPLETE
504,504,0.5800291393669109,2023-06-10 16:47:32.172656,2023-06-10 16:47:32.924483,0 days 00:00:00.751827,53.68009320143826,Plain,4,SymmetricTree,704,0.0014446551995615953,0.06285839462802857,20,7,COMPLETE
505,505,0.2515806006379595,2023-06-10 16:47:32.925178,2023-06-10 16:47:33.954370,0 days 00:00:01.029192,4.436948246745148,Plain,4,SymmetricTree,815,34.1196111589921,0.08229373642020908,20,5,COMPLETE
506,506,0.2977575819411041,2023-06-10 16:47:33.955074,2023-06-10 16:47:34.773635,0 days 00:00:00.818561,0.01835726087085806,Plain,4,SymmetricTree,766,0.5205229972234732,0.052860300017572893,20,9,COMPLETE
507,507,0.2661878883557888,2023-06-10 16:47:34.774246,2023-06-10 16:47:36.610415,0 days 00:00:01.836169,6.335726628901372,Plain,4,SymmetricTree,713,18.179187132224065,0.02141754799501298,64,4,COMPLETE
508,508,0.4133989291751124,2023-06-10 16:47:36.611092,2023-06-10 16:47:37.982791,0 days 00:00:01.371699,37.629425933867104,Plain,8,SymmetricTree,741,36.31140969727821,0.06337540207628264,5,7,COMPLETE
509,509,0.32631762175986706,2023-06-10 16:47:37.983529,2023-06-10 16:47:39.044010,0 days 00:00:01.060481,2.0276931115257457,,4,Depthwise,652,64.05187006154556,0.07524980762758919,64,10,COMPLETE
510,510,0.2828105913300982,2023-06-10 16:47:39.044717,2023-06-10 16:47:40.413147,0 days 00:00:01.368430,3.554358545426697,Plain,4,SymmetricTree,676,1.1687064327713534,0.028507654402056173,64,0,COMPLETE
511,511,0.2653985953635542,2023-06-10 16:47:40.413838,2023-06-10 16:47:41.495799,0 days 00:00:01.081961,0.0351366454811895,Plain,5,SymmetricTree,722,7.303102983997014,0.08970505271912027,64,7,COMPLETE
512,512,0.46920527850670035,2023-06-10 16:47:41.496523,2023-06-10 16:47:42.195476,0 days 00:00:00.698953,10.764815980190733,Plain,4,SymmetricTree,607,0.002258000089263198,0.043966337309767144,4,25,COMPLETE
513,513,0.2389068866718517,2023-06-10 16:47:42.196143,2023-06-10 16:47:43.390590,0 days 00:00:01.194447,2.470738348793795,Plain,4,SymmetricTree,771,24.1348101818044,0.1078221758716826,20,3,COMPLETE
514,514,0.4856388188963743,2023-06-10 16:47:43.391288,2023-06-10 16:47:44.013018,0 days 00:00:00.621730,2.5511354936169295,Plain,4,SymmetricTree,799,0.002872274753158962,0.10474741059739182,20,2,COMPLETE
515,515,0.5291711574258857,2023-06-10 16:47:44.013715,2023-06-10 16:47:44.653450,0 days 00:00:00.639735,2.3985501512258036,Plain,4,SymmetricTree,778,0.00011103402331431715,0.11333202009424134,20,1,COMPLETE
516,516,0.2451835642258194,2023-06-10 16:47:44.654132,2023-06-10 16:47:45.421746,0 days 00:00:00.767614,1.7976458794159258,Plain,4,SymmetricTree,847,13.837954997309938,0.1373821628337184,20,5,COMPLETE
517,517,0.2698719740890787,2023-06-10 16:47:45.422529,2023-06-10 16:47:46.569122,0 days 00:00:01.146593,1.4194165315678071,Plain,4,SymmetricTree,870,11.120265929715163,0.10373368074927058,20,3,COMPLETE
518,518,0.2829057988006741,2023-06-10 16:47:46.569787,2023-06-10 16:47:47.235462,0 days 00:00:00.665675,0.010361654351427472,Plain,4,SymmetricTree,856,17.690583330809222,0.1351543231453432,20,3,COMPLETE
519,519,0.573556120662368,2023-06-10 16:47:47.236165,2023-06-10 16:47:47.855332,0 days 00:00:00.619167,1.9141094001573795,,4,Lossguide,831,9.951894711130189e-08,0.13404174285951462,20,0,COMPLETE
520,520,0.402962372884239,2023-06-10 16:47:47.856166,2023-06-10 16:47:48.494796,0 days 00:00:00.638630,1.7079713200471756,Plain,4,SymmetricTree,829,0.0005619739145813079,0.09331815436674286,20,5,COMPLETE
521,521,0.4558199941212587,2023-06-10 16:47:48.495539,2023-06-10 16:47:49.106967,0 days 00:00:00.611428,1.1542952114237732,Plain,4,SymmetricTree,903,0.00043367242645718653,0.17680951525459745,20,4,COMPLETE
522,522,0.29342100193456033,2023-06-10 16:47:49.107778,2023-06-10 16:47:49.851448,0 days 00:00:00.743670,1.46762383855699,Plain,4,SymmetricTree,856,3.6415807447053865,0.12010584799836138,20,2,COMPLETE
523,523,0.3967100764989046,2023-06-10 16:47:49.852251,2023-06-10 16:47:50.917261,0 days 00:00:01.065010,2.071240469049067,Ordered,4,SymmetricTree,942,0.0067318756703678645,0.15245751613595815,20,5,COMPLETE
524,524,0.2811157394368961,2023-06-10 16:47:50.918052,2023-06-10 16:47:51.658214,0 days 00:00:00.740162,1.3162716809881787,Plain,4,SymmetricTree,845,8.082910771858565,0.16095326935240706,20,13,COMPLETE
525,525,0.26266944167305795,2023-06-10 16:47:51.659098,2023-06-10 16:47:52.396486,0 days 00:00:00.737388,1.6960571549125996,Plain,4,SymmetricTree,811,12.339309867163877,0.14503322682194125,20,8,COMPLETE
526,526,0.4198055321250009,2023-06-10 16:47:52.397279,2023-06-10 16:47:52.997816,0 days 00:00:00.600537,1.0452947049129406,Plain,4,SymmetricTree,889,0.0005887204858926841,0.11486296427580639,20,10,COMPLETE
527,527,0.3857775948536848,2023-06-10 16:47:52.998598,2023-06-10 16:47:54.845017,0 days 00:00:01.846419,0.016282085931939628,Plain,4,SymmetricTree,761,23.10086336803704,0.0026870768717431556,20,6,COMPLETE
528,528,0.4091198167749792,2023-06-10 16:47:54.845767,2023-06-10 16:47:55.778348,0 days 00:00:00.932581,2.790891898817342,Plain,4,SymmetricTree,789,14.392039043907484,0.07607882884438251,2,3,COMPLETE
529,529,0.2921526607128967,2023-06-10 16:47:55.779027,2023-06-10 16:47:56.532476,0 days 00:00:00.753449,2.1247633388188207,Plain,4,SymmetricTree,772,0.15075388984772037,0.1366932251145859,20,15,COMPLETE
530,530,0.27866738579674977,2023-06-10 16:47:56.533151,2023-06-10 16:47:57.234711,0 days 00:00:00.701560,0.3111177091679855,Plain,4,SymmetricTree,874,6.104265884641178,0.1541550440786337,20,12,COMPLETE
531,531,0.3179938278361368,2023-06-10 16:47:57.235377,2023-06-10 16:47:59.507978,0 days 00:00:02.272601,1.5401063618616209,,9,Depthwise,752,31.263051279022413,0.1214554466375887,20,8,COMPLETE
532,532,0.5814709443595831,2023-06-10 16:47:59.508709,2023-06-10 16:48:01.403030,0 days 00:00:01.894321,22.3291243736124,Plain,4,SymmetricTree,794,20.01086278114737,0.0011738656761530425,20,5,COMPLETE
533,533,0.27212807906726516,2023-06-10 16:48:01.403793,2023-06-10 16:48:02.357901,0 days 00:00:00.954108,1.7243344422865454,Plain,4,SymmetricTree,773,9.900992265940706,0.09061814963248478,32,0,COMPLETE
534,534,0.32157225932037314,2023-06-10 16:48:02.358598,2023-06-10 16:48:03.137430,0 days 00:00:00.778832,0.028443148607784914,Plain,4,SymmetricTree,738,2.695655679746301,0.06822505039550826,10,11,COMPLETE
535,535,0.30722479593174457,2023-06-10 16:48:03.138179,2023-06-10 16:48:05.100881,0 days 00:00:01.962702,1.289620331929217,Plain,4,SymmetricTree,814,27.056770013521017,0.02296367638288613,3,31,COMPLETE
536,536,0.37789486201794126,2023-06-10 16:48:05.101568,2023-06-10 16:48:05.890883,0 days 00:00:00.789315,2.2952977859029633,Plain,4,SymmetricTree,758,0.0014819404575079614,0.030869878522980627,20,7,COMPLETE
