,number,value,datetime_start,datetime_complete,duration,params_bagging_temperature,params_boosting_type,params_depth,params_grow_policy,params_iterations,params_l2_leaf_reg,params_learning_rate,params_max_bin,params_random_strength,state
992,992,0.3035778836211774,2023-06-10 16:34:36.628600,2023-06-10 16:34:37.264479,0 days 00:00:00.635879,0.3562590159419666,,4,Depthwise,660,6.460915297256239,0.09106666528873232,64,8,COMPLETE
993,993,0.4123731277732954,2023-06-10 16:34:37.265347,2023-06-10 16:34:38.710500,0 days 00:00:01.445153,0.1602507266581704,,4,Depthwise,556,3.8982744791407e-05,0.001202890320203291,64,33,COMPLETE
994,994,0.4320543865329327,2023-06-10 16:34:38.711314,2023-06-10 16:34:39.294345,0 days 00:00:00.583031,0.12827298122365702,,4,Depthwise,571,0.002867464472083732,0.2192487701904385,64,38,COMPLETE
995,995,0.4938635941428162,2023-06-10 16:34:39.295131,2023-06-10 16:34:39.873815,0 days 00:00:00.578684,0.2079322140320867,,4,Depthwise,634,5.274094995962934e-05,0.2679024886704452,64,30,COMPLETE
996,996,0.40613270897975967,2023-06-10 16:34:39.874612,2023-06-10 16:34:40.494501,0 days 00:00:00.619889,0.09003960202646902,,4,Depthwise,612,0.00019914849149472582,0.29988769641023233,10,27,COMPLETE
997,997,0.6931471805599453,2023-06-10 16:34:40.495277,2023-06-10 16:34:41.039521,0 days 00:00:00.544244,49.679291978765505,,4,Depthwise,586,7.695532631430152e-06,0.19453332959150532,64,32,COMPLETE
998,998,0.30999117278684013,2023-06-10 16:34:41.040369,2023-06-10 16:34:41.667296,0 days 00:00:00.626927,0.11731977992598104,,4,Depthwise,528,4.071295939692099,0.14928924265906168,20,24,COMPLETE
999,999,0.3184699362068436,2023-06-10 16:34:41.668090,2023-06-10 16:34:42.557796,0 days 00:00:00.889706,10.339039090576135,,4,Depthwise,602,9.381901489263898,0.13022548371642706,64,29,COMPLETE
