,number,value,datetime_start,datetime_complete,duration,params_bagging_temperature,params_boosting_type,params_depth,params_grow_policy,params_iterations,params_l2_leaf_reg,params_learning_rate,params_max_bin,params_random_strength,state
965,965,0.43914757777956737,2023-06-10 16:57:41.418710,2023-06-10 16:57:43.161569,0 days 00:00:01.742859,2.8984533167981485,Plain,4,SymmetricTree,691,66.04288716821564,0.005716093045014803,5,7,COMPLETE
966,966,0.26311011924756167,2023-06-10 16:57:43.162607,2023-06-10 16:57:46.232440,0 days 00:00:03.069833,1.5299170409789427,Ordered,4,SymmetricTree,838,11.846550664200201,0.047385750387831035,64,14,COMPLETE
967,967,0.29511590714406033,2023-06-10 16:57:46.233276,2023-06-10 16:57:47.562052,0 days 00:00:01.328776,2.001032843898347,Plain,4,SymmetricTree,651,34.61065802177348,0.06071301253179526,4,9,COMPLETE
968,968,0.3200589311695649,2023-06-10 16:57:47.562956,2023-06-10 16:57:48.233276,0 days 00:00:00.670320,1.1724000117437414,Plain,4,SymmetricTree,728,0.017422542852500784,0.08778373828392158,20,5,COMPLETE
969,969,0.3819215957008417,2023-06-10 16:57:48.234125,2023-06-10 16:57:49.219754,0 days 00:00:00.985629,23.967687785724763,Plain,4,SymmetricTree,631,0.6188861806133369,0.03182593753853304,32,12,COMPLETE
970,970,0.2867214113768239,2023-06-10 16:57:49.220613,2023-06-10 16:57:50.001130,0 days 00:00:00.780517,5.296759056445831,Plain,5,SymmetricTree,770,4.987014494660348,0.14471377843409852,32,7,COMPLETE
971,971,0.4755279690593995,2023-06-10 16:57:50.001971,2023-06-10 16:57:53.682801,0 days 00:00:03.680830,2.459804855384691,Plain,9,SymmetricTree,669,19.707848312488846,0.0020717501477890395,64,3,COMPLETE
972,972,0.37216592243265606,2023-06-10 16:57:53.683721,2023-06-10 16:57:54.347629,0 days 00:00:00.663908,0.011723089810987129,Plain,4,SymmetricTree,704,7.283383486187281e-08,0.041025032194357866,32,9,COMPLETE
973,973,0.49884918694739633,2023-06-10 16:57:54.348508,2023-06-10 16:57:54.969923,0 days 00:00:00.621415,11.036809460341983,Plain,4,SymmetricTree,747,0.005904236312435991,0.10314691486275451,20,6,COMPLETE
974,974,0.6931471805599452,2023-06-10 16:57:54.970939,2023-06-10 16:57:55.521027,0 days 00:00:00.550088,84.20970201698945,,4,Depthwise,689,2.2932678456479863e-08,0.04978973886442223,64,11,COMPLETE
975,975,0.40496906774090485,2023-06-10 16:57:55.521794,2023-06-10 16:57:56.511693,0 days 00:00:00.989899,14.598745716541716,Plain,4,SymmetricTree,723,0.001974033043830405,0.014960613880955407,32,4,COMPLETE
976,976,0.2932093756631633,2023-06-10 16:57:56.512494,2023-06-10 16:57:57.496113,0 days 00:00:00.983619,0.017600540484761038,Plain,4,SymmetricTree,658,45.83213222277657,0.12783178017207994,32,8,COMPLETE
977,977,0.31062187736492164,2023-06-10 16:57:57.496941,2023-06-10 16:57:58.347463,0 days 00:00:00.850522,3.902788316729321,Plain,4,SymmetricTree,822,0.11126971407549904,0.07457047588404313,64,1,COMPLETE
978,978,0.42302887448141874,2023-06-10 16:57:58.348271,2023-06-10 16:58:00.261104,0 days 00:00:01.912833,1.754662229396041,Plain,4,SymmetricTree,800,6.554486829760647e-06,0.003744777733681387,32,15,COMPLETE
979,979,0.4593276686977338,2023-06-10 16:58:00.261916,2023-06-10 16:58:02.136005,0 days 00:00:01.874089,2.998229795057538,Plain,4,SymmetricTree,758,16.571690030432922,0.005121756157320382,2,6,COMPLETE
980,980,0.5008658518754476,2023-06-10 16:58:02.136908,2023-06-10 16:58:03.878757,0 days 00:00:01.741849,0.03533537836601724,Plain,4,SymmetricTree,710,8.933820260990682,0.0010630937887781999,20,10,COMPLETE
981,981,0.2864256601777445,2023-06-10 16:58:03.879668,2023-06-10 16:58:05.591967,0 days 00:00:01.712299,1.3480153363308771,Plain,4,SymmetricTree,677,98.11013568354537,0.03521143243758054,32,12,COMPLETE
982,982,0.35446281572600813,2023-06-10 16:58:05.592850,2023-06-10 16:58:06.368157,0 days 00:00:00.775307,0.18750283877858198,Plain,4,SymmetricTree,786,0.000970903853605882,0.018710778653291477,64,8,COMPLETE
983,983,0.3191551482552815,2023-06-10 16:58:06.369033,2023-06-10 16:58:08.097692,0 days 00:00:01.728659,2.0610469685631045,,4,Lossguide,852,28.86018122542781,0.013648485815115295,32,5,COMPLETE
984,984,0.2627625779734064,2023-06-10 16:58:08.098581,2023-06-10 16:58:09.834737,0 days 00:00:01.736156,1.5348633896869333,Plain,4,SymmetricTree,696,60.116250693357244,0.044127662115322146,32,3,COMPLETE
985,985,0.28396344268717433,2023-06-10 16:58:09.835514,2023-06-10 16:58:12.500263,0 days 00:00:02.664749,0.5691151095484612,Ordered,4,SymmetricTree,633,24.085903529647762,0.0559811756205307,64,10,COMPLETE
986,986,0.2927403270421096,2023-06-10 16:58:12.501081,2023-06-10 16:58:13.431781,0 days 00:00:00.930700,7.46015725282419,Plain,4,SymmetricTree,737,13.208401018330338,0.06480194669643986,20,7,COMPLETE
987,987,0.46000514511069024,2023-06-10 16:58:13.432590,2023-06-10 16:58:14.058940,0 days 00:00:00.626350,2.4348164946983055,Plain,4,SymmetricTree,663,3.54325428264168e-06,0.02914651936575283,10,13,COMPLETE
988,988,0.2861181766273949,2023-06-10 16:58:14.059905,2023-06-10 16:58:15.917447,0 days 00:00:01.857542,3.4343259143080798,Plain,4,SymmetricTree,722,39.893987910825686,0.01687890921867686,32,17,COMPLETE
989,989,0.5385432363381017,2023-06-10 16:58:15.918321,2023-06-10 16:58:16.730847,0 days 00:00:00.812526,40.67796239990782,Plain,4,SymmetricTree,762,1.6735348559437333e-07,0.021694215209799556,32,2,COMPLETE
990,990,0.551630018569075,2023-06-10 16:58:16.731742,2023-06-10 16:58:17.315902,0 days 00:00:00.584160,0.0498275081493034,Plain,4,SymmetricTree,688,1.039882363769115e-05,0.23361225879451636,3,9,COMPLETE
991,991,0.6509679847604024,2023-06-10 16:58:17.316905,2023-06-10 16:58:18.060009,0 days 00:00:00.743104,74.71578619002054,Plain,4,SymmetricTree,775,1.1984991375764607e-07,0.09450945311344473,64,6,COMPLETE
992,992,0.38598530178721,2023-06-10 16:58:18.060911,2023-06-10 16:58:19.768592,0 days 00:00:01.707681,0.015583454067388659,Plain,4,SymmetricTree,708,8.90303433314891e-05,0.0016288731156870763,32,4,COMPLETE
993,993,0.6596125919633211,2023-06-10 16:58:19.769467,2023-06-10 16:58:20.446729,0 days 00:00:00.677262,64.35578989685649,Plain,8,SymmetricTree,673,6.68379296161004,0.10951761175916896,5,11,COMPLETE
994,994,0.5145174628395981,2023-06-10 16:58:20.447598,2023-06-10 16:58:21.184023,0 days 00:00:00.736425,0.4520627301391675,Plain,5,SymmetricTree,747,0.0001596265443850446,0.023325888431075692,20,47,COMPLETE
995,995,0.4671413984725477,2023-06-10 16:58:21.184938,2023-06-10 16:58:23.128914,0 days 00:00:01.943976,1.8963929436187152,Plain,4,SymmetricTree,801,20.686488364210096,0.0011295021156821745,32,0,COMPLETE
996,996,0.29885134510280803,2023-06-10 16:58:23.129719,2023-06-10 16:58:24.230044,0 days 00:00:01.100325,1.1647451270476183,,4,Depthwise,651,61.01784021177482,0.03869241732059343,64,8,COMPLETE
997,997,0.288887590870219,2023-06-10 16:58:24.230892,2023-06-10 16:58:26.167796,0 days 00:00:01.936904,1.497927577484529,Plain,4,SymmetricTree,834,1.9351132521022842,0.011184299616605544,32,6,COMPLETE
998,998,0.2693311231795227,2023-06-10 16:58:26.168606,2023-06-10 16:58:27.283828,0 days 00:00:01.115222,0.06417860225366673,Plain,4,SymmetricTree,614,32.40762962058635,0.05199821670845578,32,14,COMPLETE
999,999,0.3424183789176848,2023-06-10 16:58:27.284711,2023-06-10 16:58:28.258424,0 days 00:00:00.973713,15.534436845887337,Plain,4,SymmetricTree,721,9.858786884188458,0.1240879845515575,4,9,COMPLETE
