,number,value,datetime_start,datetime_complete,duration,params_bagging_temperature,params_boosting_type,params_depth,params_grow_policy,params_iterations,params_l2_leaf_reg,params_learning_rate,params_max_bin,params_random_strength,state
323,323,0.3981846540646366,2023-06-10 16:43:41.502041,2023-06-10 16:43:42.142487,0 days 00:00:00.640446,3.4564055737541226,Plain,4,SymmetricTree,1114,0.1936707790295198,0.16461670724939198,4,13,COMPLETE
324,324,0.3462453678771353,2023-06-10 16:43:42.143100,2023-06-10 16:43:42.980038,0 days 00:00:00.836938,2.3702637560135313,Plain,4,SymmetricTree,780,0.05086075881467639,0.04375507183946221,32,8,COMPLETE
325,325,0.3651393334503746,2023-06-10 16:43:42.980770,2023-06-10 16:43:43.750809,0 days 00:00:00.770039,6.354028779982872,Plain,4,SymmetricTree,705,25.7173234583841,0.2918430657922165,32,5,COMPLETE
326,326,0.3790818501203593,2023-06-10 16:43:43.751463,2023-06-10 16:43:44.673988,0 days 00:00:00.922525,28.992866443535743,Plain,4,SymmetricTree,808,15.56972126793577,0.05714830424525788,64,10,COMPLETE
327,327,0.268845828590843,2023-06-10 16:43:44.674673,2023-06-10 16:43:46.422632,0 days 00:00:01.747959,5.1810605738623945,Plain,4,SymmetricTree,727,64.89086054090878,0.03143052158861313,32,3,COMPLETE
328,328,0.254870545510943,2023-06-10 16:43:46.423304,2023-06-10 16:43:48.534190,0 days 00:00:02.110886,1.8415239184351884,Plain,5,SymmetricTree,762,37.65032793780607,0.05133630170772196,64,6,COMPLETE
329,329,0.27096239543633077,2023-06-10 16:43:48.534852,2023-06-10 16:43:50.091300,0 days 00:00:01.556448,1.2805955081964784,Plain,4,SymmetricTree,698,18.092269337746195,0.03487632881888613,32,12,COMPLETE
330,330,0.35469867455432225,2023-06-10 16:43:50.091937,2023-06-10 16:43:50.898090,0 days 00:00:00.806153,3.9100142506021935,,4,Depthwise,736,4.305334297957135,0.062458600116863924,32,8,COMPLETE
331,331,0.27505952439610504,2023-06-10 16:43:50.898759,2023-06-10 16:43:51.875521,0 days 00:00:00.976762,2.9492720204255187,Plain,4,SymmetricTree,710,8.800942001308481,0.08354050525931382,64,4,COMPLETE
332,332,0.4347710040896712,2023-06-10 16:43:51.876221,2023-06-10 16:43:52.982093,0 days 00:00:01.105872,1.0395565279554284,Ordered,4,SymmetricTree,792,0.1290558627211827,0.2542853237857051,32,9,COMPLETE
333,333,0.2844120405849039,2023-06-10 16:43:52.982743,2023-06-10 16:43:54.147216,0 days 00:00:01.164473,0.7745412691685023,Plain,4,SymmetricTree,682,54.23545684885883,0.09781897373903473,32,19,COMPLETE
334,334,0.3264299371434142,2023-06-10 16:43:54.147874,2023-06-10 16:43:55.139143,0 days 00:00:00.991269,0.0195701901203213,Plain,4,SymmetricTree,756,2.816025261785734,0.04559781942633958,64,37,COMPLETE
335,335,0.2598839948333477,2023-06-10 16:43:55.139788,2023-06-10 16:43:55.891283,0 days 00:00:00.751495,1.5421844725621903,Plain,4,SymmetricTree,720,28.748199269040555,0.23058029015944725,32,1,COMPLETE
336,336,0.3258754343222866,2023-06-10 16:43:55.891945,2023-06-10 16:43:57.083109,0 days 00:00:01.191164,1.9650039383243976,Plain,7,SymmetricTree,692,22.50271042186194,0.0723698784822796,64,6,COMPLETE
337,337,0.32257373968311553,2023-06-10 16:43:57.083765,2023-06-10 16:43:58.336996,0 days 00:00:01.253231,2.2879394185076176,Plain,6,SymmetricTree,740,1.2101968530739267,0.0393547255450761,32,11,COMPLETE
338,338,0.39813761446646023,2023-06-10 16:43:58.337635,2023-06-10 16:43:59.484877,0 days 00:00:01.147242,1.317645515230386,Plain,4,SymmetricTree,568,43.43974323213623,0.05368131578554256,2,7,COMPLETE
339,339,0.2686886241730567,2023-06-10 16:43:59.485505,2023-06-10 16:44:01.093740,0 days 00:00:01.608235,1.639292769358174,Plain,4,SymmetricTree,668,11.349699907867613,0.02948226848927495,32,9,COMPLETE
340,340,0.3388343816796512,2023-06-10 16:44:01.094387,2023-06-10 16:44:02.066580,0 days 00:00:00.972193,0.5255861911896157,,4,Lossguide,714,70.23122788935552,0.04692600814904233,64,4,COMPLETE
341,341,0.3369154091241512,2023-06-10 16:44:02.067236,2023-06-10 16:44:02.869072,0 days 00:00:00.801836,3.22984155169807,Plain,4,SymmetricTree,825,0.02347558722428129,0.06001205667257393,32,15,COMPLETE
342,342,0.27712817575100335,2023-06-10 16:44:02.869740,2023-06-10 16:44:04.411005,0 days 00:00:01.541265,2.5241440575768346,Plain,4,SymmetricTree,772,17.520706708394325,0.04232759766453157,32,45,COMPLETE
343,343,0.4365742522407322,2023-06-10 16:44:04.411645,2023-06-10 16:44:05.032009,0 days 00:00:00.620364,1.946584267509528,Plain,5,SymmetricTree,745,0.001059175047651188,0.051339510517893316,64,0,COMPLETE
344,344,0.49146627752215377,2023-06-10 16:44:05.032682,2023-06-10 16:44:05.724931,0 days 00:00:00.692249,4.336781100692797,Plain,4,SymmetricTree,861,0.009505876311494058,0.06488726268869822,32,12,COMPLETE
345,345,0.2659005692117457,2023-06-10 16:44:05.725761,2023-06-10 16:44:06.585019,0 days 00:00:00.859258,0.9637296380396171,Plain,4,SymmetricTree,698,31.9399455046469,0.13833983942675354,10,7,COMPLETE
346,346,0.30936126329355573,2023-06-10 16:44:06.585710,2023-06-10 16:44:07.404483,0 days 00:00:00.818773,1.2087181439889598,Plain,4,SymmetricTree,725,6.156911931349921,0.17248449582788195,32,10,COMPLETE
347,347,0.6510796352954406,2023-06-10 16:44:07.405171,2023-06-10 16:44:09.474125,0 days 00:00:02.068954,80.44105770439492,Plain,4,SymmetricTree,992,13.10367070528533,0.03790578404877369,64,3,COMPLETE
348,348,0.3330261017542523,2023-06-10 16:44:09.474801,2023-06-10 16:44:10.156045,0 days 00:00:00.681244,1.5475271703966142,Plain,4,SymmetricTree,677,0.5376932697518672,0.12794570445867973,32,6,COMPLETE
349,349,0.3354864792875216,2023-06-10 16:44:10.156807,2023-06-10 16:44:11.069856,0 days 00:00:00.913049,0.17135053752912643,Plain,4,SymmetricTree,762,25.431738708352604,0.0742228027880757,3,8,COMPLETE
350,350,0.2582416992505532,2023-06-10 16:44:11.070522,2023-06-10 16:44:12.637975,0 days 00:00:01.567453,2.6603786526992796,Plain,4,SymmetricTree,785,49.0940679002398,0.05541434016924916,64,5,COMPLETE
351,351,0.29742296126146966,2023-06-10 16:44:12.638632,2023-06-10 16:44:14.429866,0 days 00:00:01.791234,9.246048280697442,Plain,4,SymmetricTree,711,70.55343093979369,0.045665241949566546,5,10,COMPLETE
352,352,0.28758651116269246,2023-06-10 16:44:14.430646,2023-06-10 16:44:18.453377,0 days 00:00:04.022731,2.098945699679057,Ordered,4,SymmetricTree,657,8.620160349859951,0.034387315545634525,32,12,COMPLETE
353,353,0.2992775310560196,2023-06-10 16:44:18.454047,2023-06-10 16:44:19.340973,0 days 00:00:00.886926,1.7794375734817043,Plain,4,SymmetricTree,736,34.369801851050696,0.10645105297657227,4,8,COMPLETE
354,354,0.35700670152112124,2023-06-10 16:44:19.341659,2023-06-10 16:44:20.257071,0 days 00:00:00.915412,1.5000740236673797,Plain,4,SymmetricTree,689,0.00040043052870877274,0.009852532249093021,32,4,COMPLETE
355,355,0.3112525749752643,2023-06-10 16:44:20.257812,2023-06-10 16:44:21.460412,0 days 00:00:01.202600,1.0853530256582657,,4,Depthwise,702,19.869336129996437,0.021151144861226635,64,27,COMPLETE
356,356,0.2916801043643274,2023-06-10 16:44:21.461195,2023-06-10 16:44:22.356971,0 days 00:00:00.895776,0.8243115638174314,Plain,4,SymmetricTree,634,0.24622399518544538,0.041261425798336665,32,2,COMPLETE
357,357,0.4015783701491714,2023-06-10 16:44:22.357626,2023-06-10 16:44:23.130481,0 days 00:00:00.772855,3.099390314831866,Plain,4,SymmetricTree,725,5.07719830537677e-07,0.02786827878099649,32,6,COMPLETE
358,358,0.39183963339457245,2023-06-10 16:44:23.131122,2023-06-10 16:44:24.768568,0 days 00:00:01.637446,0.04832951021950572,Plain,4,SymmetricTree,1160,5.950909704765601e-05,0.004134516895538166,64,13,COMPLETE
359,359,0.27061868468285377,2023-06-10 16:44:24.769350,2023-06-10 16:44:26.248938,0 days 00:00:01.479588,2.2378832366111667,Plain,4,SymmetricTree,757,14.752014493038555,0.050546123255146236,32,9,COMPLETE
360,360,0.25902299076750757,2023-06-10 16:44:26.249685,2023-06-10 16:44:27.884821,0 days 00:00:01.635136,1.3375483390729643,Plain,4,SymmetricTree,614,42.6136877359973,0.08548244409043952,64,7,COMPLETE
361,361,0.36560759110045915,2023-06-10 16:44:27.885591,2023-06-10 16:44:28.787356,0 days 00:00:00.901765,1.8651078860315138,Plain,4,SymmetricTree,672,0.0378085500375703,0.04724104347764926,32,88,COMPLETE
362,362,0.2592969742755746,2023-06-10 16:44:28.788119,2023-06-10 16:44:30.626688,0 days 00:00:01.838569,3.848618883103428,Plain,4,SymmetricTree,745,92.48567877673946,0.05982471140964586,32,10,COMPLETE
363,363,0.4026218051380945,2023-06-10 16:44:30.627485,2023-06-10 16:44:31.393187,0 days 00:00:00.765702,0.08130054850213014,,10,Lossguide,798,2.0606951185760156,0.07093388656946106,64,5,COMPLETE
364,364,0.2715011608552845,2023-06-10 16:44:31.393931,2023-06-10 16:44:33.007233,0 days 00:00:01.613302,5.562584847023035,Plain,4,SymmetricTree,693,23.587762986968585,0.03821109214204472,32,2,COMPLETE
365,365,0.268278406637136,2023-06-10 16:44:33.008112,2023-06-10 16:44:33.985246,0 days 00:00:00.977134,2.6749323204823643,Plain,4,SymmetricTree,722,5.702314148507436,0.05545851381637362,32,8,COMPLETE
366,366,0.2789494057709684,2023-06-10 16:44:33.985911,2023-06-10 16:44:35.639746,0 days 00:00:01.653835,1.617959762994329,Plain,4,SymmetricTree,710,48.51966581903846,0.031865485943617086,64,14,COMPLETE
367,367,0.3350326655429505,2023-06-10 16:44:35.640544,2023-06-10 16:44:37.963757,0 days 00:00:02.323213,0.6652782632185978,Plain,9,SymmetricTree,775,11.863713784449368,0.06503553882793467,32,17,COMPLETE
368,368,0.41032926169942086,2023-06-10 16:44:37.964446,2023-06-10 16:44:38.661731,0 days 00:00:00.697285,0.01271621727866741,Plain,4,SymmetricTree,647,28.341559193814177,0.1880646152866295,2,11,COMPLETE
369,369,0.25143081229683883,2023-06-10 16:44:38.662360,2023-06-10 16:44:40.321755,0 days 00:00:01.659395,1.1640553214786518,Plain,4,SymmetricTree,679,17.61963502802389,0.043033131042725235,64,6,COMPLETE
370,370,0.31127398420890817,2023-06-10 16:44:40.322436,2023-06-10 16:44:42.343454,0 days 00:00:02.021018,0.15585078515373185,Plain,4,SymmetricTree,813,62.445238095146756,0.025880951400318916,32,0,COMPLETE
371,371,0.33669584707646005,2023-06-10 16:44:42.344101,2023-06-10 16:44:43.147914,0 days 00:00:00.803813,12.598200349728227,Plain,4,SymmetricTree,738,0.42045714314382104,0.050038006422181744,32,9,COMPLETE
372,372,0.28963027700482125,2023-06-10 16:44:43.148675,2023-06-10 16:44:44.876106,0 days 00:00:01.727431,2.2104003598036246,Plain,4,SymmetricTree,664,33.63919542893306,0.017396748926508464,64,4,COMPLETE
373,373,0.30525095846442835,2023-06-10 16:44:44.876880,2023-06-10 16:44:46.953853,0 days 00:00:02.076973,1.355351405875381,Ordered,4,SymmetricTree,701,9.386836800432018,0.09427393972176742,32,7,COMPLETE
374,374,0.3457824726054588,2023-06-10 16:44:46.954540,2023-06-10 16:44:48.051016,0 days 00:00:01.096476,3.2468872327672442,,4,Depthwise,719,3.8493510875396213,0.03621570919061721,32,11,COMPLETE
375,375,0.2683957863327839,2023-06-10 16:44:48.051724,2023-06-10 16:44:49.419317,0 days 00:00:01.367593,4.648860601794064,Plain,4,SymmetricTree,758,20.58430439674951,0.07846797894042093,64,59,COMPLETE
376,376,0.2823061500398481,2023-06-10 16:44:49.419989,2023-06-10 16:44:50.992549,0 days 00:00:01.572560,1.758721511628923,Plain,4,SymmetricTree,600,96.64638679564843,0.05778025053490228,10,3,COMPLETE
377,377,0.32424137013610826,2023-06-10 16:44:50.993413,2023-06-10 16:44:51.785524,0 days 00:00:00.792111,0.4816280569981198,Plain,4,SymmetricTree,528,41.905267207025695,0.15112894355317466,3,9,COMPLETE
378,378,0.3265562874981876,2023-06-10 16:44:51.786210,2023-06-10 16:44:52.487008,0 days 00:00:00.700798,0.02235087559402054,Plain,5,SymmetricTree,681,0.0021569626005554046,0.042412669110840295,32,5,COMPLETE
379,379,0.2820503311534015,2023-06-10 16:44:52.487746,2023-06-10 16:44:53.262447,0 days 00:00:00.774701,0.932248154901761,Plain,4,SymmetricTree,734,13.394713284216913,0.11705901705243182,5,7,COMPLETE
380,380,0.24681991486568877,2023-06-10 16:44:53.263207,2023-06-10 16:44:55.214148,0 days 00:00:01.950941,2.825860802177204,Plain,4,SymmetricTree,784,27.45594246028559,0.04763912151900101,64,13,COMPLETE
381,381,0.25471029559427244,2023-06-10 16:44:55.214914,2023-06-10 16:44:57.126176,0 days 00:00:01.911262,2.449255628830751,Plain,4,SymmetricTree,789,25.886133992538127,0.023320271124609923,64,14,COMPLETE
382,382,0.43108409236580436,2023-06-10 16:44:57.126961,2023-06-10 16:44:57.831253,0 days 00:00:00.704292,1.9139473897647534,Plain,4,SymmetricTree,777,0.00010999290761247883,0.04871398552185083,64,12,COMPLETE
383,383,0.2616875372214363,2023-06-10 16:44:57.832035,2023-06-10 16:44:58.972686,0 days 00:00:01.140651,1.430929087307928,Plain,4,SymmetricTree,651,6.668827550134872,0.06381202314394047,64,10,COMPLETE
384,384,0.40756570554671046,2023-06-10 16:44:58.973355,2023-06-10 16:44:59.659372,0 days 00:00:00.686017,2.7746676836622135,,4,Lossguide,693,0.05144925181393104,0.05470212981948121,64,12,COMPLETE
385,385,0.3166022322733627,2023-06-10 16:44:59.660110,2023-06-10 16:45:00.480104,0 days 00:00:00.819994,2.2090902010181894,Plain,4,SymmetricTree,800,0.17032911663546874,0.047078694300089714,64,8,COMPLETE
386,386,0.2734068139784325,2023-06-10 16:45:00.480865,2023-06-10 16:45:01.574856,0 days 00:00:01.093991,0.11890517928732329,Plain,4,SymmetricTree,504,16.851174962228463,0.05478636695535775,64,10,COMPLETE
387,387,0.37089619253293066,2023-06-10 16:45:01.575542,2023-06-10 16:45:02.471645,0 days 00:00:00.896103,6.7882370288851215,Plain,4,SymmetricTree,846,1.0955541513975393,0.06932197114846969,64,8,COMPLETE
388,388,0.31815316657854953,2023-06-10 16:45:02.472301,2023-06-10 16:45:03.350291,0 days 00:00:00.877990,1.145245996560083,Plain,4,SymmetricTree,808,0.6322101319693842,0.06106923689932269,64,13,COMPLETE
389,389,0.2993561527586134,2023-06-10 16:45:03.350957,2023-06-10 16:45:04.969744,0 days 00:00:01.618787,1.6371936747586153,Plain,4,SymmetricTree,770,10.296095726239212,0.01975381566368334,4,6,COMPLETE
390,390,0.2559357525917602,2023-06-10 16:45:04.970502,2023-06-10 16:45:05.929928,0 days 00:00:00.959426,1.980749103879886,Plain,4,SymmetricTree,713,59.91919113130744,0.21122718863255932,64,9,COMPLETE
391,391,0.2708950823227652,2023-06-10 16:45:05.930692,2023-06-10 16:45:07.474484,0 days 00:00:01.543792,1.3761342128061578,Plain,4,SymmetricTree,834,26.13720336257515,0.045042584776477226,64,11,COMPLETE
392,392,0.3377712825213522,2023-06-10 16:45:07.475248,2023-06-10 16:45:08.234484,0 days 00:00:00.759236,2.6642870414530653,Plain,4,SymmetricTree,670,0.07368131576266476,0.050976077331361606,32,7,COMPLETE
393,393,0.2571480966541416,2023-06-10 16:45:08.235155,2023-06-10 16:45:09.479012,0 days 00:00:01.243857,1.7045692528200043,Plain,4,SymmetricTree,684,15.368406386974085,0.04164579640983253,64,5,COMPLETE
394,394,0.31818896960763665,2023-06-10 16:45:09.479675,2023-06-10 16:45:11.337469,0 days 00:00:01.857794,0.9337341523785011,Plain,8,SymmetricTree,427,2.909931962588497,0.07702660273899956,32,10,COMPLETE
395,395,0.4438664657936672,2023-06-10 16:45:11.338154,2023-06-10 16:45:12.941573,0 days 00:00:01.603419,2.249347424313396,Ordered,4,SymmetricTree,704,3.4585330689959616e-05,0.05865691986569297,64,8,COMPLETE
396,396,0.269489871486887,2023-06-10 16:45:12.942297,2023-06-10 16:45:14.394903,0 days 00:00:01.452606,1.1911605858726344,Plain,4,SymmetricTree,756,33.73046666783495,0.04926011237843776,32,14,COMPLETE
397,397,0.41253656783309345,2023-06-10 16:45:14.395683,2023-06-10 16:45:15.572840,0 days 00:00:01.177157,4.070877064785788,,4,Depthwise,785,7.897462735315205,0.025062324582962182,2,6,COMPLETE
398,398,0.2954867808395655,2023-06-10 16:45:15.573605,2023-06-10 16:45:16.482921,0 days 00:00:00.909316,2.984964891855141,Plain,4,SymmetricTree,725,1.6110201981685668,0.06513666446067506,32,11,COMPLETE
399,399,0.37971228120912803,2023-06-10 16:45:16.483798,2023-06-10 16:45:17.147518,0 days 00:00:00.663720,0.3607887158303561,Plain,4,SymmetricTree,665,0.011680983002634593,0.04394246053886902,64,8,COMPLETE
400,400,0.42631171977385673,2023-06-10 16:45:17.148285,2023-06-10 16:45:17.827734,0 days 00:00:00.679449,1.5461421466364573,Plain,4,SymmetricTree,699,1.5880444439495816e-05,0.03348756093256978,32,4,COMPLETE
401,401,0.2721370575906736,2023-06-10 16:45:17.828520,2023-06-10 16:45:19.008388,0 days 00:00:01.179868,0.5934168806525513,Plain,4,SymmetricTree,629,62.87878242609623,0.1036369797356624,64,15,COMPLETE
402,402,0.27029652320326447,2023-06-10 16:45:19.009101,2023-06-10 16:45:21.053213,0 days 00:00:02.044112,1.9143905344134886,Plain,5,SymmetricTree,746,22.06065428650777,0.029155099796088373,32,10,COMPLETE
403,403,0.3615920363060675,2023-06-10 16:45:21.053987,2023-06-10 16:45:21.730098,0 days 00:00:00.676111,0.7330033733670068,Plain,4,SymmetricTree,687,0.003650839704428565,0.05493848194061564,10,6,COMPLETE
404,404,0.3867557520875198,2023-06-10 16:45:21.731083,2023-06-10 16:45:22.393413,0 days 00:00:00.662330,1.3695371265784373,Plain,4,SymmetricTree,816,1.3425691906842383e-07,0.08647207095024957,32,8,COMPLETE
405,405,0.30768525165381444,2023-06-10 16:45:22.394184,2023-06-10 16:45:23.229933,0 days 00:00:00.835749,0.26183475046222743,Plain,4,SymmetricTree,720,0.3041708985355697,0.04050279777063593,64,4,COMPLETE
406,406,0.3306161099777552,2023-06-10 16:45:23.230721,2023-06-10 16:45:24.491630,0 days 00:00:01.260909,0.30995083768597764,,4,Lossguide,766,37.07683977422575,0.016438988103207146,32,12,COMPLETE
407,407,0.331838016181646,2023-06-10 16:45:24.492308,2023-06-10 16:45:25.219681,0 days 00:00:00.727373,2.4027489588148616,Plain,4,SymmetricTree,645,0.08043831800737986,0.05185142484126929,32,9,COMPLETE
408,408,0.3086106969342785,2023-06-10 16:45:25.220331,2023-06-10 16:45:26.060672,0 days 00:00:00.840341,1.0162019455688613,Plain,4,SymmetricTree,705,4.73065605672483,0.07022703007054508,5,6,COMPLETE
409,409,0.4720860402765755,2023-06-10 16:45:26.061381,2023-06-10 16:45:26.710412,0 days 00:00:00.649031,3.596150660314664,Plain,4,SymmetricTree,735,0.004591630911793274,0.0459738829030003,3,12,COMPLETE
410,410,0.27936053580322723,2023-06-10 16:45:26.711138,2023-06-10 16:45:27.958738,0 days 00:00:01.247600,1.8119601282503446,Plain,4,SymmetricTree,661,13.254724677056545,0.06160934273010859,64,16,COMPLETE
411,411,0.2508822221477123,2023-06-10 16:45:27.959647,2023-06-10 16:45:29.698028,0 days 00:00:01.738381,2.7462054521360333,Plain,4,SymmetricTree,681,53.635628811669285,0.05148521313076797,32,7,COMPLETE
412,412,0.2555696785193422,2023-06-10 16:45:29.698836,2023-06-10 16:45:31.109707,0 days 00:00:01.410871,2.0738416570945244,Plain,4,SymmetricTree,753,23.49114177759098,0.040079465036075415,64,10,COMPLETE
413,413,0.544945085900773,2023-06-10 16:45:31.110479,2023-06-10 16:45:31.744892,0 days 00:00:00.634413,1.5841253872486336,Plain,4,SymmetricTree,713,0.0010581346179535061,0.12352668913275416,32,41,COMPLETE
414,414,0.2667785041623807,2023-06-10 16:45:31.745629,2023-06-10 16:45:32.684887,0 days 00:00:00.939258,1.2300548165959853,Plain,4,SymmetricTree,787,9.389190718014206,0.1681905086739454,32,4,COMPLETE
415,415,0.3092747900256519,2023-06-10 16:45:32.685754,2023-06-10 16:45:34.101874,0 days 00:00:01.416120,4.934405822615793,Plain,5,SymmetricTree,691,70.59903898287315,0.14001578340183676,4,8,COMPLETE
416,416,0.303609642613538,2023-06-10 16:45:34.102745,2023-06-10 16:45:41.062446,0 days 00:00:06.959701,3.130583146584342,Ordered,4,SymmetricTree,725,31.082730816968137,0.02029098882167093,64,3,COMPLETE
417,417,0.2602151863552445,2023-06-10 16:45:41.063193,2023-06-10 16:45:42.291972,0 days 00:00:01.228779,2.257419094382101,Plain,4,SymmetricTree,738,17.269705930450144,0.04645554842494715,32,6,COMPLETE
418,418,0.3639024055388098,2023-06-10 16:45:42.292768,2023-06-10 16:45:43.071857,0 days 00:00:00.779089,1.4759129018598265,Plain,4,SymmetricTree,673,0.0006493271618496638,0.03521016002440872,64,9,COMPLETE
419,419,0.5923592037528406,2023-06-10 16:45:43.072610,2023-06-10 16:45:43.707605,0 days 00:00:00.634995,24.694326783046023,Plain,4,SymmetricTree,767,1.3235459217140476e-08,0.0593901498521295,32,62,COMPLETE
420,420,0.3094164489600812,2023-06-10 16:45:43.708298,2023-06-10 16:45:44.775910,0 days 00:00:01.067612,0.4433287221628578,,4,Depthwise,1057,97.22979092782427,0.07941040809357422,32,12,COMPLETE
421,421,0.2663710017680492,2023-06-10 16:45:44.776614,2023-06-10 16:45:46.416202,0 days 00:00:01.639588,1.0699126658326683,Plain,4,SymmetricTree,706,44.009712049773654,0.029552296940783034,64,5,COMPLETE
422,422,0.2630632155526468,2023-06-10 16:45:46.416989,2023-06-10 16:45:47.636667,0 days 00:00:01.219678,1.8246398125563204,Plain,4,SymmetricTree,802,12.876068267632947,0.05507162105165097,32,10,COMPLETE
423,423,0.28362747311351455,2023-06-10 16:45:47.637550,2023-06-10 16:45:48.956178,0 days 00:00:01.318628,0.19753149836732198,Plain,4,SymmetricTree,752,23.80541844051409,0.03888746770830405,64,7,COMPLETE
424,424,0.5116590023016946,2023-06-10 16:45:48.956960,2023-06-10 16:45:50.597830,0 days 00:00:01.640870,0.86286592801906,Plain,4,SymmetricTree,653,42.59700829305812,0.0011191451369003788,32,3,COMPLETE
425,425,0.44215963324599733,2023-06-10 16:45:50.598588,2023-06-10 16:45:51.334119,0 days 00:00:00.735531,2.6215161874984387,Plain,4,SymmetricTree,685,0.10100603701963705,0.06734086537724716,2,13,COMPLETE
426,426,0.2552632893483111,2023-06-10 16:45:51.334902,2023-06-10 16:45:52.492735,0 days 00:00:01.157833,1.3090452488166027,Plain,4,SymmetricTree,723,7.717486228025938,0.046290904790905106,64,8,COMPLETE
427,427,0.438127634368644,2023-06-10 16:45:52.493403,2023-06-10 16:45:54.116531,0 days 00:00:01.623128,3.7707977847956995,Plain,4,SymmetricTree,634,19.748510731501543,0.0053750207872134475,32,49,COMPLETE
428,428,0.5770535445162464,2023-06-10 16:45:54.117225,2023-06-10 16:45:54.726900,0 days 00:00:00.609675,1.6442732256698285,,4,Lossguide,700,6.202529475497159e-06,0.09004971289528506,32,10,COMPLETE
429,429,0.3619448500644395,2023-06-10 16:45:54.727678,2023-06-10 16:45:55.468996,0 days 00:00:00.741318,2.1409272283777248,Plain,4,SymmetricTree,780,0.024545048468274742,0.04969105381053899,64,6,COMPLETE
