,number,value,datetime_start,datetime_complete,duration,params_bagging_temperature,params_boosting_type,params_depth,params_grow_policy,params_iterations,params_l2_leaf_reg,params_learning_rate,params_max_bin,params_random_strength,state
0,0,0.5303807528016372,2023-06-10 16:05:19.590955,2023-06-10 16:05:20.416829,0 days 00:00:00.825874,0.0686213659495432,,8,Depthwise,680,7.2360123985356206e-06,0.006515033653078045,4,87,COMPLETE
1,1,0.5830856743587352,2023-06-10 16:05:20.417465,2023-06-10 16:05:26.309116,0 days 00:00:05.891651,0.47033992822349,Ordered,7,SymmetricTree,365,5.14514946568246e-07,0.0010765740170891346,2,86,COMPLETE
2,2,0.3560302226762775,2023-06-10 16:05:26.309805,2023-06-10 16:05:27.154984,0 days 00:00:00.845179,0.3435205458597775,,4,Depthwise,488,0.5687648307619401,0.00937300998866828,20,63,COMPLETE
3,3,0.4344151184764031,2023-06-10 16:05:27.155736,2023-06-10 16:05:29.132811,0 days 00:00:01.977075,0.04075595908896923,Ordered,5,SymmetricTree,581,10.430643197723128,0.08118693526682673,2,23,COMPLETE
4,4,0.35203414271758154,2023-06-10 16:05:29.133485,2023-06-10 16:05:30.046042,0 days 00:00:00.912557,1.1638747960755882,,9,Depthwise,371,1.7370053156330758,0.05200366168275621,5,96,COMPLETE
5,5,0.6931471805599454,2023-06-10 16:05:30.046727,2023-06-10 16:05:30.596449,0 days 00:00:00.549722,81.7829134782452,,8,Depthwise,930,5.496662222667152e-07,0.23930128108325924,2,92,COMPLETE
6,6,0.5144044331538988,2023-06-10 16:05:30.597146,2023-06-10 16:05:32.919921,0 days 00:00:02.322775,0.33617550234863375,Ordered,8,SymmetricTree,892,1.8685050949199405e-08,0.028850353480955555,10,49,COMPLETE
7,7,0.4174898164519937,2023-06-10 16:05:32.920705,2023-06-10 16:05:33.566191,0 days 00:00:00.645486,0.015872397907772024,,4,Depthwise,493,3.3496993373297834,0.09486006798622895,4,81,COMPLETE
8,8,0.3331474676986029,2023-06-10 16:05:33.566817,2023-06-10 16:05:36.900845,0 days 00:00:03.334028,1.434756997253497,,9,Lossguide,1057,0.039275223697566815,0.0012769807033377902,32,42,COMPLETE
9,9,0.6470672866629312,2023-06-10 16:05:36.901588,2023-06-10 16:05:38.399790,0 days 00:00:01.498202,67.16721457918413,Plain,5,SymmetricTree,639,0.06252849373008908,0.002984289708353582,64,4,COMPLETE
10,10,0.38467843268392676,2023-06-10 16:05:38.400479,2023-06-10 16:05:42.259235,0 days 00:00:03.858756,4.357839551558496,,10,Lossguide,1159,0.004512875877550029,0.0010888636702133135,32,36,COMPLETE
11,11,0.3671937170444752,2023-06-10 16:05:42.259879,2023-06-10 16:05:44.710054,0 days 00:00:02.450175,2.951912034997103,,10,Lossguide,1183,69.73483535618476,0.025246303182623945,5,64,COMPLETE
12,12,0.3473163330792736,2023-06-10 16:05:44.710783,2023-06-10 16:05:46.814414,0 days 00:00:02.103631,2.2724140180935066,,9,Lossguide,854,0.022295586036036017,0.0035706725737481623,32,29,COMPLETE
13,13,0.38492504660636917,2023-06-10 16:05:46.815094,2023-06-10 16:05:49.048432,0 days 00:00:02.233338,8.077986403068198,,9,Lossguide,955,0.001181027126487999,0.003272520850865726,32,25,COMPLETE
14,14,0.3532670545894777,2023-06-10 16:05:49.049035,2023-06-10 16:05:53.174832,0 days 00:00:04.125797,12.902092347502775,,7,Lossguide,820,0.03673504751441955,0.0023494810905798627,32,3,COMPLETE
15,15,0.5182884579293117,2023-06-10 16:05:53.175529,2023-06-10 16:05:54.250973,0 days 00:00:01.075444,1.7250915397522781,,9,Lossguide,1061,0.00013411588375567918,0.007117832583501361,3,38,COMPLETE
16,16,0.36963849277870686,2023-06-10 16:05:54.251585,2023-06-10 16:05:56.217416,0 days 00:00:01.965831,0.8529978596774092,,6,Lossguide,1039,0.0589560326173446,0.0020488756953689164,32,17,COMPLETE
17,17,0.37348654274497545,2023-06-10 16:05:56.218110,2023-06-10 16:05:59.595338,0 days 00:00:03.377228,19.338211408975955,,10,Lossguide,791,0.0004979815338420358,0.004694465622614824,32,51,COMPLETE
18,18,0.38393133653264055,2023-06-10 16:05:59.595939,2023-06-10 16:06:00.768319,0 days 00:00:01.172380,3.523656183025771,,7,Lossguide,1054,0.006679818197212396,0.011482359748772934,10,41,COMPLETE
19,19,0.46660713540368887,2023-06-10 16:06:00.768916,2023-06-10 16:06:02.670816,0 days 00:00:01.901900,0.2455372637030065,,9,Lossguide,753,0.28928005971282184,0.001626684911646184,3,67,COMPLETE
20,20,0.3485504139356426,2023-06-10 16:06:02.671617,2023-06-10 16:06:04.449998,0 days 00:00:01.778381,1.2988296378096444,,8,Lossguide,863,0.22736388632268245,0.004475060016026986,20,27,COMPLETE
21,21,0.3496336765339477,2023-06-10 16:06:04.450720,2023-06-10 16:06:05.725814,0 days 00:00:01.275094,0.9974684831585924,,8,Lossguide,853,0.1825793571193533,0.005415073722549201,20,29,COMPLETE
22,22,0.35416250814282124,2023-06-10 16:06:05.726550,2023-06-10 16:06:07.575121,0 days 00:00:01.848571,1.7866640634399842,,9,Lossguide,990,0.020946664399377993,0.003654396836307913,20,15,COMPLETE
23,23,0.34023769262894066,2023-06-10 16:06:07.575820,2023-06-10 16:06:10.130050,0 days 00:00:02.554230,0.7093217882326625,,8,Lossguide,1117,0.7219646808588023,0.0019152304885377202,64,51,COMPLETE
24,24,0.3300440288132289,2023-06-10 16:06:10.130745,2023-06-10 16:06:13.490947,0 days 00:00:03.360202,0.17880932015849077,,10,Lossguide,1143,1.4418228490411937,0.0016626106854961767,64,50,COMPLETE
25,25,0.31036001563010734,2023-06-10 16:06:13.491655,2023-06-10 16:06:18.340454,0 days 00:00:04.848799,0.1384569382306733,,10,Lossguide,1110,11.821948388394661,0.0016157401842853962,64,54,COMPLETE
26,26,0.31196786086773853,2023-06-10 16:06:18.341165,2023-06-10 16:06:24.135336,0 days 00:00:05.794171,0.11027794748136503,,10,Lossguide,1124,15.604708825214136,0.0011926190835486214,64,57,COMPLETE
27,27,0.3099667909478302,2023-06-10 16:06:24.136203,2023-06-10 16:06:29.853938,0 days 00:00:05.717735,0.13030835236649219,,10,Lossguide,1124,27.39768273346495,0.0015091261642485973,64,59,COMPLETE
28,28,0.5305543041429199,2023-06-10 16:06:29.854697,2023-06-10 16:06:35.888072,0 days 00:00:06.033375,0.09763302049846866,Plain,10,SymmetricTree,1198,87.55764573155234,0.002406973132323125,64,73,COMPLETE
29,29,0.3116738808661774,2023-06-10 16:06:35.888722,2023-06-10 16:06:41.603394,0 days 00:00:05.714672,0.12843962142063936,,10,Lossguide,1105,16.648267218395702,0.0012402312747571954,64,58,COMPLETE
30,30,0.3656484159440859,2023-06-10 16:06:41.604015,2023-06-10 16:06:47.154389,0 days 00:00:05.550374,0.048229585786766005,,10,Depthwise,995,7.468458601655194,0.001035578219386701,64,77,COMPLETE
31,31,0.31181532074647983,2023-06-10 16:06:47.155024,2023-06-10 16:06:52.926743,0 days 00:00:05.771719,0.12203980054231434,,10,Lossguide,1117,35.761691535661384,0.0015272856901103634,64,60,COMPLETE
32,32,0.3112282677137888,2023-06-10 16:06:52.927404,2023-06-10 16:06:58.467640,0 days 00:00:05.540236,0.18347382386729372,,10,Lossguide,1083,24.30199237500765,0.0014657978944248172,64,58,COMPLETE
33,33,0.31595588445838085,2023-06-10 16:06:58.468241,2023-06-10 16:07:03.121254,0 days 00:00:04.653013,0.44407373492876506,,10,Lossguide,1089,16.49524311509124,0.0024198244388668484,64,69,COMPLETE
34,34,0.32089952340034467,2023-06-10 16:07:03.121915,2023-06-10 16:07:06.892973,0 days 00:00:03.771058,0.1958688045321861,,9,Lossguide,1017,2.7297233947093997,0.0015719761611945565,64,57,COMPLETE
35,35,0.6314724577539589,2023-06-10 16:07:06.893599,2023-06-10 16:07:11.671420,0 days 00:00:04.777821,0.07133551126811279,Plain,10,SymmetricTree,955,99.94552853979376,0.0010606581953560834,4,45,COMPLETE
36,36,0.31900686285217783,2023-06-10 16:07:11.672057,2023-06-10 16:07:16.343179,0 days 00:00:04.671122,0.03355617555312489,,9,Depthwise,921,6.35875148118584,0.0025063084555509985,64,56,COMPLETE
37,37,0.4237673094978722,2023-06-10 16:07:16.343917,2023-06-10 16:07:21.908015,0 days 00:00:05.564098,0.28392573027631723,,10,Lossguide,1086,27.704195706519126,0.0015195172006318002,2,85,COMPLETE
38,38,0.3431454443005391,2023-06-10 16:07:21.908760,2023-06-10 16:08:05.097734,0 days 00:00:43.188974,0.5147670587278851,Ordered,9,SymmetricTree,1194,4.591187660946967,0.006624931581529458,64,73,COMPLETE
39,39,0.4321046118149081,2023-06-10 16:08:05.098376,2023-06-10 16:08:09.478879,0 days 00:00:04.380503,0.1513489270851393,,10,Depthwise,705,18.58256285179438,0.002122299235033507,5,62,COMPLETE
40,40,0.34567068775451876,2023-06-10 16:08:09.479589,2023-06-10 16:08:11.184070,0 days 00:00:01.704481,0.06888128942049261,,9,Lossguide,486,0.843620773303787,0.002961719155485715,10,45,COMPLETE
41,41,0.3172436200575691,2023-06-10 16:08:11.184820,2023-06-10 16:08:16.934785,0 days 00:00:05.749965,0.12777286854879077,,10,Lossguide,1108,39.41868504146069,0.0014040268462619967,64,60,COMPLETE
42,42,0.3139837651324046,2023-06-10 16:08:16.935529,2023-06-10 16:08:21.804309,0 days 00:00:04.868780,0.2566965822130906,,10,Lossguide,1148,7.360091683495614,0.0014217646673028426,64,68,COMPLETE
43,43,0.3054658068465189,2023-06-10 16:08:21.805044,2023-06-10 16:08:26.994283,0 days 00:00:05.189239,0.03412672930618684,,10,Lossguide,1010,29.91622646246213,0.0017693982321491779,64,55,COMPLETE
44,44,0.3304445305105425,2023-06-10 16:08:26.995001,2023-06-10 16:08:31.288309,0 days 00:00:04.293308,0.0386017202346269,,5,Lossguide,1006,2.6003294343602295,0.0010701943293314493,64,54,COMPLETE
45,45,0.43167245601324505,2023-06-10 16:08:31.289010,2023-06-10 16:08:34.997732,0 days 00:00:03.708722,0.01737770170752031,,6,Lossguide,963,12.205188337664257,0.001878999656548803,2,45,COMPLETE
46,46,0.4355059631872146,2023-06-10 16:08:34.998602,2023-06-10 16:08:36.981175,0 days 00:00:01.982573,0.029668283290418807,,10,Lossguide,1071,1.5461603480804138,0.0034137968367118805,4,35,COMPLETE
47,47,0.33763682587059807,2023-06-10 16:08:36.981875,2023-06-10 16:08:39.913578,0 days 00:00:02.931703,0.07308891345378485,,4,Depthwise,1153,38.93205367514296,0.0010177149134863984,64,64,COMPLETE
48,48,0.4832733865856583,2023-06-10 16:08:39.914290,2023-06-10 16:08:44.050038,0 days 00:00:04.135748,0.022329949249762643,Plain,8,SymmetricTree,1040,3.419819791654113,0.001940058857663532,3,74,COMPLETE
49,49,0.4240118853502295,2023-06-10 16:08:44.050815,2023-06-10 16:08:46.357388,0 days 00:00:02.306573,0.013157093179484464,,9,Lossguide,302,88.73591062849586,0.0028476312227911226,5,54,COMPLETE
50,50,0.31319740795286266,2023-06-10 16:08:46.358131,2023-06-10 16:08:51.406702,0 days 00:00:05.048571,0.0556008222578983,,9,Lossguide,926,9.608426265549573,0.0012735058599265933,64,47,COMPLETE
51,51,0.31111984399233067,2023-06-10 16:08:51.408220,2023-06-10 16:08:57.802877,0 days 00:00:06.394657,0.09695805708451492,,10,Lossguide,1116,29.898020675463076,0.0013706697568151593,64,62,COMPLETE
52,52,0.3183933202454164,2023-06-10 16:08:57.803800,2023-06-10 16:09:03.777351,0 days 00:00:05.973551,0.0910475683767632,,10,Lossguide,1088,34.977103846650465,0.0012545885260024934,64,65,COMPLETE
53,53,0.31161817485237914,2023-06-10 16:09:03.778129,2023-06-10 16:09:08.970575,0 days 00:00:05.192446,0.17334046591080016,,10,Lossguide,1031,13.812837807920648,0.0019085977097664283,64,60,COMPLETE
54,54,0.3353615849319648,2023-06-10 16:09:08.971335,2023-06-10 16:09:11.639699,0 days 00:00:02.668364,0.1807821583626502,,10,Lossguide,1028,1.2583177940797343,0.001842141597930306,64,69,COMPLETE
55,55,0.3243141750027163,2023-06-10 16:09:11.644233,2023-06-10 16:09:14.633213,0 days 00:00:02.988980,0.05416823393134122,,9,Lossguide,977,3.9601446907699094,0.00266970879527945,64,52,COMPLETE
56,56,0.3187431941016893,2023-06-10 16:09:14.633832,2023-06-10 16:09:18.190132,0 days 00:00:03.556300,0.31089220796880007,,6,Lossguide,1164,33.87712612528689,0.004097923764117969,10,41,COMPLETE
57,57,0.34372229222277534,2023-06-10 16:09:18.190767,2023-06-10 16:09:19.962807,0 days 00:00:01.772040,0.09322403917150156,,10,Lossguide,616,0.3519161794677519,0.002164337965504234,64,100,COMPLETE
58,58,0.4476337526594796,2023-06-10 16:09:19.963433,2023-06-10 16:09:21.802653,0 days 00:00:01.839220,0.2064723533558169,,10,Lossguide,890,0.5601176338941816,0.0030768216268271266,4,77,COMPLETE
59,59,0.44231571480250687,2023-06-10 16:09:21.803279,2023-06-10 16:09:25.997911,0 days 00:00:04.194632,0.02701435389126414,,9,Lossguide,1059,7.50904739262632,0.0016269081466958385,3,61,COMPLETE
60,60,0.3565572951036902,2023-06-10 16:09:25.998607,2023-06-10 16:09:27.259483,0 days 00:00:01.260876,0.3574363856207653,,10,Lossguide,1176,0.13488825958315462,0.005178102322391001,20,49,COMPLETE
61,61,0.30615136691232325,2023-06-10 16:09:27.260216,2023-06-10 16:09:33.166748,0 days 00:00:05.906532,0.04284094802880079,,10,Lossguide,1125,19.940540412789556,0.0012869914636959327,64,58,COMPLETE
62,62,0.31901747089197796,2023-06-10 16:09:33.167373,2023-06-10 16:09:38.881361,0 days 00:00:05.713988,0.04361978948635926,,10,Lossguide,1126,48.10517738538001,0.0013054968886885023,64,54,COMPLETE
63,63,0.3072402196276107,2023-06-10 16:09:38.882081,2023-06-10 16:09:43.800022,0 days 00:00:04.917941,0.08226497557083104,,10,Lossguide,1028,16.990747507083704,0.00184254155532017,64,65,COMPLETE
64,64,0.30309558527884595,2023-06-10 16:09:43.800754,2023-06-10 16:09:49.361404,0 days 00:00:05.560650,0.010555603203274238,,10,Lossguide,1066,62.03019440406267,0.0024063962414054216,64,66,COMPLETE
65,65,0.3072078958166709,2023-06-10 16:09:49.362104,2023-06-10 16:09:55.098303,0 days 00:00:05.736199,0.012077143221952141,,9,Lossguide,1137,95.488186643836,0.0024924011100667383,64,66,COMPLETE
66,66,0.42565548088966026,2023-06-10 16:09:55.099029,2023-06-10 16:10:00.868098,0 days 00:00:05.769069,0.011978114588561725,,9,Lossguide,1146,95.2894681864342,0.0023367093851766984,2,81,COMPLETE
67,67,0.4297461419951458,2023-06-10 16:10:00.868839,2023-06-10 16:10:37.936350,0 days 00:00:37.067511,0.019870333448615614,Ordered,9,SymmetricTree,1053,71.50447818015627,0.0036881972055416517,64,66,COMPLETE
68,68,0.4202008543554998,2023-06-10 16:10:37.937074,2023-06-10 16:10:40.323672,0 days 00:00:02.386598,0.01029422618905095,,10,Depthwise,985,2.134830638307873,0.002572806470033361,5,71,COMPLETE
69,69,0.3181617391869793,2023-06-10 16:10:40.324296,2023-06-10 16:10:44.473460,0 days 00:00:04.149164,0.025678236224464995,,10,Lossguide,1191,5.795320374877146,0.001750150682874511,64,78,COMPLETE
70,70,0.30105857312408957,2023-06-10 16:10:44.474085,2023-06-10 16:10:47.939704,0 days 00:00:03.465619,0.014878863349685394,,7,Lossguide,1016,47.891310406206735,0.004142784585007697,32,66,COMPLETE
71,71,0.31057959388886236,2023-06-10 16:10:47.940324,2023-06-10 16:10:52.420718,0 days 00:00:04.480394,0.01594137017190094,,7,Lossguide,1015,17.352237450653323,0.002183867332681575,32,66,COMPLETE
72,72,0.29815052644481554,2023-06-10 16:10:52.421304,2023-06-10 16:10:57.657451,0 days 00:00:05.236147,0.03639812704702456,,7,Lossguide,1077,62.249460815818715,0.003007845501592621,32,71,COMPLETE
73,73,0.3010078344440393,2023-06-10 16:10:57.658062,2023-06-10 16:11:01.514405,0 days 00:00:03.856343,0.02238191730962841,,7,Lossguide,1068,51.5197923078987,0.0040681116940166585,32,74,COMPLETE
74,74,0.2988086129674083,2023-06-10 16:11:01.515039,2023-06-10 16:11:05.137333,0 days 00:00:03.622294,0.02051199296950475,,7,Lossguide,946,55.95293567499006,0.004369295275663399,32,86,COMPLETE
75,75,0.2991535157844873,2023-06-10 16:11:05.138135,2023-06-10 16:11:09.219305,0 days 00:00:04.081170,0.014703904190465335,,7,Lossguide,900,56.23116342905558,0.004011566424272052,32,91,COMPLETE
76,76,0.2986488149327084,2023-06-10 16:11:09.219928,2023-06-10 16:11:12.157321,0 days 00:00:02.937393,0.017982266542458967,,7,Lossguide,939,50.911579090744965,0.005785723435809331,32,90,COMPLETE
77,77,0.2985134022890858,2023-06-10 16:11:12.157983,2023-06-10 16:11:15.088125,0 days 00:00:02.930142,0.019883673546278704,,7,Lossguide,901,57.00396459985499,0.0055910414404867215,32,92,COMPLETE
78,78,0.29693219459401643,2023-06-10 16:11:15.089154,2023-06-10 16:11:17.863896,0 days 00:00:02.774742,0.022105674952502416,,7,Lossguide,900,60.08248356080594,0.0057641636645973035,32,92,COMPLETE
79,79,0.2971421855021668,2023-06-10 16:11:17.864504,2023-06-10 16:11:20.763104,0 days 00:00:02.898600,0.020738747713139064,,7,Lossguide,817,52.05871870022903,0.005853154075493269,32,90,COMPLETE
80,80,0.40403519654318015,2023-06-10 16:11:20.763715,2023-06-10 16:11:23.345613,0 days 00:00:02.581898,0.020457048095576462,Plain,7,SymmetricTree,814,50.416763668454685,0.008267742837821793,32,91,COMPLETE
81,81,0.29734589262982364,2023-06-10 16:11:23.346267,2023-06-10 16:11:26.225450,0 days 00:00:02.879183,0.01443705756954692,,7,Lossguide,885,55.08959743560064,0.0057953946343295565,32,90,COMPLETE
82,82,0.3216310362743427,2023-06-10 16:11:26.226118,2023-06-10 16:11:28.416757,0 days 00:00:02.190639,0.018427190340951187,,7,Lossguide,905,9.769316388892072,0.005367830706202548,32,90,COMPLETE
83,83,0.2969362460603725,2023-06-10 16:11:28.417369,2023-06-10 16:11:31.403056,0 days 00:00:02.985687,0.023932871177647346,,7,Lossguide,871,62.47063285709065,0.0060209082311215726,32,95,COMPLETE
84,84,0.3311522218413121,2023-06-10 16:11:31.403694,2023-06-10 16:11:33.107593,0 days 00:00:01.703899,0.014807786029155338,,6,Lossguide,864,5.478815481533554,0.0060696304078731575,32,95,COMPLETE
85,85,0.298086126770303,2023-06-10 16:11:33.108262,2023-06-10 16:11:36.113593,0 days 00:00:03.005331,0.028338127737738826,,8,Lossguide,830,98.84171992683463,0.007745853365931552,32,87,COMPLETE
86,86,0.330013770943542,2023-06-10 16:11:36.114274,2023-06-10 16:11:39.811885,0 days 00:00:03.697611,0.031878793429002225,,8,Depthwise,766,24.310489981093966,0.007034652815206742,32,87,COMPLETE
87,87,0.31422023308177777,2023-06-10 16:11:39.812572,2023-06-10 16:11:42.184397,0 days 00:00:02.371825,0.025957532521491133,,7,Lossguide,828,12.704863624192937,0.004746435078688883,32,95,COMPLETE
88,88,0.30046402815378936,2023-06-10 16:11:42.185109,2023-06-10 16:11:44.674938,0 days 00:00:02.489829,0.023454445965901117,,6,Lossguide,725,90.84130379238945,0.008045732261569231,32,84,COMPLETE
89,89,0.303634111803979,2023-06-10 16:11:44.675639,2023-06-10 16:11:47.117388,0 days 00:00:02.441749,0.03564665798426866,,8,Lossguide,788,26.947745223366415,0.005845601111594642,32,100,COMPLETE
90,90,0.3214337569179757,2023-06-10 16:11:47.118088,2023-06-10 16:11:48.555658,0 days 00:00:01.437570,0.017069742586145558,,7,Lossguide,868,10.010326642536382,0.01062840083402852,32,97,COMPLETE
91,91,0.2985891835519776,2023-06-10 16:11:48.556380,2023-06-10 16:11:51.813847,0 days 00:00:03.257467,0.028931349625541808,,7,Lossguide,837,48.72716618493075,0.004824600912627974,32,89,COMPLETE
92,92,0.2984753980165493,2023-06-10 16:11:51.814560,2023-06-10 16:11:55.516449,0 days 00:00:03.701889,0.030040288869679098,,7,Lossguide,940,59.091063443882874,0.004745452009723527,32,88,COMPLETE
93,93,0.30208071843839396,2023-06-10 16:11:55.517182,2023-06-10 16:11:58.130293,0 days 00:00:02.613111,0.02979316629093813,,7,Lossguide,833,27.988987002495275,0.005056344927743031,32,93,COMPLETE
94,94,0.2984788813660478,2023-06-10 16:11:58.131079,2023-06-10 16:12:01.622755,0 days 00:00:03.491676,0.03859591427920573,,8,Lossguide,882,93.23868652311502,0.006364573882142626,32,89,COMPLETE
95,95,0.30021855023790817,2023-06-10 16:12:01.623641,2023-06-10 16:12:05.056114,0 days 00:00:03.432473,0.05856394769203567,,8,Lossguide,796,89.39894059955995,0.00659038496707471,32,88,COMPLETE
96,96,0.3062213636844693,2023-06-10 16:12:05.056957,2023-06-10 16:12:06.902056,0 days 00:00:01.845099,0.040076098202612466,,8,Lossguide,887,20.757313998313517,0.0077621576490096555,32,84,COMPLETE
97,97,0.3432746178141912,2023-06-10 16:12:06.902694,2023-06-10 16:12:08.432930,0 days 00:00:01.530236,0.049961294467836356,,6,Lossguide,848,4.072172413981799,0.0048282631746522035,32,81,COMPLETE
98,98,0.2980400104931914,2023-06-10 16:12:08.433567,2023-06-10 16:12:10.537582,0 days 00:00:02.104015,0.0291010178465219,,7,Lossguide,914,37.968909355441916,0.009076949117399378,32,97,COMPLETE
99,99,0.3631561650305009,2023-06-10 16:12:10.538232,2023-06-10 16:12:13.402015,0 days 00:00:02.863783,0.03684551409079155,Plain,7,SymmetricTree,913,10.257822524878222,0.00924767769754473,32,97,COMPLETE
100,100,0.3098443920758207,2023-06-10 16:12:13.402683,2023-06-10 16:12:15.494580,0 days 00:00:02.091897,0.024600506907466686,,8,Lossguide,876,19.44448725042393,0.006547622386345239,32,93,COMPLETE
101,101,0.3018975447846405,2023-06-10 16:12:15.495213,2023-06-10 16:12:18.189500,0 days 00:00:02.694287,0.030514765522680103,,7,Lossguide,847,41.85746980821374,0.006014054460229526,32,88,COMPLETE
102,102,0.29521409758092,2023-06-10 16:12:18.190198,2023-06-10 16:12:20.855758,0 days 00:00:02.665560,0.02822424725725564,,7,Lossguide,800,66.19352461816639,0.007303860539378793,32,98,COMPLETE
103,103,0.2956230471655466,2023-06-10 16:12:20.856511,2023-06-10 16:12:23.775717,0 days 00:00:02.919206,0.043651326298118236,,7,Lossguide,812,74.82427949777981,0.007512595903292357,32,98,COMPLETE
104,104,0.29766050088076734,2023-06-10 16:12:23.776424,2023-06-10 16:12:26.784034,0 days 00:00:03.007610,0.05613987897177135,,7,Lossguide,805,96.31822439310987,0.007181374590673307,32,98,COMPLETE
105,105,0.30237255072496516,2023-06-10 16:12:26.784757,2023-06-10 16:12:29.004833,0 days 00:00:02.220076,0.04577745312568707,,7,Lossguide,768,32.996715749687944,0.007371835868816872,32,98,COMPLETE
106,106,0.31800146449486477,2023-06-10 16:12:29.005483,2023-06-10 16:12:30.261988,0 days 00:00:01.256505,0.061285563787799556,,6,Depthwise,753,13.262153390291012,0.00898923858569225,32,95,COMPLETE
107,107,0.3295007449751489,2023-06-10 16:12:30.262654,2023-06-10 16:12:32.708749,0 days 00:00:02.446095,0.04930658346259276,,7,Lossguide,714,96.91395814214663,0.010264857070910492,10,99,COMPLETE
108,108,0.3257371102790253,2023-06-10 16:12:32.709497,2023-06-10 16:12:34.201461,0 days 00:00:01.491964,0.024549229386742796,,7,Lossguide,808,29.742767270220696,0.011978595456557104,20,94,COMPLETE
