,number,value,datetime_start,datetime_complete,duration,params_bagging_temperature,params_boosting_type,params_depth,params_grow_policy,params_iterations,params_l2_leaf_reg,params_learning_rate,params_max_bin,params_random_strength,state
219,219,0.29925928053466333,2023-06-10 16:17:35.810550,2023-06-10 16:17:39.434558,0 days 00:00:03.624008,0.01510739162227343,,7,Lossguide,913,99.3627110737191,0.005872295791774312,32,90,COMPLETE
220,220,0.3665910918940641,2023-06-10 16:17:39.435281,2023-06-10 16:17:52.723215,0 days 00:00:13.287934,0.01957573091749282,Ordered,7,SymmetricTree,882,49.49375880802584,0.021972149310573053,4,98,COMPLETE
221,221,0.29956375875416397,2023-06-10 16:17:52.723932,2023-06-10 16:17:55.577583,0 days 00:00:02.853651,0.06600156461315647,,7,Lossguide,851,68.68434071416029,0.006893115473036985,32,97,COMPLETE
222,222,0.3435067952677724,2023-06-10 16:17:55.578320,2023-06-10 16:17:58.089164,0 days 00:00:02.510844,1.996355440931811,,7,Lossguide,925,42.54090971136322,0.010160655957472724,32,94,COMPLETE
223,223,0.2967985531840221,2023-06-10 16:17:58.089896,2023-06-10 16:18:01.078513,0 days 00:00:02.988617,0.05181440810335332,,7,Lossguide,892,93.99991824623548,0.007598808614136042,32,98,COMPLETE
224,224,0.301016792545653,2023-06-10 16:18:01.079141,2023-06-10 16:18:02.816174,0 days 00:00:01.737033,0.03937450110016046,,7,Lossguide,896,28.389100621950416,0.008177780499552053,32,96,COMPLETE
225,225,0.297792551295225,2023-06-10 16:18:02.816809,2023-06-10 16:18:05.859213,0 days 00:00:03.042404,0.05047516760069897,,7,Lossguide,870,67.2516842311386,0.006546043787771595,32,100,COMPLETE
226,226,0.30053464250722084,2023-06-10 16:18:05.859916,2023-06-10 16:18:07.982634,0 days 00:00:02.122718,0.023622798700722036,,7,Lossguide,897,46.00176100679541,0.007568602055315611,32,95,COMPLETE
227,227,0.4477373967486952,2023-06-10 16:18:07.983369,2023-06-10 16:18:11.639194,0 days 00:00:03.655825,0.03506106338526924,,7,Depthwise,877,99.89231992942597,0.00561743555247683,2,93,COMPLETE
228,228,0.30856508389658266,2023-06-10 16:18:11.639920,2023-06-10 16:18:13.274328,0 days 00:00:01.634408,0.02952393862027639,,7,Lossguide,912,18.20229846645755,0.008778536341616825,32,98,COMPLETE
229,229,0.3768707161328128,2023-06-10 16:18:13.275070,2023-06-10 16:18:18.076514,0 days 00:00:04.801444,4.73546494767845,,7,Lossguide,939,66.43076440123677,0.004806724713527802,32,88,COMPLETE
230,230,0.33641388938647576,2023-06-10 16:18:18.077259,2023-06-10 16:18:18.778964,0 days 00:00:00.701705,0.22825311351026223,,7,Lossguide,856,31.624843894514935,0.29673232038595004,5,91,COMPLETE
231,231,0.29830531292104046,2023-06-10 16:18:18.779709,2023-06-10 16:18:22.131982,0 days 00:00:03.352273,0.054909071214914125,,7,Lossguide,831,97.96330803051156,0.0071121916379543225,32,98,COMPLETE
232,232,0.2978989329091852,2023-06-10 16:18:22.132703,2023-06-10 16:18:24.985022,0 days 00:00:02.852319,0.0713294372534197,,7,Lossguide,803,56.41018758225581,0.0062841554047342995,32,100,COMPLETE
233,233,0.29632325219669464,2023-06-10 16:18:24.985757,2023-06-10 16:18:27.585507,0 days 00:00:02.599750,0.043604242277018535,,7,Lossguide,891,63.25241075574816,0.00784268934013306,32,96,COMPLETE
234,234,0.3044143319163038,2023-06-10 16:18:27.586067,2023-06-10 16:18:29.518706,0 days 00:00:01.932639,0.15765684366048613,,7,Lossguide,885,45.62866097628455,0.0101485687630036,32,95,COMPLETE
235,235,0.3842612732431995,2023-06-10 16:18:29.519352,2023-06-10 16:18:30.517417,0 days 00:00:00.998065,0.04138965952849921,,7,Lossguide,898,0.3711328981716121,0.007973826706760749,32,93,COMPLETE
236,236,0.297352534461281,2023-06-10 16:18:30.517994,2023-06-10 16:18:33.340478,0 days 00:00:02.822484,0.02601235395955373,,7,Lossguide,864,56.28391578971729,0.006038191053042196,32,96,COMPLETE
237,237,0.30020730247127064,2023-06-10 16:18:33.341215,2023-06-10 16:18:35.577148,0 days 00:00:02.235933,0.02687144591650508,,7,Lossguide,863,30.401195590017483,0.006168074116957852,32,97,COMPLETE
238,238,0.30749803630005684,2023-06-10 16:18:35.577782,2023-06-10 16:18:39.154432,0 days 00:00:03.576650,0.41184806014203096,,7,Lossguide,842,95.45301498228723,0.005516963381086485,32,96,COMPLETE
239,239,0.2983283299107582,2023-06-10 16:18:39.155014,2023-06-10 16:18:41.573486,0 days 00:00:02.418472,0.03481100736148306,,7,Lossguide,915,46.84532766129105,0.0071755870096727814,32,98,COMPLETE
240,240,0.3065232401866455,2023-06-10 16:18:41.574040,2023-06-10 16:18:43.248555,0 days 00:00:01.674515,0.09572100953595637,,7,Lossguide,966,21.557289081430476,0.00877338265802951,32,95,COMPLETE
241,241,0.2826083374306789,2023-06-10 16:18:43.249179,2023-06-10 16:18:44.066500,0 days 00:00:00.817321,0.021076754255340335,,7,Lossguide,876,64.15200522007298,0.11250599013460064,32,94,COMPLETE
242,242,0.29618472937056256,2023-06-10 16:18:44.067052,2023-06-10 16:18:46.940129,0 days 00:00:02.873077,0.02419920993589009,,7,Lossguide,869,66.8291143934801,0.006553842862914315,32,94,COMPLETE
243,243,0.2978723822066688,2023-06-10 16:18:46.940748,2023-06-10 16:18:49.637768,0 days 00:00:02.697020,0.025595421829708337,,7,Lossguide,858,60.52674144991401,0.0065860454858547935,32,94,COMPLETE
244,244,0.300958070216369,2023-06-10 16:18:49.638355,2023-06-10 16:18:50.593603,0 days 00:00:00.955248,0.023041434739080727,,7,Lossguide,867,38.968633783126094,0.04672739865201696,32,96,COMPLETE
245,245,0.2971003699909489,2023-06-10 16:18:50.594232,2023-06-10 16:18:51.414165,0 days 00:00:00.819933,0.02921894569547957,,7,Lossguide,828,65.73118002180082,0.09723108956903297,32,100,COMPLETE
246,246,0.5136989669064321,2023-06-10 16:18:51.414793,2023-06-10 16:18:52.125425,0 days 00:00:00.710632,0.04694990469052713,,7,Lossguide,835,0.009296049288234924,0.12103464395043734,32,99,COMPLETE
247,247,0.40739760881114795,2023-06-10 16:18:52.126085,2023-06-10 16:18:52.834224,0 days 00:00:00.708139,0.03237114585897747,,7,Lossguide,829,0.16541510682837018,0.1551693197365925,32,100,COMPLETE
248,248,0.5352608672794378,2023-06-10 16:18:52.834940,2023-06-10 16:18:53.550710,0 days 00:00:00.715770,0.019327166100512532,,7,Lossguide,849,3.4414077336596436e-05,0.11351438512168788,32,98,COMPLETE
249,249,0.3035164346657757,2023-06-10 16:18:53.551378,2023-06-10 16:18:54.801641,0 days 00:00:01.250263,0.04115046214021337,,7,Lossguide,815,35.296096764143364,0.017358336501766256,32,100,COMPLETE
250,250,0.2976532884644575,2023-06-10 16:18:54.802283,2023-06-10 16:18:55.639246,0 days 00:00:00.836963,0.12076830717100495,,7,Lossguide,931,65.95631005527596,0.07576347321129011,32,97,COMPLETE
251,251,0.3362701572022957,2023-06-10 16:18:55.639951,2023-06-10 16:18:56.804376,0 days 00:00:01.164425,0.032091945903795424,,7,Lossguide,902,1.337022435955645,0.007488625481484399,10,93,COMPLETE
252,252,0.3022283111012775,2023-06-10 16:18:56.804963,2023-06-10 16:18:58.507720,0 days 00:00:01.702757,0.02479187940983861,,7,Lossguide,859,45.84770279947573,0.011738267837975462,32,97,COMPLETE
253,253,0.3810482868381663,2023-06-10 16:18:58.508273,2023-06-10 16:18:59.432986,0 days 00:00:00.924713,0.34370085057647964,,7,Lossguide,821,0.056411237710080775,0.00918602915465604,32,98,COMPLETE
254,254,0.3066388265984193,2023-06-10 16:18:59.433623,2023-06-10 16:19:02.969230,0 days 00:00:03.535607,0.604874036849529,,7,Lossguide,894,66.29578436015618,0.006579909446415482,32,94,COMPLETE
255,255,0.3035036455032795,2023-06-10 16:19:02.969919,2023-06-10 16:19:03.988199,0 days 00:00:01.018280,0.020050390018730543,,7,Lossguide,842,24.889948573665166,0.029492909956322717,32,92,COMPLETE
256,256,0.41609090798979137,2023-06-10 16:19:03.988813,2023-06-10 16:19:05.719248,0 days 00:00:01.730435,0.03754992830020477,Plain,7,SymmetricTree,955,0.9081361697894412,0.00819351580979784,32,100,COMPLETE
257,257,0.36374969650328665,2023-06-10 16:19:05.719862,2023-06-10 16:19:09.657319,0 days 00:00:03.937457,0.01654975986800908,,7,Lossguide,925,97.69020409051402,0.0061111540252599674,3,96,COMPLETE
258,258,0.33370558602487527,2023-06-10 16:19:09.657932,2023-06-10 16:19:11.446570,0 days 00:00:01.788638,0.029060949058510924,,7,Lossguide,870,13.786725680682702,0.0074369499524117155,20,0,COMPLETE
259,259,0.2993703926786912,2023-06-10 16:19:11.447299,2023-06-10 16:19:13.249168,0 days 00:00:01.801869,0.022253502802820454,,7,Lossguide,793,37.82785072039202,0.009473219887548477,32,95,COMPLETE
260,260,0.4560243607616641,2023-06-10 16:19:13.249922,2023-06-10 16:19:16.096031,0 days 00:00:02.846109,23.397179428531437,,7,Depthwise,910,98.30918638177835,0.006820953523713843,32,92,COMPLETE
261,261,0.3714339854564712,2023-06-10 16:19:16.096759,2023-06-10 16:19:17.665958,0 days 00:00:01.569199,0.05429952405611433,,5,Lossguide,886,58.55804470526311,0.012971665953196274,4,98,COMPLETE
262,262,0.3030331652393435,2023-06-10 16:19:17.666707,2023-06-10 16:19:19.335453,0 days 00:00:01.668746,0.029480903845695215,,7,Lossguide,853,28.26427849619831,0.010627248676537462,32,90,COMPLETE
263,263,0.29636755482852206,2023-06-10 16:19:19.336164,2023-06-10 16:19:22.283962,0 days 00:00:02.947798,0.043280577269222235,,7,Lossguide,817,63.86663493081384,0.005980649379490081,32,100,COMPLETE
264,264,0.4371541086991891,2023-06-10 16:19:22.284725,2023-06-10 16:19:23.266173,0 days 00:00:00.981448,0.04709768181981165,,7,Lossguide,776,0.03702460580234825,0.00787966742711562,32,100,COMPLETE
265,265,0.4244804346067332,2023-06-10 16:19:23.266912,2023-06-10 16:19:26.041144,0 days 00:00:02.774232,0.04141583820727658,,7,Lossguide,817,47.49659340882248,0.005908454653582585,2,98,COMPLETE
266,266,0.310200462923404,2023-06-10 16:19:26.041760,2023-06-10 16:19:26.787072,0 days 00:00:00.745312,0.03732412661389953,,7,Lossguide,797,17.374643849428345,0.22142480331507836,32,100,COMPLETE
267,267,0.3007990736273015,2023-06-10 16:19:26.787717,2023-06-10 16:19:30.330791,0 days 00:00:03.543074,0.2091866485140516,,7,Lossguide,945,99.4333079668505,0.007004622991951611,32,97,COMPLETE
268,268,0.5195696348951359,2023-06-10 16:19:30.331429,2023-06-10 16:19:31.114370,0 days 00:00:00.782941,0.06361907169468632,,7,Lossguide,829,0.00018232247452607664,0.008170892889614997,32,96,COMPLETE
269,269,0.46731045783214625,2023-06-10 16:19:31.114905,2023-06-10 16:19:31.972087,0 days 00:00:00.857182,0.032195868660729904,,7,Lossguide,903,5.508876349591934e-06,0.005096374653438273,5,93,COMPLETE
270,270,0.4973375108141187,2023-06-10 16:19:31.972693,2023-06-10 16:19:32.811446,0 days 00:00:00.838753,0.05076578650482445,,7,Lossguide,974,0.001738398301836704,0.005996593825558464,32,98,COMPLETE
271,271,0.34585822611311057,2023-06-10 16:19:32.812060,2023-06-10 16:19:33.613439,0 days 00:00:00.801379,0.9498975587020017,,7,Lossguide,872,42.40168992721408,0.0783709680114402,32,88,COMPLETE
272,272,0.3347301907222272,2023-06-10 16:19:33.614034,2023-06-10 16:19:34.783444,0 days 00:00:01.169410,0.02528813910806373,,7,Lossguide,927,4.267872003224681,0.009903868181648748,32,100,COMPLETE
273,273,0.2966029044041012,2023-06-10 16:19:34.784036,2023-06-10 16:19:37.612958,0 days 00:00:02.828922,0.08647162047216404,,7,Lossguide,809,64.64604219281995,0.0067935099356611515,32,94,COMPLETE
274,274,0.32920179133862043,2023-06-10 16:19:37.613634,2023-06-10 16:19:38.980693,0 days 00:00:01.367059,0.06246347426070123,,7,Lossguide,745,7.171842483460018,0.0087727390261749,32,96,COMPLETE
275,275,0.30707280127415104,2023-06-10 16:19:38.981382,2023-06-10 16:19:41.060128,0 days 00:00:02.078746,0.07230504868595806,,7,Lossguide,780,24.632290539069803,0.007333010310687752,32,94,COMPLETE
276,276,0.2974795808633103,2023-06-10 16:19:41.060817,2023-06-10 16:19:43.947336,0 days 00:00:02.886519,0.04471894874043017,,7,Lossguide,818,66.09243218517778,0.006541481505378449,32,98,COMPLETE
277,277,0.29756605313574497,2023-06-10 16:19:43.947980,2023-06-10 16:19:47.285941,0 days 00:00:03.337961,0.03735616406144874,,7,Lossguide,808,99.74034046968592,0.007468184326972563,32,96,COMPLETE
278,278,0.302509275218489,2023-06-10 16:19:47.286565,2023-06-10 16:19:51.745344,0 days 00:00:04.458779,0.0884992128027045,Ordered,7,SymmetricTree,838,34.818283786278755,0.09040719262767877,32,100,COMPLETE
279,279,0.34286802101279634,2023-06-10 16:19:51.746112,2023-06-10 16:19:52.887471,0 days 00:00:01.141359,1.1577652692051288,,7,Lossguide,795,61.47072706829142,0.06167570394816846,32,94,COMPLETE
280,280,0.29659488367612363,2023-06-10 16:19:52.888090,2023-06-10 16:19:55.023081,0 days 00:00:02.134991,0.05524444384907015,,7,Lossguide,762,41.40173492401618,0.008438297804187155,32,91,COMPLETE
281,281,0.3248171357140199,2023-06-10 16:19:55.023688,2023-06-10 16:19:56.853998,0 days 00:00:01.830310,0.05497711361404814,,7,Lossguide,760,31.351458967176647,0.00902378126794959,10,85,COMPLETE
282,282,0.3262669246084535,2023-06-10 16:19:56.854674,2023-06-10 16:19:59.740416,0 days 00:00:02.885742,0.048814194795542554,,7,Depthwise,719,99.66574092194996,0.011069606716152184,32,90,COMPLETE
283,283,0.3080706775206841,2023-06-10 16:19:59.741013,2023-06-10 16:20:01.529891,0 days 00:00:01.788878,0.07023242164005325,,7,Lossguide,789,21.821998285731336,0.008204978119833735,32,88,COMPLETE
284,284,0.30031875523943774,2023-06-10 16:20:01.530544,2023-06-10 16:20:03.319040,0 days 00:00:01.788496,0.03440676379256663,,7,Lossguide,997,42.198070675784706,0.010006783803335034,32,91,COMPLETE
285,285,0.3294135514313575,2023-06-10 16:20:03.319655,2023-06-10 16:20:05.144119,0 days 00:00:01.824464,0.07902640087730754,,7,Lossguide,806,14.513695009278987,0.006822377519499634,20,38,COMPLETE
286,286,0.2990891852430551,2023-06-10 16:20:05.144735,2023-06-10 16:20:07.515596,0 days 00:00:02.370861,0.04307462632134918,,6,Lossguide,765,70.58793009220872,0.008325037274950991,32,93,COMPLETE
287,287,0.3963305918147097,2023-06-10 16:20:07.516329,2023-06-10 16:20:08.361393,0 days 00:00:00.845064,0.030096475671460232,,7,Lossguide,774,0.19724175445332787,0.014671406519975408,32,98,COMPLETE
288,288,0.4807398894820416,2023-06-10 16:20:08.362136,2023-06-10 16:20:09.199774,0 days 00:00:00.837638,0.06279487304868929,,7,Lossguide,823,0.004973532629656834,0.007739792922254294,32,92,COMPLETE
289,289,0.2984387462532011,2023-06-10 16:20:09.200483,2023-06-10 16:20:12.720287,0 days 00:00:03.519804,0.05352975158406161,,7,Lossguide,831,43.35657517042771,0.004631420056733944,32,94,COMPLETE
290,290,0.524647991157516,2023-06-10 16:20:12.721066,2023-06-10 16:20:13.792999,0 days 00:00:01.071933,0.012988775250805005,,7,Lossguide,808,0.5539562901266187,0.0053248187493984255,3,98,COMPLETE
291,291,0.40273352176525046,2023-06-10 16:20:13.793704,2023-06-10 16:20:14.912554,0 days 00:00:01.118850,0.10457361163896665,,7,Lossguide,847,0.10280680816056084,0.0066538127597576616,32,90,COMPLETE
292,292,0.30075798207677107,2023-06-10 16:20:14.913177,2023-06-10 16:20:15.705456,0 days 00:00:00.792279,0.03725769002072738,,7,Lossguide,737,66.15034061509218,0.11386294397679668,32,100,COMPLETE
293,293,0.39300397831779255,2023-06-10 16:20:15.706210,2023-06-10 16:20:17.292711,0 days 00:00:01.586501,0.04131644749996212,,7,Lossguide,890,32.869663967926556,0.009746745126867842,4,87,COMPLETE
294,294,0.2957682084252877,2023-06-10 16:20:17.293317,2023-06-10 16:20:19.452595,0 days 00:00:02.159278,0.029267272532029653,,7,Lossguide,919,98.31540087036103,0.012841336159622355,32,96,COMPLETE
295,295,0.29674222694496555,2023-06-10 16:20:19.453200,2023-06-10 16:20:21.707258,0 days 00:00:02.254058,0.031332047456116716,,7,Lossguide,925,99.04504108956851,0.011384419673567361,32,96,COMPLETE
296,296,0.2984819298189637,2023-06-10 16:20:21.707862,2023-06-10 16:20:23.530827,0 days 00:00:01.822965,0.02989117540595776,,7,Lossguide,939,57.88073079529817,0.011865202424392877,32,96,COMPLETE
297,297,0.2978171529836786,2023-06-10 16:20:23.531428,2023-06-10 16:20:25.745248,0 days 00:00:02.213820,0.024617593339136778,,7,Lossguide,952,98.17297823914201,0.01339498668478006,32,98,COMPLETE
298,298,0.5867941828673492,2023-06-10 16:20:25.745917,2023-06-10 16:20:26.502084,0 days 00:00:00.756167,0.032491499357190715,,7,Lossguide,916,0.010847857594092057,0.011039086025012627,2,95,COMPLETE
299,299,0.31880602204312153,2023-06-10 16:20:26.502690,2023-06-10 16:20:27.848516,0 days 00:00:01.345826,0.027504438894211086,,7,Lossguide,923,11.082396437180687,0.010767693039927171,32,13,COMPLETE
300,300,0.344708530633963,2023-06-10 16:20:27.849265,2023-06-10 16:20:29.601602,0 days 00:00:01.752337,0.02254486858850514,,7,Lossguide,971,65.5740325385061,0.011681520090109447,5,97,COMPLETE
301,301,0.40501870176312615,2023-06-10 16:20:29.602250,2023-06-10 16:20:30.836092,0 days 00:00:01.233842,0.03573652864710365,Plain,7,SymmetricTree,943,1.4196462738931357,0.016092900147701716,32,100,COMPLETE
302,302,0.3077350971769657,2023-06-10 16:20:30.836726,2023-06-10 16:20:31.766510,0 days 00:00:00.929784,0.028841551279549002,,7,Lossguide,911,23.783949618699207,0.03877462023369018,32,95,COMPLETE
303,303,0.4034779626041356,2023-06-10 16:20:31.767160,2023-06-10 16:20:32.655112,0 days 00:00:00.887952,1.594520058390337,,7,Lossguide,929,0.002501556960804274,0.012893078765669669,32,98,COMPLETE
304,304,0.3100376663617847,2023-06-10 16:20:32.655722,2023-06-10 16:20:33.425381,0 days 00:00:00.769659,0.018816600066101134,,7,Lossguide,897,41.03588544018193,0.13467483196105182,32,94,COMPLETE
305,305,0.4204947376701623,2023-06-10 16:20:33.425953,2023-06-10 16:20:34.325577,0 days 00:00:00.899624,2.702272530790433,,7,Depthwise,875,2.544286202096823e-08,0.009283292558702052,32,96,COMPLETE
306,306,0.40573478985371314,2023-06-10 16:20:34.326209,2023-06-10 16:20:35.154589,0 days 00:00:00.828380,0.2524861532634522,,7,Lossguide,456,0.012113594470155257,0.01219205325672933,32,98,COMPLETE
307,307,0.29616281693444124,2023-06-10 16:20:35.155189,2023-06-10 16:20:37.464764,0 days 00:00:02.309575,0.0439663370517711,,7,Lossguide,967,62.90921163896143,0.00875181770601338,32,100,COMPLETE
308,308,0.29604185004390265,2023-06-10 16:20:37.465385,2023-06-10 16:20:39.648370,0 days 00:00:02.182985,0.04208310624267557,,7,Lossguide,964,45.14388152407437,0.009028369817408502,32,100,COMPLETE
309,309,0.39470014752372695,2023-06-10 16:20:39.648978,2023-06-10 16:20:40.565136,0 days 00:00:00.916158,0.044689842595258274,,7,Lossguide,987,0.26184995179062337,0.009081891159675903,32,99,COMPLETE
310,310,0.5068728773291665,2023-06-10 16:20:40.565835,2023-06-10 16:20:41.364311,0 days 00:00:00.798476,0.04258669751781094,,7,Lossguide,1013,0.0008723683706564205,0.010042714287789026,32,100,COMPLETE
311,311,0.30254370178645085,2023-06-10 16:20:41.365063,2023-06-10 16:20:43.168229,0 days 00:00:01.803166,0.05721012544343535,,7,Lossguide,958,30.2690802378482,0.00921740568467891,32,100,COMPLETE
312,312,0.32539075710623916,2023-06-10 16:20:43.168899,2023-06-10 16:20:44.677968,0 days 00:00:01.509069,0.12254289313778402,,7,Lossguide,996,7.562193550327878,0.008527492035025761,32,97,COMPLETE
313,313,0.32559511266081426,2023-06-10 16:20:44.678597,2023-06-10 16:20:46.692750,0 days 00:00:02.014153,0.1810886899622896,,7,Lossguide,696,47.918399764698655,0.010413940293601326,10,100,COMPLETE
314,314,0.33284015297078495,2023-06-10 16:20:46.693397,2023-06-10 16:20:47.977514,0 days 00:00:01.284117,0.4011302518417825,,7,Lossguide,976,1.8427429633035348,0.008105384670064764,32,98,COMPLETE
315,315,0.33480672001535605,2023-06-10 16:20:47.978189,2023-06-10 16:20:49.106191,0 days 00:00:01.128002,0.03674364860094339,,7,Lossguide,934,17.000887651972246,0.019141526701236398,20,97,COMPLETE
316,316,0.29825987151295974,2023-06-10 16:20:49.106814,2023-06-10 16:20:50.923109,0 days 00:00:01.816295,0.05135945980136062,,7,Lossguide,970,63.73808886791143,0.012342102221176491,32,100,COMPLETE
317,317,0.30077816134256896,2023-06-10 16:20:50.923787,2023-06-10 16:20:52.427723,0 days 00:00:01.503936,0.13792547811084602,,7,Lossguide,909,37.959548038125455,0.013731337366854024,32,96,COMPLETE
318,318,0.2964660719274075,2023-06-10 16:20:52.428361,2023-06-10 16:20:53.545635,0 days 00:00:01.117274,0.04447321604472369,,8,Lossguide,956,66.13586351345135,0.03271292988678491,32,97,COMPLETE
319,319,0.31036463487389754,2023-06-10 16:20:53.546242,2023-06-10 16:20:54.343369,0 days 00:00:00.797127,0.045206456137482705,,7,Lossguide,962,19.619143903711976,0.09254531925824454,32,98,COMPLETE
320,320,0.39232562340767196,2023-06-10 16:20:54.343951,2023-06-10 16:20:55.102388,0 days 00:00:00.758437,0.03837664135250168,,8,Lossguide,953,0.07553642455174962,0.052214227012161156,32,96,COMPLETE
321,321,0.2986453351420175,2023-06-10 16:20:55.103005,2023-06-10 16:20:55.926642,0 days 00:00:00.823637,0.06256838695527193,,8,Lossguide,1033,71.32404955448094,0.09788640645495282,32,98,COMPLETE
322,322,0.38399616866840597,2023-06-10 16:20:55.927307,2023-06-10 16:20:57.054402,0 days 00:00:01.127095,0.0461893633571483,,8,Lossguide,937,99.02277124427236,0.03632011403328992,4,100,COMPLETE
323,323,0.6323380540654253,2023-06-10 16:20:57.055097,2023-06-10 16:20:57.783963,0 days 00:00:00.728866,96.8951785590378,,7,Lossguide,989,44.08951676705117,0.16009896700541254,32,96,COMPLETE
324,324,0.37977561996695774,2023-06-10 16:20:57.784763,2023-06-10 16:20:58.655171,0 days 00:00:00.870408,0.033335039492577406,,6,Lossguide,921,31.339070546617567,0.06201900985699468,3,98,COMPLETE
325,325,0.36403897948677183,2023-06-10 16:20:58.656012,2023-06-10 16:21:01.634318,0 days 00:00:02.978306,0.08220513311943609,Plain,7,SymmetricTree,950,64.39794490410256,0.011131150321895357,32,94,COMPLETE
326,326,0.3457244346544646,2023-06-10 16:21:01.634972,2023-06-10 16:21:02.484331,0 days 00:00:00.849359,0.054242262724198825,,7,Lossguide,970,3.0971675370803426,0.025945122162093538,32,100,COMPLETE
327,327,0.581746581608257,2023-06-10 16:21:02.484940,2023-06-10 16:21:03.217104,0 days 00:00:00.732164,0.03550024707893812,,7,Lossguide,900,0.015591009633981261,0.016274470944441063,2,97,COMPLETE
328,328,0.4489102923421826,2023-06-10 16:21:03.217839,2023-06-10 16:21:04.168975,0 days 00:00:00.951136,0.04096176451458069,,7,Lossguide,757,0.03817973976693254,0.009944550024354756,32,95,COMPLETE
